"No.","Time","Source","Destination","Protocol","Length","Info"
"1","0.000000","192.168.1.107","8.8.8.8","DNS","81","Standard query 0x4d6e A www.oceanicrealty.com"
"2","0.118794","8.8.8.8","192.168.1.107","DNS","111","Standard query response 0x4d6e A www.oceanicrealty.com CNAME oceanicrealty.com A 74.86.13.168"
"3","0.119969","192.168.1.107","74.86.13.168","TCP","66","49166  >  80 [SYN] Seq=0 Win=8192 Len=0 MSS=1460 WS=4 SACK_PERM"
"4","0.154073","74.86.13.168","192.168.1.107","TCP","66","80  >  49166 [SYN, ACK] Seq=0 Ack=1 Win=5840 Len=0 MSS=1460 SACK_PERM WS=256"
"5","0.154083","192.168.1.107","74.86.13.168","TCP","60","49166  >  80 [ACK] Seq=1 Ack=1 Win=65700 Len=0"
"6","0.154515","192.168.1.107","74.86.13.168","HTTP","791","GET /Vacation_Rental_Pages/75%20Wharf%20Road.htm HTTP/1.1 "
"7","0.175285","74.86.13.168","192.168.1.107","TCP","60","80  >  49166 [ACK] Seq=1 Ack=738 Win=7424 Len=0"
"8","0.187801","74.86.13.168","192.168.1.107","TCP","1514","80  >  49166 [ACK] Seq=1 Ack=738 Win=7424 Len=1460 [TCP segment of a reassembled PDU]"
"9","0.188011","74.86.13.168","192.168.1.107","TCP","1514","80  >  49166 [ACK] Seq=1461 Ack=738 Win=7424 Len=1460 [TCP segment of a reassembled PDU]"
"10","0.188016","192.168.1.107","74.86.13.168","TCP","60","49166  >  80 [ACK] Seq=738 Ack=2921 Win=65700 Len=0"
"11","0.192176","192.168.1.107","74.86.13.168","TCP","66","49167  >  80 [SYN] Seq=0 Win=8192 Len=0 MSS=1460 WS=4 SACK_PERM"
"12","0.212686","74.86.13.168","192.168.1.107","TCP","1514","80  >  49166 [ACK] Seq=2921 Ack=738 Win=7424 Len=1460 [TCP segment of a reassembled PDU]"
"13","0.212964","74.86.13.168","192.168.1.107","TCP","1514","80  >  49166 [ACK] Seq=4381 Ack=738 Win=7424 Len=1460 [TCP segment of a reassembled PDU]"
"14","0.212969","192.168.1.107","74.86.13.168","TCP","60","49166  >  80 [ACK] Seq=738 Ack=5841 Win=65700 Len=0"
"15","0.214802","74.86.13.168","192.168.1.107","TCP","1514","80  >  49166 [ACK] Seq=5841 Ack=738 Win=7424 Len=1460 [TCP segment of a reassembled PDU]"
"16","0.235345","74.86.13.168","192.168.1.107","TCP","1514","80  >  49166 [ACK] Seq=7301 Ack=738 Win=7424 Len=1460 [TCP segment of a reassembled PDU]"
"17","0.235355","74.86.13.168","192.168.1.107","TCP","1514","80  >  49166 [ACK] Seq=8761 Ack=738 Win=7424 Len=1460 [TCP segment of a reassembled PDU]"
"18","0.235359","192.168.1.107","74.86.13.168","TCP","60","49166  >  80 [ACK] Seq=738 Ack=8761 Win=65700 Len=0"
"19","0.235361","74.86.13.168","192.168.1.107","TCP","66","80  >  49167 [SYN, ACK] Seq=0 Ack=1 Win=5840 Len=0 MSS=1460 SACK_PERM WS=256"
"20","0.235544","192.168.1.107","74.86.13.168","TCP","60","49167  >  80 [ACK] Seq=1 Ack=1 Win=65700 Len=0"
"21","0.235792","192.168.1.107","74.86.13.168","HTTP","472","GET /images/CLIPS/spacer.gif HTTP/1.1 "
"22","0.236285","74.86.13.168","192.168.1.107","TCP","1514","80  >  49166 [ACK] Seq=10221 Ack=738 Win=7424 Len=1460 [TCP segment of a reassembled PDU]"
"23","0.236290","192.168.1.107","74.86.13.168","TCP","60","49166  >  80 [ACK] Seq=738 Ack=11681 Win=65700 Len=0"
"24","0.237675","192.168.1.107","74.86.13.168","TCP","66","49168  >  80 [SYN] Seq=0 Win=8192 Len=0 MSS=1460 WS=4 SACK_PERM"
"25","0.237685","192.168.1.107","74.86.13.168","TCP","66","49169  >  80 [SYN] Seq=0 Win=8192 Len=0 MSS=1460 WS=4 SACK_PERM"
"26","0.237982","192.168.1.107","74.86.13.168","TCP","66","49170  >  80 [SYN] Seq=0 Win=8192 Len=0 MSS=1460 WS=4 SACK_PERM"
"27","0.262326","74.86.13.168","192.168.1.107","TCP","1514","80  >  49166 [ACK] Seq=11681 Ack=738 Win=7424 Len=1460 [TCP segment of a reassembled PDU]"
"28","0.262337","74.86.13.168","192.168.1.107","TCP","1514","80  >  49166 [ACK] Seq=13141 Ack=738 Win=7424 Len=1460 [TCP segment of a reassembled PDU]"
"29","0.262515","74.86.13.168","192.168.1.107","TCP","1514","80  >  49166 [ACK] Seq=14601 Ack=738 Win=7424 Len=1460 [TCP segment of a reassembled PDU]"
"30","0.262520","192.168.1.107","74.86.13.168","TCP","60","49166  >  80 [ACK] Seq=738 Ack=14601 Win=65700 Len=0"
"31","0.263178","74.86.13.168","192.168.1.107","TCP","1514","80  >  49166 [ACK] Seq=16061 Ack=738 Win=7424 Len=1460 [TCP segment of a reassembled PDU]"
"32","0.263422","74.86.13.168","192.168.1.107","TCP","1514","80  >  49166 [ACK] Seq=17521 Ack=738 Win=7424 Len=1460 [TCP segment of a reassembled PDU]"
"33","0.263424","192.168.1.107","74.86.13.168","TCP","60","49166  >  80 [ACK] Seq=738 Ack=17521 Win=65700 Len=0"
"34","0.263424","74.86.13.168","192.168.1.107","TCP","1514","80  >  49166 [ACK] Seq=18981 Ack=738 Win=7424 Len=1460 [TCP segment of a reassembled PDU]"
"35","0.263426","74.86.13.168","192.168.1.107","TCP","60","80  >  49167 [ACK] Seq=1 Ack=419 Win=6912 Len=0"
"36","0.263426","192.168.1.107","74.86.13.168","TCP","60","49166  >  80 [ACK] Seq=738 Ack=20441 Win=65700 Len=0"
"37","0.264496","192.168.1.107","74.86.13.168","TCP","66","49171  >  80 [SYN] Seq=0 Win=8192 Len=0 MSS=1460 WS=4 SACK_PERM"
"38","0.270362","74.86.13.168","192.168.1.107","TCP","66","80  >  49168 [SYN, ACK] Seq=0 Ack=1 Win=5840 Len=0 MSS=1460 SACK_PERM WS=256"
"39","0.270370","192.168.1.107","74.86.13.168","TCP","60","49168  >  80 [ACK] Seq=1 Ack=1 Win=65700 Len=0"
"40","0.270623","192.168.1.107","74.86.13.168","HTTP","472","GET /images/CLIPS/Surfer.gif HTTP/1.1 "
"41","0.282148","74.86.13.168","192.168.1.107","HTTP","656","HTTP/1.1 200 OK  (text/html)"
"42","0.282499","192.168.1.107","74.86.13.168","HTTP","474","GET /images/CLIPS/arw_rest.gif HTTP/1.1 "
"43","0.288208","74.86.13.168","192.168.1.107","TCP","66","80  >  49169 [SYN, ACK] Seq=0 Ack=1 Win=5840 Len=0 MSS=1460 SACK_PERM WS=256"
"44","0.288218","192.168.1.107","74.86.13.168","TCP","60","49169  >  80 [ACK] Seq=1 Ack=1 Win=65700 Len=0"
"45","0.288431","192.168.1.107","74.86.13.168","HTTP","470","GET /images/CLIPS/cor2.gif HTTP/1.1 "
"46","0.289198","74.86.13.168","192.168.1.107","HTTP","338","HTTP/1.1 200 OK  (GIF89a)"
"47","0.290127","192.168.1.107","74.86.13.168","HTTP","490","GET /holiday/images/feat_hubbtn_wc_01-over.gif HTTP/1.1 "
"48","0.295960","74.86.13.168","192.168.1.107","TCP","66","80  >  49170 [SYN, ACK] Seq=0 Ack=1 Win=5840 Len=0 MSS=1460 SACK_PERM WS=256"
"49","0.295970","192.168.1.107","74.86.13.168","TCP","60","49170  >  80 [ACK] Seq=1 Ack=1 Win=65700 Len=0"
"50","0.296182","192.168.1.107","74.86.13.168","HTTP","512","GET /images/Stinson_Beach_Proper/75%20Wharf%20Road/balcony_small.jpg HTTP/1.1 "
"51","0.314743","74.86.13.168","192.168.1.107","TCP","66","80  >  49171 [SYN, ACK] Seq=0 Ack=1 Win=5840 Len=0 MSS=1460 SACK_PERM WS=256"
"52","0.314753","192.168.1.107","74.86.13.168","TCP","60","49171  >  80 [ACK] Seq=1 Ack=1 Win=65700 Len=0"
"53","0.314968","192.168.1.107","74.86.13.168","HTTP","485","GET /holiday/images/feat_hubbtn_wc_01.gif HTTP/1.1 "
"54","0.322405","74.86.13.168","192.168.1.107","TCP","60","80  >  49168 [ACK] Seq=1 Ack=419 Win=6912 Len=0"
"55","0.323630","74.86.13.168","192.168.1.107","TCP","1514","80  >  49168 [ACK] Seq=1 Ack=419 Win=6912 Len=1460 [TCP segment of a reassembled PDU]"
"56","0.323979","74.86.13.168","192.168.1.107","TCP","1514","80  >  49168 [ACK] Seq=1461 Ack=419 Win=6912 Len=1460 [TCP segment of a reassembled PDU]"
"57","0.323984","192.168.1.107","74.86.13.168","TCP","60","49168  >  80 [ACK] Seq=419 Ack=2921 Win=65700 Len=0"
"58","0.324746","74.86.13.168","192.168.1.107","HTTP","612","HTTP/1.1 404 Not Found  (text/html)"
"59","0.324756","74.86.13.168","192.168.1.107","HTTP","347","HTTP/1.1 200 OK  (GIF89a)"
"60","0.324759","74.86.13.168","192.168.1.107","TCP","60","80  >  49169 [ACK] Seq=1 Ack=417 Win=6912 Len=0"
"61","0.324990","74.86.13.168","192.168.1.107","HTTP","405","HTTP/1.1 200 OK  (GIF89a)"
"62","0.324995","74.86.13.168","192.168.1.107","TCP","60","80  >  49170 [ACK] Seq=1 Ack=459 Win=6912 Len=0"
"63","0.325300","192.168.1.107","74.86.13.168","HTTP","518","GET /images/Stinson_Beach_Proper/75%20Wharf%20Road/Dining%20room_small.jpg HTTP/1.1 "
"64","0.325303","192.168.1.107","74.86.13.168","HTTP","512","GET /images/Stinson_Beach_Proper/75%20Wharf%20Road/bedroom_small.jpg HTTP/1.1 "
"65","0.325305","192.168.1.107","74.86.13.168","HTTP","518","GET /images/Stinson_Beach_Proper/75%20Wharf%20Road/Living%20room_small.jpg HTTP/1.1 "
"66","0.325550","74.86.13.168","192.168.1.107","HTTP","631","HTTP/1.1 404 Not Found  (text/html)"
"67","0.335197","74.86.13.168","192.168.1.107","TCP","60","80  >  49171 [ACK] Seq=1 Ack=432 Win=6912 Len=0"
"68","0.382434","74.86.13.168","192.168.1.107","TCP","1514","80  >  49168 [ACK] Seq=2921 Ack=419 Win=6912 Len=1460 [TCP segment of a reassembled PDU]"
"69","0.382805","74.86.13.168","192.168.1.107","TCP","1514","80  >  49168 [ACK] Seq=4381 Ack=419 Win=6912 Len=1460 [TCP segment of a reassembled PDU]"
"70","0.382810","192.168.1.107","74.86.13.168","TCP","60","49168  >  80 [ACK] Seq=419 Ack=5841 Win=65700 Len=0"
"71","0.383886","74.86.13.168","192.168.1.107","TCP","1514","80  >  49168 [ACK] Seq=5841 Ack=419 Win=6912 Len=1460 [TCP segment of a reassembled PDU]"
"72","0.383896","74.86.13.168","192.168.1.107","HTTP","634","HTTP/1.1 404 Not Found  (text/html)"
"73","0.383898","74.86.13.168","192.168.1.107","HTTP","630","HTTP/1.1 404 Not Found  (text/html)"
"74","0.387673","74.86.13.168","192.168.1.107","HTTP","634","HTTP/1.1 404 Not Found  (text/html)"
"75","0.427420","74.86.13.168","192.168.1.107","HTTP","608","HTTP/1.1 404 Not Found  (text/html)"
"76","0.436506","74.86.13.168","192.168.1.107","TCP","1514","80  >  49168 [ACK] Seq=7301 Ack=419 Win=6912 Len=1460 [TCP segment of a reassembled PDU]"
"77","0.436518","192.168.1.107","74.86.13.168","TCP","60","49168  >  80 [ACK] Seq=419 Ack=8761 Win=65700 Len=0"
"78","0.438264","74.86.13.168","192.168.1.107","TCP","1514","80  >  49168 [ACK] Seq=8761 Ack=419 Win=6912 Len=1460 [TCP segment of a reassembled PDU]"
"79","0.438274","74.86.13.168","192.168.1.107","TCP","1514","80  >  49168 [ACK] Seq=10221 Ack=419 Win=6912 Len=1460 [TCP segment of a reassembled PDU]"
"80","0.438463","192.168.1.107","74.86.13.168","TCP","60","49168  >  80 [ACK] Seq=419 Ack=11681 Win=65700 Len=0"
"81","0.483953","74.86.13.168","192.168.1.107","TCP","1514","80  >  49168 [ACK] Seq=11681 Ack=419 Win=6912 Len=1460 [TCP segment of a reassembled PDU]"
"82","0.484151","74.86.13.168","192.168.1.107","TCP","1514","80  >  49168 [ACK] Seq=13141 Ack=419 Win=6912 Len=1460 [TCP segment of a reassembled PDU]"
"83","0.484156","192.168.1.107","74.86.13.168","TCP","60","49168  >  80 [ACK] Seq=419 Ack=14601 Win=65700 Len=0"
"84","0.484837","74.86.13.168","192.168.1.107","TCP","1514","80  >  49168 [ACK] Seq=14601 Ack=419 Win=6912 Len=1460 [TCP segment of a reassembled PDU]"
"85","0.485102","74.86.13.168","192.168.1.107","TCP","1514","80  >  49168 [ACK] Seq=16061 Ack=419 Win=6912 Len=1460 [TCP segment of a reassembled PDU]"
"86","0.485107","192.168.1.107","74.86.13.168","TCP","60","49168  >  80 [ACK] Seq=419 Ack=17521 Win=65700 Len=0"
"87","0.487129","74.86.13.168","192.168.1.107","TCP","1514","80  >  49168 [ACK] Seq=17521 Ack=419 Win=6912 Len=1460 [TCP segment of a reassembled PDU]"
"88","0.487326","74.86.13.168","192.168.1.107","TCP","1514","80  >  49168 [ACK] Seq=18981 Ack=419 Win=6912 Len=1460 [TCP segment of a reassembled PDU]"
"89","0.487332","192.168.1.107","74.86.13.168","TCP","60","49168  >  80 [ACK] Seq=419 Ack=20441 Win=65700 Len=0"
"90","0.520472","74.86.13.168","192.168.1.107","TCP","1514","80  >  49168 [ACK] Seq=20441 Ack=419 Win=6912 Len=1460 [TCP segment of a reassembled PDU]"
"91","0.520482","74.86.13.168","192.168.1.107","TCP","1514","80  >  49168 [ACK] Seq=21901 Ack=419 Win=6912 Len=1460 [TCP segment of a reassembled PDU]"
"92","0.520671","192.168.1.107","74.86.13.168","TCP","60","49168  >  80 [ACK] Seq=419 Ack=23361 Win=65700 Len=0"
"93","0.521740","74.86.13.168","192.168.1.107","TCP","1514","80  >  49168 [ACK] Seq=23361 Ack=419 Win=6912 Len=1460 [TCP segment of a reassembled PDU]"
"94","0.521751","74.86.13.168","192.168.1.107","TCP","1514","80  >  49168 [ACK] Seq=24821 Ack=419 Win=6912 Len=1460 [TCP segment of a reassembled PDU]"
"95","0.521754","192.168.1.107","74.86.13.168","TCP","60","49170  >  80 [ACK] Seq=459 Ack=578 Win=65120 Len=0"
"96","0.521939","192.168.1.107","74.86.13.168","TCP","60","49168  >  80 [ACK] Seq=419 Ack=26281 Win=65700 Len=0"
"97","0.523262","74.86.13.168","192.168.1.107","TCP","1514","80  >  49168 [ACK] Seq=26281 Ack=419 Win=6912 Len=1460 [TCP segment of a reassembled PDU]"
"98","0.523272","74.86.13.168","192.168.1.107","HTTP","1012","HTTP/1.1 200 OK  (GIF89a)"
"99","0.523276","192.168.1.107","74.86.13.168","TCP","60","49168  >  80 [ACK] Seq=419 Ack=28699 Win=65700 Len=0"
"100","0.539155","192.168.1.107","74.86.13.168","HTTP","353","GET /favicon.ico HTTP/1.1 "
"101","0.561668","74.86.13.168","192.168.1.107","TCP","1514","80  >  49170 [ACK] Seq=578 Ack=758 Win=8192 Len=1460 [TCP segment of a reassembled PDU]"
"102","0.561680","74.86.13.168","192.168.1.107","HTTP","245","HTTP/1.1 200 OK  (image/x-icon)"
"103","0.561682","192.168.1.107","74.86.13.168","TCP","60","49170  >  80 [ACK] Seq=758 Ack=2229 Win=65700 Len=0"
"104","0.570029","74.86.13.168","192.168.1.107","TCP","630","[TCP Retransmission] 80  >  49166 [PSH, ACK] Seq=21336 Ack=1616 Win=10496 Len=576"
"105","0.570040","192.168.1.107","74.86.13.168","TCP","66","49166  >  80 [ACK] Seq=1616 Ack=21912 Win=65700 Len=0 SLE=21336 SRE=21912"
"106","0.571306","74.86.13.168","192.168.1.107","TCP","634","[TCP Retransmission] 80  >  49169 [PSH, ACK] Seq=352 Ack=881 Win=8192 Len=580"
"107","0.571317","192.168.1.107","74.86.13.168","TCP","66","49169  >  80 [ACK] Seq=881 Ack=932 Win=64768 Len=0 SLE=352 SRE=932"
"108","0.579723","74.86.13.168","192.168.1.107","TCP","634","[TCP Retransmission] 80  >  49167 [PSH, ACK] Seq=843 Ack=1319 Win=9216 Len=580"
"109","0.579734","192.168.1.107","74.86.13.168","TCP","66","49167  >  80 [ACK] Seq=1319 Ack=1423 Win=64276 Len=0 SLE=843 SRE=1423"
"110","0.631148","192.168.1.107","74.86.13.168","TCP","60","49171  >  80 [ACK] Seq=432 Ack=555 Win=65144 Len=0"
"111","5.305886","74.86.13.168","192.168.1.107","TCP","60","80  >  49168 [FIN, ACK] Seq=28699 Ack=419 Win=6912 Len=0"
"112","5.305895","192.168.1.107","74.86.13.168","TCP","60","49168  >  80 [ACK] Seq=419 Ack=28700 Win=65700 Len=0"
"113","5.344923","74.86.13.168","192.168.1.107","TCP","60","80  >  49169 [FIN, ACK] Seq=932 Ack=881 Win=8192 Len=0"
"114","5.344932","192.168.1.107","74.86.13.168","TCP","60","49169  >  80 [ACK] Seq=881 Ack=933 Win=64768 Len=0"
"115","5.345994","74.86.13.168","192.168.1.107","TCP","60","80  >  49167 [FIN, ACK] Seq=1423 Ack=1319 Win=9216 Len=0"
"116","5.346004","192.168.1.107","74.86.13.168","TCP","60","49167  >  80 [ACK] Seq=1319 Ack=1424 Win=64276 Len=0"
"117","5.346006","74.86.13.168","192.168.1.107","TCP","60","80  >  49166 [FIN, ACK] Seq=21912 Ack=1616 Win=10496 Len=0"
"118","5.346191","192.168.1.107","74.86.13.168","TCP","60","49166  >  80 [ACK] Seq=1616 Ack=21913 Win=65700 Len=0"
"119","5.387075","74.86.13.168","192.168.1.107","TCP","60","80  >  49171 [FIN, ACK] Seq=555 Ack=432 Win=6912 Len=0"
"120","5.387079","192.168.1.107","74.86.13.168","TCP","60","49171  >  80 [ACK] Seq=432 Ack=556 Win=65144 Len=0"
"121","5.560059","74.86.13.168","192.168.1.107","TCP","60","80  >  49170 [FIN, ACK] Seq=2229 Ack=758 Win=8192 Len=0"
"122","5.560069","192.168.1.107","74.86.13.168","TCP","60","49170  >  80 [ACK] Seq=758 Ack=2230 Win=65700 Len=0"
"123","5.561050","192.168.1.107","74.86.13.168","TCP","60","49167  >  80 [RST, ACK] Seq=1319 Ack=1424 Win=0 Len=0"
"124","5.561060","192.168.1.107","74.86.13.168","TCP","60","49166  >  80 [RST, ACK] Seq=1616 Ack=21913 Win=0 Len=0"
"125","5.561061","192.168.1.107","74.86.13.168","TCP","60","49169  >  80 [RST, ACK] Seq=881 Ack=933 Win=0 Len=0"
"126","5.561063","192.168.1.107","74.86.13.168","TCP","60","49171  >  80 [RST, ACK] Seq=432 Ack=556 Win=0 Len=0"
"127","5.561246","192.168.1.107","74.86.13.168","TCP","60","49168  >  80 [RST, ACK] Seq=419 Ack=28700 Win=0 Len=0"
"128","5.561250","192.168.1.107","74.86.13.168","TCP","60","49170  >  80 [RST, ACK] Seq=758 Ack=2230 Win=0 Len=0"
"129","46.549831","192.168.1.107","74.86.13.168","TCP","66","49174  >  80 [SYN] Seq=0 Win=8192 Len=0 MSS=1460 WS=4 SACK_PERM"
"130","46.586414","74.86.13.168","192.168.1.107","TCP","66","80  >  49174 [SYN, ACK] Seq=0 Ack=1 Win=5840 Len=0 MSS=1460 SACK_PERM WS=256"
"131","46.586424","192.168.1.107","74.86.13.168","TCP","60","49174  >  80 [ACK] Seq=1 Ack=1 Win=65700 Len=0"
"132","46.586642","192.168.1.107","74.86.13.168","HTTP","581","GET /new_vacation_list.htm HTTP/1.1 "
"133","46.606410","74.86.13.168","192.168.1.107","TCP","60","80  >  49174 [ACK] Seq=1 Ack=528 Win=6912 Len=0"
"134","46.607678","74.86.13.168","192.168.1.107","HTTP","907","HTTP/1.1 302 Found  (text/html)"
"135","46.607689","74.86.13.168","192.168.1.107","TCP","60","80  >  49174 [FIN, ACK] Seq=854 Ack=528 Win=6912 Len=0"
"136","46.607691","192.168.1.107","74.86.13.168","TCP","60","49174  >  80 [ACK] Seq=528 Ack=855 Win=64844 Len=0"
"137","46.608560","192.168.1.107","74.86.13.168","TCP","60","49174  >  80 [RST, ACK] Seq=528 Ack=855 Win=0 Len=0"
"138","46.609979","192.168.1.107","8.8.8.8","DNS","106","Standard query 0x12d2 A t93jo0tumvjtke73neu1ixr.domestiquecleaning.com"
"139","46.631505","8.8.8.8","192.168.1.107","DNS","122","Standard query response 0x12d2 A t93jo0tumvjtke73neu1ixr.domestiquecleaning.com A 94.137.122.252"
"140","46.632651","192.168.1.107","94.137.122.252","TCP","66","49175  >  80 [SYN] Seq=0 Win=8192 Len=0 MSS=1460 WS=4 SACK_PERM"
"141","46.805996","94.137.122.252","192.168.1.107","TCP","66","80  >  49175 [SYN, ACK] Seq=0 Ack=1 Win=5840 Len=0 MSS=1460 SACK_PERM WS=128"
"142","46.806006","192.168.1.107","94.137.122.252","TCP","60","49175  >  80 [ACK] Seq=1 Ack=1 Win=65700 Len=0"
"143","46.806453","192.168.1.107","94.137.122.252","HTTP","761","GET /index.php?f=YXd5cG9nbz1zaXB6cCZ0aW1lPTEzMTIxOTAwNDc0NjMzNDU2MDYmc3JjPTMxNiZzdXJsPXd3dy5vY2VhbmljcmVhbHR5LmNvbSZzcG9ydD04MCZrZXk9NTA2NzBGMTImc3VyaT0vbmV3X3ZhY2F0aW9uX2xpc3QuaHRt HTTP/1.1 "
"144","46.971042","94.137.122.252","192.168.1.107","TCP","60","80  >  49175 [ACK] Seq=1 Ack=708 Win=7296 Len=0"
"145","47.367611","94.137.122.252","192.168.1.107","HTTP","935","HTTP/1.1 200 OK  (text/html)"
"146","47.406531","192.168.1.107","94.137.122.252","HTTP","378","GET /favicon.ico HTTP/1.1 "
"147","47.587567","94.137.122.252","192.168.1.107","TCP","60","80  >  49175 [ACK] Seq=882 Ack=1032 Win=8704 Len=0"
"148","47.645041","94.137.122.252","192.168.1.107","HTTP","778","HTTP/1.1 404 Not Found  (text/html)"
"149","47.708064","192.168.1.107","8.8.8.8","DNS","139","Standard query 0x52f9 A t93jo0tumvjtke73neu1ixr53164e366ec7440dd42452677baa54d83.domestiquecleaning.com"
"150","47.798943","8.8.8.8","192.168.1.107","DNS","155","Standard query response 0x52f9 A t93jo0tumvjtke73neu1ixr53164e366ec7440dd42452677baa54d83.domestiquecleaning.com A 94.137.122.252"
"151","47.800064","192.168.1.107","94.137.122.252","TCP","66","49178  >  80 [SYN] Seq=0 Win=8192 Len=0 MSS=1460 WS=4 SACK_PERM"
"152","47.846586","192.168.1.107","94.137.122.252","TCP","60","49175  >  80 [ACK] Seq=1032 Ack=1606 Win=65700 Len=0"
"153","47.978678","94.137.122.252","192.168.1.107","TCP","66","80  >  49178 [SYN, ACK] Seq=0 Ack=1 Win=5840 Len=0 MSS=1460 SACK_PERM WS=128"
"154","47.978688","192.168.1.107","94.137.122.252","TCP","60","49178  >  80 [ACK] Seq=1 Ack=1 Win=65700 Len=0"
"155","47.979100","192.168.1.107","94.137.122.252","HTTP","545","GET /index2.php HTTP/1.1 "
"156","48.145908","94.137.122.252","192.168.1.107","TCP","60","80  >  49178 [ACK] Seq=1 Ack=492 Win=6912 Len=0"
"157","48.857662","94.137.122.252","192.168.1.107","HTTP","1273","HTTP/1.1 200 OK  (text/html)"
"158","48.906821","192.168.1.107","94.137.122.252","HTTP","411","GET /favicon.ico HTTP/1.1 "
"159","49.067653","94.137.122.252","192.168.1.107","TCP","60","80  >  49178 [ACK] Seq=1220 Ack=849 Win=8064 Len=0"
"160","49.152774","94.137.122.252","192.168.1.107","HTTP","778","HTTP/1.1 404 Not Found  (text/html)"
"161","49.375390","192.168.1.107","94.137.122.252","TCP","60","49178  >  80 [ACK] Seq=849 Ack=1944 Win=65700 Len=0"
"162","49.417625","192.168.1.107","8.8.8.8","DNS","80","Standard query 0x87a6 A du8siun.frapdays.com"
"163","49.488966","8.8.8.8","192.168.1.107","DNS","96","Standard query response 0x87a6 A du8siun.frapdays.com A 212.83.191.241"
"164","49.490101","192.168.1.107","212.83.191.241","TCP","66","49181  >  8000 [SYN] Seq=0 Win=8192 Len=0 MSS=1460 WS=4 SACK_PERM"
"165","49.628847","212.83.191.241","192.168.1.107","TCP","66","8000  >  49181 [SYN, ACK] Seq=0 Ack=1 Win=14600 Len=0 MSS=1460 SACK_PERM WS=1024"
"166","49.628857","192.168.1.107","212.83.191.241","TCP","60","49181  >  8000 [ACK] Seq=1 Ack=1 Win=65700 Len=0"
"167","49.629288","192.168.1.107","212.83.191.241","HTTP","613","GET /fgepikjfck?innyj=3410575 HTTP/1.1 "
"168","49.754976","212.83.191.241","192.168.1.107","TCP","60","8000  >  49181 [ACK] Seq=1 Ack=560 Win=16384 Len=0"
"169","49.793381","212.83.191.241","192.168.1.107","TCP","1514","8000  >  49181 [ACK] Seq=1 Ack=560 Win=16384 Len=1460 [TCP segment of a reassembled PDU]"
"170","49.793391","212.83.191.241","192.168.1.107","TCP","1044","8000  >  49181 [PSH, ACK] Seq=1461 Ack=560 Win=16384 Len=990 [TCP segment of a reassembled PDU]"
"171","49.793395","212.83.191.241","192.168.1.107","HTTP","60","HTTP/1.1 200 OK  (text/html)"
"172","49.793580","192.168.1.107","212.83.191.241","TCP","60","49181  >  8000 [ACK] Seq=560 Ack=2456 Win=65700 Len=0"
"173","49.803077","192.168.1.107","212.83.191.241","HTTP","454","GET /vazltfaaczuw.css HTTP/1.1 "
"174","49.804071","192.168.1.107","212.83.191.241","TCP","66","49182  >  8000 [SYN] Seq=0 Win=8192 Len=0 MSS=1460 WS=4 SACK_PERM"
"175","49.804435","192.168.1.107","212.83.191.241","TCP","66","49183  >  8000 [SYN] Seq=0 Win=8192 Len=0 MSS=1460 WS=4 SACK_PERM"
"176","49.804933","192.168.1.107","212.83.191.241","TCP","66","49184  >  8000 [SYN] Seq=0 Win=8192 Len=0 MSS=1460 WS=4 SACK_PERM"
"177","49.805571","192.168.1.107","212.83.191.241","TCP","66","49185  >  8000 [SYN] Seq=0 Win=8192 Len=0 MSS=1460 WS=4 SACK_PERM"
"178","49.805829","192.168.1.107","212.83.191.241","TCP","66","49186  >  8000 [SYN] Seq=0 Win=8192 Len=0 MSS=1460 WS=4 SACK_PERM"
"179","49.864173","192.168.1.107","173.194.77.95","TCP","66","49187  >  80 [SYN] Seq=0 Win=8192 Len=0 MSS=1460 WS=4 SACK_PERM"
"180","49.943713","212.83.191.241","192.168.1.107","TCP","66","8000  >  49182 [SYN, ACK] Seq=0 Ack=1 Win=14600 Len=0 MSS=1460 SACK_PERM WS=1024"
"181","49.943722","192.168.1.107","212.83.191.241","TCP","60","49182  >  8000 [ACK] Seq=1 Ack=1 Win=65700 Len=0"
"182","49.944095","192.168.1.107","212.83.191.241","HTTP","448","GET /fgcitq.css HTTP/1.1 "
"183","49.944899","212.83.191.241","192.168.1.107","HTTP","557","HTTP/1.1 200 OK  (text/css)"
"184","49.945454","192.168.1.107","212.83.191.241","HTTP","457","GET /xnkfhzqaxiyhqwtz.js HTTP/1.1 "
"185","49.951140","173.194.77.95","192.168.1.107","TCP","66","80  >  49187 [SYN, ACK] Seq=0 Ack=1 Win=62920 Len=0 MSS=1430 SACK_PERM WS=64"
"186","49.951148","192.168.1.107","173.194.77.95","TCP","60","49187  >  80 [ACK] Seq=1 Ack=1 Win=65780 Len=0"
"187","49.951579","192.168.1.107","173.194.77.95","HTTP","468","GET /ajax/libs/jquery/1.9.1/jquery.min.js HTTP/1.1 "
"188","49.958409","212.83.191.241","192.168.1.107","TCP","66","8000  >  49183 [SYN, ACK] Seq=0 Ack=1 Win=14600 Len=0 MSS=1460 SACK_PERM WS=1024"
"189","49.958418","192.168.1.107","212.83.191.241","TCP","60","49183  >  8000 [ACK] Seq=1 Ack=1 Win=65700 Len=0"
"190","49.958833","192.168.1.107","212.83.191.241","HTTP","454","GET /kiheegcpyxpx.css HTTP/1.1 "
"191","49.966215","212.83.191.241","192.168.1.107","TCP","66","8000  >  49184 [SYN, ACK] Seq=0 Ack=1 Win=14600 Len=0 MSS=1460 SACK_PERM WS=1024"
"192","49.966223","192.168.1.107","212.83.191.241","TCP","60","49184  >  8000 [ACK] Seq=1 Ack=1 Win=65700 Len=0"
"193","49.966618","192.168.1.107","212.83.191.241","HTTP","447","GET /rsaba.css HTTP/1.1 "
"194","49.973657","212.83.191.241","192.168.1.107","TCP","66","8000  >  49185 [SYN, ACK] Seq=0 Ack=1 Win=14600 Len=0 MSS=1460 SACK_PERM WS=1024"
"195","49.973666","192.168.1.107","212.83.191.241","TCP","60","49185  >  8000 [ACK] Seq=1 Ack=1 Win=65700 Len=0"
"196","49.974090","192.168.1.107","212.83.191.241","HTTP","450","GET /iuoktysyj.js HTTP/1.1 "
"197","49.981496","212.83.191.241","192.168.1.107","TCP","66","8000  >  49186 [SYN, ACK] Seq=0 Ack=1 Win=14600 Len=0 MSS=1460 SACK_PERM WS=1024"
"198","49.981500","192.168.1.107","212.83.191.241","TCP","60","49186  >  8000 [ACK] Seq=1 Ack=1 Win=65700 Len=0"
"199","49.981899","192.168.1.107","212.83.191.241","HTTP","458","GET /jhflpybaqmixrnet.css HTTP/1.1 "
"200","50.048602","173.194.77.95","192.168.1.107","TCP","60","80  >  49187 [ACK] Seq=1 Ack=415 Win=64000 Len=0"
"201","50.050106","173.194.77.95","192.168.1.107","TCP","1484","80  >  49187 [ACK] Seq=1 Ack=415 Win=64000 Len=1430 [TCP segment of a reassembled PDU]"
"202","50.050303","173.194.77.95","192.168.1.107","TCP","1484","80  >  49187 [ACK] Seq=1431 Ack=415 Win=64000 Len=1430 [TCP segment of a reassembled PDU]"
"203","50.050554","173.194.77.95","192.168.1.107","TCP","1484","80  >  49187 [ACK] Seq=2861 Ack=415 Win=64000 Len=1430 [TCP segment of a reassembled PDU]"
"204","50.050558","192.168.1.107","173.194.77.95","TCP","60","49187  >  80 [ACK] Seq=415 Ack=2861 Win=65780 Len=0"
"205","50.050803","173.194.77.95","192.168.1.107","TCP","1484","80  >  49187 [ACK] Seq=4291 Ack=415 Win=64000 Len=1430 [TCP segment of a reassembled PDU]"
"206","50.051053","173.194.77.95","192.168.1.107","TCP","1484","80  >  49187 [ACK] Seq=5721 Ack=415 Win=64000 Len=1430 [TCP segment of a reassembled PDU]"
"207","50.051057","192.168.1.107","173.194.77.95","TCP","60","49187  >  80 [ACK] Seq=415 Ack=5721 Win=65780 Len=0"
"208","50.051059","173.194.77.95","192.168.1.107","TCP","1484","80  >  49187 [ACK] Seq=7151 Ack=415 Win=64000 Len=1430 [TCP segment of a reassembled PDU]"
"209","50.051061","173.194.77.95","192.168.1.107","TCP","1484","80  >  49187 [ACK] Seq=8581 Ack=415 Win=64000 Len=1430 [TCP segment of a reassembled PDU]"
"210","50.051303","192.168.1.107","173.194.77.95","TCP","60","49187  >  80 [ACK] Seq=415 Ack=8581 Win=65780 Len=0"
"211","50.051553","173.194.77.95","192.168.1.107","TCP","1484","80  >  49187 [ACK] Seq=10011 Ack=415 Win=64000 Len=1430 [TCP segment of a reassembled PDU]"
"212","50.051557","173.194.77.95","192.168.1.107","TCP","1484","80  >  49187 [ACK] Seq=11441 Ack=415 Win=64000 Len=1430 [TCP segment of a reassembled PDU]"
"213","50.051559","192.168.1.107","173.194.77.95","TCP","60","49187  >  80 [ACK] Seq=415 Ack=11441 Win=64348 Len=0"
"214","50.051802","173.194.77.95","192.168.1.107","TCP","1484","80  >  49187 [ACK] Seq=12871 Ack=415 Win=64000 Len=1430 [TCP segment of a reassembled PDU]"
"215","50.051807","192.168.1.107","173.194.77.95","TCP","60","49187  >  80 [ACK] Seq=415 Ack=14301 Win=61488 Len=0"
"216","50.052538","192.168.1.107","173.194.77.95","TCP","60","[TCP Window Update] 49187  >  80 [ACK] Seq=415 Ack=14301 Win=64960 Len=0"
"217","50.086196","212.83.191.241","192.168.1.107","HTTP","602","HTTP/1.1 200 OK  (application/x-javascript)"
"218","50.086707","192.168.1.107","212.83.191.241","HTTP","447","GET /jjfje.css HTTP/1.1 "
"219","50.098822","212.83.191.241","192.168.1.107","TCP","60","8000  >  49182 [ACK] Seq=1 Ack=395 Win=16384 Len=0"
"220","50.108448","212.83.191.241","192.168.1.107","TCP","60","8000  >  49184 [ACK] Seq=1 Ack=394 Win=16384 Len=0"
"221","50.109442","212.83.191.241","192.168.1.107","TCP","60","8000  >  49186 [ACK] Seq=1 Ack=405 Win=16384 Len=0"
"222","50.110435","212.83.191.241","192.168.1.107","TCP","60","8000  >  49183 [ACK] Seq=1 Ack=401 Win=16384 Len=0"
"223","50.110445","212.83.191.241","192.168.1.107","TCP","60","8000  >  49185 [ACK] Seq=1 Ack=397 Win=16384 Len=0"
"224","50.115073","212.83.191.241","192.168.1.107","HTTP","557","HTTP/1.1 200 OK  (text/css)"
"225","50.115580","192.168.1.107","212.83.191.241","HTTP","453","GET /vhvlqcfrbztb.js HTTP/1.1 "
"226","50.123572","173.194.77.95","192.168.1.107","TCP","1484","80  >  49187 [ACK] Seq=14301 Ack=415 Win=64000 Len=1430 [TCP segment of a reassembled PDU]"
"227","50.123769","173.194.77.95","192.168.1.107","TCP","1484","80  >  49187 [ACK] Seq=15731 Ack=415 Win=64000 Len=1430 [TCP segment of a reassembled PDU]"
"228","50.123774","192.168.1.107","173.194.77.95","TCP","60","49187  >  80 [ACK] Seq=415 Ack=17161 Win=65780 Len=0"
"229","50.124019","173.194.77.95","192.168.1.107","TCP","1484","80  >  49187 [ACK] Seq=17161 Ack=415 Win=64000 Len=1430 [TCP segment of a reassembled PDU]"
"230","50.124533","173.194.77.95","192.168.1.107","TCP","1484","80  >  49187 [ACK] Seq=18591 Ack=415 Win=64000 Len=1430 [TCP segment of a reassembled PDU]"
"231","50.124539","192.168.1.107","173.194.77.95","TCP","60","49187  >  80 [ACK] Seq=415 Ack=20021 Win=65780 Len=0"
"232","50.124877","173.194.77.95","192.168.1.107","TCP","1484","80  >  49187 [ACK] Seq=20021 Ack=415 Win=64000 Len=1430 [TCP segment of a reassembled PDU]"
"233","50.125131","173.194.77.95","192.168.1.107","TCP","1484","80  >  49187 [ACK] Seq=21451 Ack=415 Win=64000 Len=1430 [TCP segment of a reassembled PDU]"
"234","50.125135","192.168.1.107","173.194.77.95","TCP","60","49187  >  80 [ACK] Seq=415 Ack=22881 Win=65780 Len=0"
"235","50.125381","173.194.77.95","192.168.1.107","TCP","1484","80  >  49187 [ACK] Seq=22881 Ack=415 Win=64000 Len=1430 [TCP segment of a reassembled PDU]"
"236","50.125385","173.194.77.95","192.168.1.107","TCP","1484","80  >  49187 [ACK] Seq=24311 Ack=415 Win=64000 Len=1430 [TCP segment of a reassembled PDU]"
"237","50.125632","173.194.77.95","192.168.1.107","TCP","1484","80  >  49187 [ACK] Seq=25741 Ack=415 Win=64000 Len=1430 [TCP segment of a reassembled PDU]"
"238","50.125636","192.168.1.107","173.194.77.95","TCP","60","49187  >  80 [ACK] Seq=415 Ack=25741 Win=65780 Len=0"
"239","50.125638","173.194.77.95","192.168.1.107","TCP","1484","80  >  49187 [ACK] Seq=27171 Ack=415 Win=64000 Len=1430 [TCP segment of a reassembled PDU]"
"240","50.125640","192.168.1.107","173.194.77.95","TCP","60","49187  >  80 [ACK] Seq=415 Ack=28601 Win=65780 Len=0"
"241","50.125975","173.194.77.95","192.168.1.107","TCP","1484","80  >  49187 [ACK] Seq=28601 Ack=415 Win=64000 Len=1430 [TCP segment of a reassembled PDU]"
"242","50.126225","173.194.77.95","192.168.1.107","TCP","1484","80  >  49187 [ACK] Seq=30031 Ack=415 Win=64000 Len=1430 [TCP segment of a reassembled PDU]"
"243","50.126228","212.83.191.241","192.168.1.107","HTTP","557","HTTP/1.1 200 OK  (text/css)"
"244","50.126230","192.168.1.107","173.194.77.95","TCP","60","49187  >  80 [ACK] Seq=415 Ack=31461 Win=65780 Len=0"
"245","50.126923","212.83.191.241","192.168.1.107","HTTP","557","HTTP/1.1 200 OK  (text/css)"
"246","50.127169","212.83.191.241","192.168.1.107","HTTP","557","HTTP/1.1 200 OK  (text/css)"
"247","50.127602","212.83.191.241","192.168.1.107","HTTP","602","HTTP/1.1 200 OK  (application/x-javascript)"
"248","50.128346","173.194.77.95","192.168.1.107","TCP","1484","80  >  49187 [ACK] Seq=31461 Ack=415 Win=64000 Len=1430 [TCP segment of a reassembled PDU]"
"249","50.128356","192.168.1.107","212.83.191.241","HTTP","456","GET /linyrlpeqjgtbzu.js HTTP/1.1 "
"250","50.128358","173.194.77.95","192.168.1.107","HTTP","459","HTTP/1.1 200 OK  (text/javascript)"
"251","50.128361","192.168.1.107","173.194.77.95","TCP","60","49187  >  80 [ACK] Seq=415 Ack=33296 Win=65780 Len=0"
"252","50.128709","192.168.1.107","212.83.191.241","HTTP","446","GET /djktt.js HTTP/1.1 "
"253","50.130603","192.168.1.107","212.83.191.241","HTTP","457","GET /igqkfklcryefjxvt.js HTTP/1.1 "
"254","50.131319","192.168.1.107","212.83.191.241","HTTP","450","GET /ttulnvvce.js HTTP/1.1 "
"255","50.227979","212.83.191.241","192.168.1.107","HTTP","557","HTTP/1.1 200 OK  (text/css)"
"256","50.228500","192.168.1.107","212.83.191.241","HTTP","452","GET /qtkjsubjpif.js HTTP/1.1 "
"257","50.259053","212.83.191.241","192.168.1.107","HTTP","602","HTTP/1.1 200 OK  (application/x-javascript)"
"258","50.274796","212.83.191.241","192.168.1.107","HTTP","602","HTTP/1.1 200 OK  (application/x-javascript)"
"259","50.274994","212.83.191.241","192.168.1.107","HTTP","602","HTTP/1.1 200 OK  (application/x-javascript)"
"260","50.275451","212.83.191.241","192.168.1.107","HTTP","602","HTTP/1.1 200 OK  (application/x-javascript)"
"261","50.275702","212.83.191.241","192.168.1.107","HTTP","602","HTTP/1.1 200 OK  (application/x-javascript)"
"262","50.369963","212.83.191.241","192.168.1.107","HTTP","602","HTTP/1.1 200 OK  (application/x-javascript)"
"263","50.376861","192.168.1.107","212.83.191.241","HTTP","457","GET /hugrozmanhvplxt.jpg HTTP/1.1 "
"264","50.377081","192.168.1.107","212.83.191.241","HTTP","451","GET /ilydigyoy.jpg HTTP/1.1 "
"265","50.377382","192.168.1.107","212.83.191.241","HTTP","451","GET /masiqefks.jpg HTTP/1.1 "
"266","50.377633","192.168.1.107","212.83.191.241","HTTP","447","GET /iatng.jpg HTTP/1.1 "
"267","50.377636","192.168.1.107","212.83.191.241","HTTP","452","GET /hpttydbjcf.png HTTP/1.1 "
"268","50.378323","192.168.1.107","212.83.191.241","HTTP","447","GET /fgptq.gif HTTP/1.1 "
"269","50.517059","212.83.191.241","192.168.1.107","HTTP","571","HTTP/1.1 200 OK "
"270","50.519399","212.83.191.241","192.168.1.107","HTTP","571","HTTP/1.1 200 OK "
"271","50.520387","212.83.191.241","192.168.1.107","HTTP","571","HTTP/1.1 200 OK "
"272","50.522361","212.83.191.241","192.168.1.107","HTTP","571","HTTP/1.1 200 OK "
"273","50.522560","212.83.191.241","192.168.1.107","HTTP","571","HTTP/1.1 200 OK "
"274","50.543693","212.83.191.241","192.168.1.107","TCP","60","8000  >  49186 [ACK] Seq=1052 Ack=1194 Win=18432 Len=0"
"275","50.717107","192.168.1.107","212.83.191.241","TCP","60","49181  >  8000 [ACK] Seq=2547 Ack=5075 Win=64632 Len=0"
"276","50.732699","192.168.1.107","212.83.191.241","TCP","60","49184  >  8000 [ACK] Seq=1193 Ack=1569 Win=65700 Len=0"
"277","50.732709","192.168.1.107","212.83.191.241","TCP","60","49185  >  8000 [ACK] Seq=1191 Ack=1614 Win=65700 Len=0"
"278","50.732711","192.168.1.107","212.83.191.241","TCP","60","49182  >  8000 [ACK] Seq=1197 Ack=1569 Win=65700 Len=0"
"279","50.732713","192.168.1.107","212.83.191.241","TCP","60","49183  >  8000 [ACK] Seq=1197 Ack=1569 Win=65700 Len=0"
"280","51.520100","212.83.191.241","192.168.1.107","HTTP","571","HTTP/1.1 200 OK "
"281","51.549364","192.168.1.107","212.83.191.241","HTTP","528","POST /nnbxuxquvzx HTTP/1.1 "
"282","51.696299","212.83.191.241","192.168.1.107","TCP","1514","8000  >  49184 [ACK] Seq=1569 Ack=1667 Win=19456 Len=1460 [TCP segment of a reassembled PDU]"
"283","51.696309","212.83.191.241","192.168.1.107","TCP","1514","8000  >  49184 [ACK] Seq=3029 Ack=1667 Win=19456 Len=1460 [TCP segment of a reassembled PDU]"
"284","51.696497","212.83.191.241","192.168.1.107","TCP","1315","8000  >  49184 [PSH, ACK] Seq=4489 Ack=1667 Win=19456 Len=1261 [TCP segment of a reassembled PDU]"
"285","51.696504","192.168.1.107","212.83.191.241","TCP","60","49184  >  8000 [ACK] Seq=1667 Ack=4489 Win=65700 Len=0"
"286","51.696748","212.83.191.241","192.168.1.107","TCP","1514","8000  >  49184 [ACK] Seq=5750 Ack=1667 Win=19456 Len=1460 [TCP segment of a reassembled PDU]"
"287","51.696754","212.83.191.241","192.168.1.107","TCP","1514","8000  >  49184 [ACK] Seq=7210 Ack=1667 Win=19456 Len=1460 [TCP segment of a reassembled PDU]"
"288","51.696758","192.168.1.107","212.83.191.241","TCP","60","49184  >  8000 [ACK] Seq=1667 Ack=7210 Win=65700 Len=0"
"289","51.696760","212.83.191.241","192.168.1.107","TCP","1230","8000  >  49184 [PSH, ACK] Seq=8670 Ack=1667 Win=19456 Len=1176 [TCP segment of a reassembled PDU]"
"290","51.696997","212.83.191.241","192.168.1.107","TCP","1514","8000  >  49184 [ACK] Seq=9846 Ack=1667 Win=19456 Len=1460 [TCP segment of a reassembled PDU]"
"291","51.697004","192.168.1.107","212.83.191.241","TCP","60","49184  >  8000 [ACK] Seq=1667 Ack=9846 Win=65700 Len=0"
"292","51.698121","212.83.191.241","192.168.1.107","TCP","1514","8000  >  49184 [ACK] Seq=11306 Ack=1667 Win=19456 Len=1460 [TCP segment of a reassembled PDU]"
"293","51.698368","212.83.191.241","192.168.1.107","TCP","1230","8000  >  49184 [PSH, ACK] Seq=12766 Ack=1667 Win=19456 Len=1176 [TCP segment of a reassembled PDU]"
"294","51.698373","192.168.1.107","212.83.191.241","TCP","60","49184  >  8000 [ACK] Seq=1667 Ack=12766 Win=64240 Len=0"
"295","51.698752","192.168.1.107","212.83.191.241","TCP","60","49184  >  8000 [ACK] Seq=1667 Ack=13942 Win=65700 Len=0"
"296","51.711081","212.83.191.241","192.168.1.107","TCP","1514","8000  >  49184 [ACK] Seq=13942 Ack=1667 Win=19456 Len=1460 [TCP segment of a reassembled PDU]"
"297","51.715536","192.168.1.107","212.83.191.241","TCP","60","49186  >  8000 [ACK] Seq=1194 Ack=1569 Win=65700 Len=0"
"298","51.823405","212.83.191.241","192.168.1.107","TCP","1514","8000  >  49184 [ACK] Seq=15402 Ack=1667 Win=19456 Len=1460 [TCP segment of a reassembled PDU]"
"299","51.823417","192.168.1.107","212.83.191.241","TCP","60","49184  >  8000 [ACK] Seq=1667 Ack=16862 Win=65700 Len=0"
"300","51.823653","212.83.191.241","192.168.1.107","TCP","1514","8000  >  49184 [ACK] Seq=16862 Ack=1667 Win=19456 Len=1460 [TCP segment of a reassembled PDU]"
"301","51.824048","212.83.191.241","192.168.1.107","TCP","1514","8000  >  49184 [ACK] Seq=18322 Ack=1667 Win=19456 Len=1460 [TCP segment of a reassembled PDU]"
"302","51.824052","192.168.1.107","212.83.191.241","TCP","60","49184  >  8000 [ACK] Seq=1667 Ack=19782 Win=65700 Len=0"
"303","51.828057","212.83.191.241","192.168.1.107","TCP","1514","8000  >  49184 [ACK] Seq=19782 Ack=1667 Win=19456 Len=1460 [TCP segment of a reassembled PDU]"
"304","51.828376","212.83.191.241","192.168.1.107","TCP","1514","8000  >  49184 [ACK] Seq=21242 Ack=1667 Win=19456 Len=1460 [TCP segment of a reassembled PDU]"
"305","51.828627","192.168.1.107","212.83.191.241","TCP","60","49184  >  8000 [ACK] Seq=1667 Ack=22702 Win=65700 Len=0"
"306","51.828630","212.83.191.241","192.168.1.107","TCP","1514","8000  >  49184 [ACK] Seq=22702 Ack=1667 Win=19456 Len=1460 [TCP segment of a reassembled PDU]"
"307","51.828633","212.83.191.241","192.168.1.107","TCP","1514","8000  >  49184 [ACK] Seq=24162 Ack=1667 Win=19456 Len=1460 [TCP segment of a reassembled PDU]"
"308","51.828876","192.168.1.107","212.83.191.241","TCP","60","49184  >  8000 [ACK] Seq=1667 Ack=25622 Win=65700 Len=0"
"309","51.829125","212.83.191.241","192.168.1.107","TCP","1514","8000  >  49184 [ACK] Seq=25622 Ack=1667 Win=19456 Len=1460 [TCP segment of a reassembled PDU]"
"310","51.829129","212.83.191.241","192.168.1.107","TCP","1514","8000  >  49184 [ACK] Seq=27082 Ack=1667 Win=19456 Len=1460 [TCP segment of a reassembled PDU]"
"311","51.829375","212.83.191.241","192.168.1.107","TCP","1514","8000  >  49184 [ACK] Seq=28542 Ack=1667 Win=19456 Len=1460 [TCP segment of a reassembled PDU]"
"312","51.829379","192.168.1.107","212.83.191.241","TCP","60","49184  >  8000 [ACK] Seq=1667 Ack=28542 Win=65700 Len=0"
"313","51.829626","212.83.191.241","192.168.1.107","TCP","1514","8000  >  49184 [ACK] Seq=30002 Ack=1667 Win=19456 Len=1460 [TCP segment of a reassembled PDU]"
"314","51.829631","212.83.191.241","192.168.1.107","TCP","1514","8000  >  49184 [ACK] Seq=31462 Ack=1667 Win=19456 Len=1460 [TCP segment of a reassembled PDU]"
"315","51.829634","192.168.1.107","212.83.191.241","TCP","60","49184  >  8000 [ACK] Seq=1667 Ack=31462 Win=65700 Len=0"
"316","51.829889","212.83.191.241","192.168.1.107","TCP","1514","8000  >  49184 [ACK] Seq=32922 Ack=1667 Win=19456 Len=1460 [TCP segment of a reassembled PDU]"
"317","51.830139","212.83.191.241","192.168.1.107","TCP","1514","8000  >  49184 [ACK] Seq=34382 Ack=1667 Win=19456 Len=1460 [TCP segment of a reassembled PDU]"
"318","51.830143","192.168.1.107","212.83.191.241","TCP","60","49184  >  8000 [ACK] Seq=1667 Ack=34382 Win=65700 Len=0"
"319","51.948058","212.83.191.241","192.168.1.107","TCP","1514","8000  >  49184 [ACK] Seq=35842 Ack=1667 Win=19456 Len=1460 [TCP segment of a reassembled PDU]"
"320","51.948069","192.168.1.107","212.83.191.241","TCP","60","49184  >  8000 [ACK] Seq=1667 Ack=37302 Win=65700 Len=0"
"321","51.948255","212.83.191.241","192.168.1.107","TCP","1514","8000  >  49184 [ACK] Seq=37302 Ack=1667 Win=19456 Len=1460 [TCP segment of a reassembled PDU]"
"322","51.948505","212.83.191.241","192.168.1.107","TCP","1514","8000  >  49184 [ACK] Seq=38762 Ack=1667 Win=19456 Len=1460 [TCP segment of a reassembled PDU]"
"323","51.948509","192.168.1.107","212.83.191.241","TCP","60","49184  >  8000 [ACK] Seq=1667 Ack=40222 Win=65700 Len=0"
"324","51.949049","212.83.191.241","192.168.1.107","TCP","1514","8000  >  49184 [ACK] Seq=40222 Ack=1667 Win=19456 Len=1460 [TCP segment of a reassembled PDU]"
"325","51.949298","212.83.191.241","192.168.1.107","TCP","1514","8000  >  49184 [ACK] Seq=41682 Ack=1667 Win=19456 Len=1460 [TCP segment of a reassembled PDU]"
"326","51.949303","192.168.1.107","212.83.191.241","TCP","60","49184  >  8000 [ACK] Seq=1667 Ack=43142 Win=65700 Len=0"
"327","51.949549","212.83.191.241","192.168.1.107","TCP","1514","8000  >  49184 [ACK] Seq=43142 Ack=1667 Win=19456 Len=1460 [TCP segment of a reassembled PDU]"
"328","51.956469","212.83.191.241","192.168.1.107","TCP","1514","8000  >  49184 [ACK] Seq=44602 Ack=1667 Win=19456 Len=1460 [TCP segment of a reassembled PDU]"
"329","51.956479","212.83.191.241","192.168.1.107","TCP","1514","8000  >  49184 [ACK] Seq=46062 Ack=1667 Win=19456 Len=1460 [TCP segment of a reassembled PDU]"
"330","51.956483","192.168.1.107","212.83.191.241","TCP","60","49184  >  8000 [ACK] Seq=1667 Ack=46062 Win=65700 Len=0"
"331","51.957166","212.83.191.241","192.168.1.107","TCP","1514","8000  >  49184 [ACK] Seq=47522 Ack=1667 Win=19456 Len=1460 [TCP segment of a reassembled PDU]"
"332","51.957174","192.168.1.107","212.83.191.241","TCP","60","49184  >  8000 [ACK] Seq=1667 Ack=48982 Win=65700 Len=0"
"333","51.957662","212.83.191.241","192.168.1.107","TCP","1514","8000  >  49184 [ACK] Seq=48982 Ack=1667 Win=19456 Len=1460 [TCP segment of a reassembled PDU]"
"334","51.957666","212.83.191.241","192.168.1.107","TCP","1514","8000  >  49184 [ACK] Seq=50442 Ack=1667 Win=19456 Len=1460 [TCP segment of a reassembled PDU]"
"335","51.957668","192.168.1.107","212.83.191.241","TCP","60","49184  >  8000 [ACK] Seq=1667 Ack=51902 Win=65700 Len=0"
"336","51.957911","212.83.191.241","192.168.1.107","TCP","1514","8000  >  49184 [ACK] Seq=51902 Ack=1667 Win=19456 Len=1460 [TCP segment of a reassembled PDU]"
"337","51.958238","212.83.191.241","192.168.1.107","TCP","1514","8000  >  49184 [ACK] Seq=53362 Ack=1667 Win=19456 Len=1460 [TCP segment of a reassembled PDU]"
"338","51.958488","212.83.191.241","192.168.1.107","TCP","1514","8000  >  49184 [ACK] Seq=54822 Ack=1667 Win=19456 Len=1460 [TCP segment of a reassembled PDU]"
"339","51.958492","192.168.1.107","212.83.191.241","TCP","60","49184  >  8000 [ACK] Seq=1667 Ack=54822 Win=65700 Len=0"
"340","51.958494","212.83.191.241","192.168.1.107","TCP","1514","8000  >  49184 [ACK] Seq=56282 Ack=1667 Win=19456 Len=1460 [TCP segment of a reassembled PDU]"
"341","51.958496","192.168.1.107","212.83.191.241","TCP","60","49184  >  8000 [ACK] Seq=1667 Ack=57742 Win=65700 Len=0"
"342","52.072424","212.83.191.241","192.168.1.107","TCP","1514","8000  >  49184 [ACK] Seq=57742 Ack=1667 Win=19456 Len=1460 [TCP segment of a reassembled PDU]"
"343","52.072434","212.83.191.241","192.168.1.107","TCP","1514","8000  >  49184 [ACK] Seq=59202 Ack=1667 Win=19456 Len=1460 [TCP segment of a reassembled PDU]"
"344","52.072626","192.168.1.107","212.83.191.241","TCP","60","49184  >  8000 [ACK] Seq=1667 Ack=60662 Win=65700 Len=0"
"345","52.072921","212.83.191.241","192.168.1.107","TCP","1514","8000  >  49184 [ACK] Seq=60662 Ack=1667 Win=19456 Len=1460 [TCP segment of a reassembled PDU]"
"346","52.073171","212.83.191.241","192.168.1.107","TCP","1514","8000  >  49184 [ACK] Seq=62122 Ack=1667 Win=19456 Len=1460 [TCP segment of a reassembled PDU]"
"347","52.073175","212.83.191.241","192.168.1.107","TCP","1514","8000  >  49184 [ACK] Seq=63582 Ack=1667 Win=19456 Len=1460 [TCP segment of a reassembled PDU]"
"348","52.073177","192.168.1.107","212.83.191.241","TCP","60","49184  >  8000 [ACK] Seq=1667 Ack=63582 Win=65700 Len=0"
"349","52.073421","212.83.191.241","192.168.1.107","TCP","1514","8000  >  49184 [ACK] Seq=65042 Ack=1667 Win=19456 Len=1460 [TCP segment of a reassembled PDU]"
"350","52.073424","212.83.191.241","192.168.1.107","TCP","1514","8000  >  49184 [ACK] Seq=66502 Ack=1667 Win=19456 Len=1460 [TCP segment of a reassembled PDU]"
"351","52.073427","192.168.1.107","212.83.191.241","TCP","60","49184  >  8000 [ACK] Seq=1667 Ack=66502 Win=65700 Len=0"
"352","52.073671","212.83.191.241","192.168.1.107","TCP","1514","8000  >  49184 [ACK] Seq=67962 Ack=1667 Win=19456 Len=1460 [TCP segment of a reassembled PDU]"
"353","52.073676","192.168.1.107","212.83.191.241","TCP","60","49184  >  8000 [ACK] Seq=1667 Ack=69422 Win=65700 Len=0"
"354","52.073968","212.83.191.241","192.168.1.107","TCP","1514","8000  >  49184 [ACK] Seq=69422 Ack=1667 Win=19456 Len=1460 [TCP segment of a reassembled PDU]"
"355","52.076211","212.83.191.241","192.168.1.107","TCP","1514","8000  >  49184 [ACK] Seq=70882 Ack=1667 Win=19456 Len=1460 [TCP segment of a reassembled PDU]"
"356","52.076221","212.83.191.241","192.168.1.107","TCP","1514","8000  >  49184 [ACK] Seq=72342 Ack=1667 Win=19456 Len=1460 [TCP segment of a reassembled PDU]"
"357","52.076225","192.168.1.107","212.83.191.241","TCP","60","49184  >  8000 [ACK] Seq=1667 Ack=72342 Win=65700 Len=0"
"358","52.076659","212.83.191.241","192.168.1.107","TCP","1514","8000  >  49184 [ACK] Seq=73802 Ack=1667 Win=19456 Len=1460 [TCP segment of a reassembled PDU]"
"359","52.076663","192.168.1.107","212.83.191.241","TCP","60","49184  >  8000 [ACK] Seq=1667 Ack=75262 Win=65700 Len=0"
"360","52.076908","212.83.191.241","192.168.1.107","TCP","1514","8000  >  49184 [ACK] Seq=75262 Ack=1667 Win=19456 Len=1460 [TCP segment of a reassembled PDU]"
"361","52.077167","212.83.191.241","192.168.1.107","TCP","1514","8000  >  49184 [ACK] Seq=76722 Ack=1667 Win=19456 Len=1460 [TCP segment of a reassembled PDU]"
"362","52.077171","192.168.1.107","212.83.191.241","TCP","60","49184  >  8000 [ACK] Seq=1667 Ack=78182 Win=65700 Len=0"
"363","52.077786","212.83.191.241","192.168.1.107","TCP","1514","8000  >  49184 [ACK] Seq=78182 Ack=1667 Win=19456 Len=1460 [TCP segment of a reassembled PDU]"
"364","52.085187","212.83.191.241","192.168.1.107","TCP","1514","8000  >  49184 [ACK] Seq=79642 Ack=1667 Win=19456 Len=1460 [TCP segment of a reassembled PDU]"
"365","52.085198","192.168.1.107","212.83.191.241","TCP","60","49184  >  8000 [ACK] Seq=1667 Ack=81102 Win=65700 Len=0"
"366","52.085384","212.83.191.241","192.168.1.107","TCP","1514","8000  >  49184 [ACK] Seq=81102 Ack=1667 Win=19456 Len=1460 [TCP segment of a reassembled PDU]"
"367","52.085635","212.83.191.241","192.168.1.107","TCP","1514","8000  >  49184 [ACK] Seq=82562 Ack=1667 Win=19456 Len=1460 [TCP segment of a reassembled PDU]"
"368","52.085639","192.168.1.107","212.83.191.241","TCP","60","49184  >  8000 [ACK] Seq=1667 Ack=84022 Win=65700 Len=0"
"369","52.085884","212.83.191.241","192.168.1.107","TCP","1514","8000  >  49184 [ACK] Seq=84022 Ack=1667 Win=19456 Len=1460 [TCP segment of a reassembled PDU]"
"370","52.086134","212.83.191.241","192.168.1.107","TCP","1514","8000  >  49184 [ACK] Seq=85482 Ack=1667 Win=19456 Len=1460 [TCP segment of a reassembled PDU]"
"371","52.086137","212.83.191.241","192.168.1.107","TCP","1514","8000  >  49184 [ACK] Seq=86942 Ack=1667 Win=19456 Len=1460 [TCP segment of a reassembled PDU]"
"372","52.086140","192.168.1.107","212.83.191.241","TCP","60","49184  >  8000 [ACK] Seq=1667 Ack=86942 Win=65700 Len=0"
"373","52.086457","212.83.191.241","192.168.1.107","TCP","1514","8000  >  49184 [ACK] Seq=88402 Ack=1667 Win=19456 Len=1460 [TCP segment of a reassembled PDU]"
"374","52.086708","212.83.191.241","192.168.1.107","TCP","1514","8000  >  49184 [ACK] Seq=89862 Ack=1667 Win=19456 Len=1460 [TCP segment of a reassembled PDU]"
"375","52.086712","192.168.1.107","212.83.191.241","TCP","60","49184  >  8000 [ACK] Seq=1667 Ack=89862 Win=65700 Len=0"
"376","52.086957","212.83.191.241","192.168.1.107","TCP","1514","8000  >  49184 [ACK] Seq=91322 Ack=1667 Win=19456 Len=1460 [TCP segment of a reassembled PDU]"
"377","52.086960","212.83.191.241","192.168.1.107","TCP","1514","8000  >  49184 [ACK] Seq=92782 Ack=1667 Win=19456 Len=1460 [TCP segment of a reassembled PDU]"
"378","52.086963","192.168.1.107","212.83.191.241","TCP","60","49184  >  8000 [ACK] Seq=1667 Ack=92782 Win=65700 Len=0"
"379","52.087513","212.83.191.241","192.168.1.107","TCP","1514","8000  >  49184 [ACK] Seq=94242 Ack=1667 Win=19456 Len=1460 [TCP segment of a reassembled PDU]"
"380","52.087755","212.83.191.241","192.168.1.107","TCP","1514","8000  >  49184 [ACK] Seq=95702 Ack=1667 Win=19456 Len=1460 [TCP segment of a reassembled PDU]"
"381","52.087760","192.168.1.107","212.83.191.241","TCP","60","49184  >  8000 [ACK] Seq=1667 Ack=95702 Win=65700 Len=0"
"382","52.200590","212.83.191.241","192.168.1.107","TCP","1514","8000  >  49184 [ACK] Seq=97162 Ack=1667 Win=19456 Len=1460 [TCP segment of a reassembled PDU]"
"383","52.200601","192.168.1.107","212.83.191.241","TCP","60","49184  >  8000 [ACK] Seq=1667 Ack=98622 Win=65700 Len=0"
"384","52.200913","212.83.191.241","192.168.1.107","TCP","1514","8000  >  49184 [ACK] Seq=98622 Ack=1667 Win=19456 Len=1460 [TCP segment of a reassembled PDU]"
"385","52.201163","212.83.191.241","192.168.1.107","TCP","1514","8000  >  49184 [ACK] Seq=100082 Ack=1667 Win=19456 Len=1460 [TCP segment of a reassembled PDU]"
"386","52.201172","212.83.191.241","192.168.1.107","TCP","1514","8000  >  49184 [ACK] Seq=101542 Ack=1667 Win=19456 Len=1460 [TCP segment of a reassembled PDU]"
"387","52.201176","192.168.1.107","212.83.191.241","TCP","60","49184  >  8000 [ACK] Seq=1667 Ack=101542 Win=65700 Len=0"
"388","52.201491","212.83.191.241","192.168.1.107","TCP","1514","8000  >  49184 [ACK] Seq=103002 Ack=1667 Win=19456 Len=1460 [TCP segment of a reassembled PDU]"
"389","52.201499","212.83.191.241","192.168.1.107","HTTP","643","HTTP/1.1 200 OK  (text/html)"
"390","52.201502","192.168.1.107","212.83.191.241","TCP","60","49184  >  8000 [ACK] Seq=1667 Ack=104462 Win=65700 Len=0"
"391","52.401925","192.168.1.107","212.83.191.241","TCP","60","49184  >  8000 [ACK] Seq=1667 Ack=105051 Win=65108 Len=0"
"392","65.202226","192.168.1.107","212.83.191.241","TCP","631","49182  >  8000 [PSH, ACK] Seq=1197 Ack=1569 Win=65700 Len=577 [TCP segment of a reassembled PDU]"
"393","65.209147","192.168.1.107","212.83.191.241","HTTP","805","POST /zwqqobnvwq HTTP/1.1  (application/x-www-form-urlencoded)"
"394","65.338966","212.83.191.241","192.168.1.107","TCP","60","8000  >  49182 [ACK] Seq=1569 Ack=2525 Win=20480 Len=0"
"395","65.365857","212.83.191.241","192.168.1.107","TCP","1514","8000  >  49182 [ACK] Seq=1569 Ack=2525 Win=20480 Len=1460 [TCP segment of a reassembled PDU]"
"396","65.366067","212.83.191.241","192.168.1.107","TCP","1484","8000  >  49182 [PSH, ACK] Seq=3029 Ack=2525 Win=20480 Len=1430 [TCP segment of a reassembled PDU]"
"397","65.366076","212.83.191.241","192.168.1.107","HTTP","60","HTTP/1.1 200 OK  (text/html)"
"398","65.366078","192.168.1.107","212.83.191.241","TCP","60","49182  >  8000 [ACK] Seq=2525 Ack=4464 Win=65700 Len=0"
"399","70.505470","192.168.1.107","8.8.8.8","DNS","98","Standard query 0xd5e0 A aicjm9c5paqtiapsrz3v7nj.allsexopen.com"
"400","70.506563","192.168.1.107","212.83.191.241","TCP","66","49189  >  8000 [SYN] Seq=0 Win=8192 Len=0 MSS=1460 WS=256 SACK_PERM"
"401","70.541937","8.8.8.8","192.168.1.107","DNS","114","Standard query response 0xd5e0 A aicjm9c5paqtiapsrz3v7nj.allsexopen.com A 94.137.122.252"
"402","70.542403","192.168.1.107","94.137.122.252","TCP","66","49190  >  80 [SYN] Seq=0 Win=8192 Len=0 MSS=1460 WS=4 SACK_PERM"
"403","70.643887","212.83.191.241","192.168.1.107","TCP","66","8000  >  49189 [SYN, ACK] Seq=0 Ack=1 Win=14600 Len=0 MSS=1460 SACK_PERM WS=1024"
"404","70.643897","192.168.1.107","212.83.191.241","TCP","60","49189  >  8000 [ACK] Seq=1 Ack=1 Win=65536 Len=0"
"405","70.672370","192.168.1.107","212.83.191.241","HTTP","378","GET /rdcxhvgc?srznbgwatoh=losqjhx HTTP/1.1 "
"406","70.750413","94.137.122.252","192.168.1.107","TCP","66","80  >  49190 [SYN, ACK] Seq=0 Ack=1 Win=5840 Len=0 MSS=1460 SACK_PERM WS=128"
"407","70.750422","192.168.1.107","94.137.122.252","TCP","60","49190  >  80 [ACK] Seq=1 Ack=1 Win=65700 Len=0"
"408","70.750834","192.168.1.107","94.137.122.252","HTTP","532","GET /adsort.php?yy=1&aid=2&atr=exts&src=316 HTTP/1.1 "
"409","70.802230","212.83.191.241","192.168.1.107","TCP","60","8000  >  49189 [ACK] Seq=1 Ack=325 Win=16384 Len=0"
"410","70.830954","212.83.191.241","192.168.1.107","TCP","1514","8000  >  49189 [ACK] Seq=1 Ack=325 Win=16384 Len=1460 [TCP segment of a reassembled PDU]"
"411","70.830964","212.83.191.241","192.168.1.107","TCP","1514","8000  >  49189 [ACK] Seq=1461 Ack=325 Win=16384 Len=1460 [TCP segment of a reassembled PDU]"
"412","70.831151","212.83.191.241","192.168.1.107","TCP","1228","8000  >  49189 [PSH, ACK] Seq=2921 Ack=325 Win=16384 Len=1174 [TCP segment of a reassembled PDU]"
"413","70.831156","192.168.1.107","212.83.191.241","TCP","60","49189  >  8000 [ACK] Seq=325 Ack=2921 Win=65536 Len=0"
"414","70.835688","212.83.191.241","192.168.1.107","TCP","1514","8000  >  49189 [ACK] Seq=4095 Ack=325 Win=16384 Len=1460 [TCP segment of a reassembled PDU]"
"415","70.835700","192.168.1.107","212.83.191.241","TCP","60","49189  >  8000 [ACK] Seq=325 Ack=5555 Win=65536 Len=0"
"416","70.836891","212.83.191.241","192.168.1.107","TCP","1514","8000  >  49189 [ACK] Seq=5555 Ack=325 Win=16384 Len=1460 [TCP segment of a reassembled PDU]"
"417","70.839716","212.83.191.241","192.168.1.107","TCP","1514","8000  >  49189 [ACK] Seq=7015 Ack=325 Win=16384 Len=1460 [TCP segment of a reassembled PDU]"
"418","70.839727","212.83.191.241","192.168.1.107","TCP","1514","8000  >  49189 [ACK] Seq=8475 Ack=325 Win=16384 Len=1460 [TCP segment of a reassembled PDU]"
"419","70.839730","192.168.1.107","212.83.191.241","TCP","60","49189  >  8000 [ACK] Seq=325 Ack=8475 Win=65536 Len=0"
"420","70.839914","212.83.191.241","192.168.1.107","TCP","1514","8000  >  49189 [ACK] Seq=9935 Ack=325 Win=16384 Len=1460 [TCP segment of a reassembled PDU]"
"421","70.839918","192.168.1.107","212.83.191.241","TCP","60","49189  >  8000 [ACK] Seq=325 Ack=11395 Win=65536 Len=0"
"422","70.916302","94.137.122.252","192.168.1.107","TCP","60","80  >  49190 [ACK] Seq=1 Ack=479 Win=6912 Len=0"
"423","70.958617","212.83.191.241","192.168.1.107","TCP","1514","8000  >  49189 [ACK] Seq=11395 Ack=325 Win=16384 Len=1460 [TCP segment of a reassembled PDU]"
"424","70.959558","212.83.191.241","192.168.1.107","TCP","1514","8000  >  49189 [ACK] Seq=12855 Ack=325 Win=16384 Len=1460 [TCP segment of a reassembled PDU]"
"425","70.959568","212.83.191.241","192.168.1.107","TCP","1514","8000  >  49189 [ACK] Seq=14315 Ack=325 Win=16384 Len=1460 [TCP segment of a reassembled PDU]"
"426","70.959572","192.168.1.107","212.83.191.241","TCP","60","49189  >  8000 [ACK] Seq=325 Ack=14315 Win=65536 Len=0"
"427","70.959756","212.83.191.241","192.168.1.107","TCP","1514","8000  >  49189 [ACK] Seq=15775 Ack=325 Win=16384 Len=1460 [TCP segment of a reassembled PDU]"
"428","70.960005","212.83.191.241","192.168.1.107","TCP","1514","8000  >  49189 [ACK] Seq=17235 Ack=325 Win=16384 Len=1460 [TCP segment of a reassembled PDU]"
"429","70.960010","192.168.1.107","212.83.191.241","TCP","60","49189  >  8000 [ACK] Seq=325 Ack=17235 Win=65536 Len=0"
"430","70.965863","212.83.191.241","192.168.1.107","TCP","1514","8000  >  49189 [ACK] Seq=18695 Ack=325 Win=16384 Len=1460 [TCP segment of a reassembled PDU]"
"431","70.965876","212.83.191.241","192.168.1.107","HTTP","247","HTTP/1.1 200 OK  (video/ogg)"
"432","70.965878","192.168.1.107","212.83.191.241","TCP","60","49189  >  8000 [ACK] Seq=325 Ack=20348 Win=65536 Len=0"
"433","71.106324","94.137.122.252","192.168.1.107","HTTP","393","HTTP/1.1 302 Found "
"434","71.107372","192.168.1.107","8.8.8.8","DNS","81","Standard query 0x98af A adultfriendfinder.com"
"435","71.131503","8.8.8.8","192.168.1.107","DNS","97","Standard query response 0x98af A adultfriendfinder.com A 208.88.180.72"
"436","71.304994","192.168.1.107","94.137.122.252","TCP","66","49192  >  80 [SYN] Seq=0 Win=8192 Len=0 MSS=1460 WS=256 SACK_PERM"
"437","71.321835","192.168.1.107","94.137.122.252","TCP","60","49190  >  80 [ACK] Seq=479 Ack=340 Win=65360 Len=0"
"438","71.481550","94.137.122.252","192.168.1.107","TCP","66","80  >  49192 [SYN, ACK] Seq=0 Ack=1 Win=5840 Len=0 MSS=1460 SACK_PERM WS=128"
"439","71.481560","192.168.1.107","94.137.122.252","TCP","60","49192  >  80 [ACK] Seq=1 Ack=1 Win=65536 Len=0"
"440","71.485093","192.168.1.107","94.137.122.252","HTTP","352","GET /META-INF/services/javax.xml.datatype.DatatypeFactory HTTP/1.1 "
"441","71.651634","94.137.122.252","192.168.1.107","TCP","60","80  >  49192 [ACK] Seq=1 Ack=299 Win=6912 Len=0"
"442","71.726776","94.137.122.252","192.168.1.107","HTTP","492","HTTP/1.1 404 Not Found  (text/html)"
"443","71.792702","192.168.1.107","212.83.191.241","HTTP","306","GET /tgpiazr?snbpvk=losqjhx HTTP/1.1 "
"444","71.930307","192.168.1.107","94.137.122.252","TCP","60","49192  >  80 [ACK] Seq=299 Ack=439 Win=65024 Len=0"
"445","71.955187","212.83.191.241","192.168.1.107","TCP","60","8000  >  49189 [ACK] Seq=20348 Ack=577 Win=17408 Len=0"
"446","71.975762","212.83.191.241","192.168.1.107","TCP","1514","8000  >  49189 [ACK] Seq=20348 Ack=577 Win=17408 Len=1460 [TCP segment of a reassembled PDU]"
"447","71.975971","212.83.191.241","192.168.1.107","TCP","1514","8000  >  49189 [ACK] Seq=21808 Ack=577 Win=17408 Len=1460 [TCP segment of a reassembled PDU]"
"448","71.975976","192.168.1.107","212.83.191.241","TCP","60","49189  >  8000 [ACK] Seq=577 Ack=23268 Win=65536 Len=0"
"449","71.976578","212.83.191.241","192.168.1.107","TCP","1228","8000  >  49189 [PSH, ACK] Seq=23268 Ack=577 Win=17408 Len=1174 [TCP segment of a reassembled PDU]"
"450","71.977106","212.83.191.241","192.168.1.107","TCP","1514","8000  >  49189 [ACK] Seq=24442 Ack=577 Win=17408 Len=1460 [TCP segment of a reassembled PDU]"
"451","71.977112","192.168.1.107","212.83.191.241","TCP","60","49189  >  8000 [ACK] Seq=577 Ack=25902 Win=65536 Len=0"
"452","71.978142","212.83.191.241","192.168.1.107","TCP","1514","8000  >  49189 [ACK] Seq=25902 Ack=577 Win=17408 Len=1460 [TCP segment of a reassembled PDU]"
"453","71.978153","212.83.191.241","192.168.1.107","TCP","1230","8000  >  49189 [PSH, ACK] Seq=27362 Ack=577 Win=17408 Len=1176 [TCP segment of a reassembled PDU]"
"454","71.978372","192.168.1.107","212.83.191.241","TCP","60","49189  >  8000 [ACK] Seq=577 Ack=28538 Win=65536 Len=0"
"455","71.979446","212.83.191.241","192.168.1.107","TCP","1514","8000  >  49189 [ACK] Seq=28538 Ack=577 Win=17408 Len=1460 [TCP segment of a reassembled PDU]"
"456","71.979644","212.83.191.241","192.168.1.107","TCP","1514","8000  >  49189 [ACK] Seq=29998 Ack=577 Win=17408 Len=1460 [TCP segment of a reassembled PDU]"
"457","71.979650","192.168.1.107","212.83.191.241","TCP","60","49189  >  8000 [ACK] Seq=577 Ack=31458 Win=65536 Len=0"
"458","71.980641","212.83.191.241","192.168.1.107","TCP","1230","8000  >  49189 [PSH, ACK] Seq=31458 Ack=577 Win=17408 Len=1176 [TCP segment of a reassembled PDU]"
"459","72.033634","212.83.191.241","192.168.1.107","TCP","1514","8000  >  49189 [ACK] Seq=32634 Ack=577 Win=17408 Len=1460 [TCP segment of a reassembled PDU]"
"460","72.033646","192.168.1.107","212.83.191.241","TCP","60","49189  >  8000 [ACK] Seq=577 Ack=34094 Win=65536 Len=0"
"461","72.103564","212.83.191.241","192.168.1.107","TCP","1514","8000  >  49189 [ACK] Seq=34094 Ack=577 Win=17408 Len=1460 [TCP segment of a reassembled PDU]"
"462","72.103792","212.83.191.241","192.168.1.107","TCP","1514","8000  >  49189 [ACK] Seq=35554 Ack=577 Win=17408 Len=1460 [TCP segment of a reassembled PDU]"
"463","72.103798","192.168.1.107","212.83.191.241","TCP","60","49189  >  8000 [ACK] Seq=577 Ack=37014 Win=65536 Len=0"
"464","72.104042","212.83.191.241","192.168.1.107","TCP","1514","8000  >  49189 [ACK] Seq=37014 Ack=577 Win=17408 Len=1460 [TCP segment of a reassembled PDU]"
"465","72.104929","212.83.191.241","192.168.1.107","TCP","1514","8000  >  49189 [ACK] Seq=38474 Ack=577 Win=17408 Len=1460 [TCP segment of a reassembled PDU]"
"466","72.105127","212.83.191.241","192.168.1.107","TCP","1514","8000  >  49189 [ACK] Seq=39934 Ack=577 Win=17408 Len=1460 [TCP segment of a reassembled PDU]"
"467","72.105131","192.168.1.107","212.83.191.241","TCP","60","49189  >  8000 [ACK] Seq=577 Ack=39934 Win=65536 Len=0"
"468","72.105376","212.83.191.241","192.168.1.107","TCP","1514","8000  >  49189 [ACK] Seq=41394 Ack=577 Win=17408 Len=1460 [TCP segment of a reassembled PDU]"
"469","72.105627","212.83.191.241","192.168.1.107","TCP","1514","8000  >  49189 [ACK] Seq=42854 Ack=577 Win=17408 Len=1460 [TCP segment of a reassembled PDU]"
"470","72.105631","192.168.1.107","212.83.191.241","TCP","60","49189  >  8000 [ACK] Seq=577 Ack=42854 Win=65536 Len=0"
"471","72.105962","212.83.191.241","192.168.1.107","TCP","1514","8000  >  49189 [ACK] Seq=44314 Ack=577 Win=17408 Len=1460 [TCP segment of a reassembled PDU]"
"472","72.105966","192.168.1.107","212.83.191.241","TCP","60","49189  >  8000 [ACK] Seq=577 Ack=45774 Win=65536 Len=0"
"473","72.106212","212.83.191.241","192.168.1.107","TCP","1514","8000  >  49189 [ACK] Seq=45774 Ack=577 Win=17408 Len=1460 [TCP segment of a reassembled PDU]"
"474","72.106599","212.83.191.241","192.168.1.107","TCP","1514","8000  >  49189 [ACK] Seq=47234 Ack=577 Win=17408 Len=1460 [TCP segment of a reassembled PDU]"
"475","72.106603","192.168.1.107","212.83.191.241","TCP","60","49189  >  8000 [ACK] Seq=577 Ack=48694 Win=65536 Len=0"
"476","72.106849","212.83.191.241","192.168.1.107","TCP","1514","8000  >  49189 [ACK] Seq=48694 Ack=577 Win=17408 Len=1460 [TCP segment of a reassembled PDU]"
"477","72.107098","212.83.191.241","192.168.1.107","TCP","1514","8000  >  49189 [ACK] Seq=50154 Ack=577 Win=17408 Len=1460 [TCP segment of a reassembled PDU]"
"478","72.107103","192.168.1.107","212.83.191.241","TCP","60","49189  >  8000 [ACK] Seq=577 Ack=51614 Win=65536 Len=0"
"479","72.184939","212.83.191.241","192.168.1.107","TCP","1514","8000  >  49189 [ACK] Seq=51614 Ack=577 Win=17408 Len=1460 [TCP segment of a reassembled PDU]"
"480","72.185209","212.83.191.241","192.168.1.107","TCP","1514","8000  >  49189 [ACK] Seq=53074 Ack=577 Win=17408 Len=1460 [TCP segment of a reassembled PDU]"
"481","72.185460","192.168.1.107","212.83.191.241","TCP","60","49189  >  8000 [ACK] Seq=577 Ack=54534 Win=65536 Len=0"
"482","72.185463","212.83.191.241","192.168.1.107","TCP","1514","8000  >  49189 [ACK] Seq=54534 Ack=577 Win=17408 Len=1460 [TCP segment of a reassembled PDU]"
"483","72.234028","212.83.191.241","192.168.1.107","TCP","1514","8000  >  49189 [ACK] Seq=55994 Ack=577 Win=17408 Len=1460 [TCP segment of a reassembled PDU]"
"484","72.234040","192.168.1.107","212.83.191.241","TCP","60","49189  >  8000 [ACK] Seq=577 Ack=57454 Win=65536 Len=0"
"485","72.234326","212.83.191.241","192.168.1.107","TCP","1514","8000  >  49189 [ACK] Seq=57454 Ack=577 Win=17408 Len=1460 [TCP segment of a reassembled PDU]"
"486","72.234577","212.83.191.241","192.168.1.107","TCP","1514","8000  >  49189 [ACK] Seq=58914 Ack=577 Win=17408 Len=1460 [TCP segment of a reassembled PDU]"
"487","72.234582","192.168.1.107","212.83.191.241","TCP","60","49189  >  8000 [ACK] Seq=577 Ack=60374 Win=65536 Len=0"
"488","72.234825","212.83.191.241","192.168.1.107","TCP","1514","8000  >  49189 [ACK] Seq=60374 Ack=577 Win=17408 Len=1460 [TCP segment of a reassembled PDU]"
"489","72.234829","212.83.191.241","192.168.1.107","TCP","1514","8000  >  49189 [ACK] Seq=61834 Ack=577 Win=17408 Len=1460 [TCP segment of a reassembled PDU]"
"490","72.235075","212.83.191.241","192.168.1.107","TCP","1514","8000  >  49189 [ACK] Seq=63294 Ack=577 Win=17408 Len=1460 [TCP segment of a reassembled PDU]"
"491","72.235080","192.168.1.107","212.83.191.241","TCP","60","49189  >  8000 [ACK] Seq=577 Ack=63294 Win=65536 Len=0"
"492","72.235325","212.83.191.241","192.168.1.107","TCP","1514","8000  >  49189 [ACK] Seq=64754 Ack=577 Win=17408 Len=1460 [TCP segment of a reassembled PDU]"
"493","72.235329","212.83.191.241","192.168.1.107","TCP","1514","8000  >  49189 [ACK] Seq=66214 Ack=577 Win=17408 Len=1460 [TCP segment of a reassembled PDU]"
"494","72.235331","192.168.1.107","212.83.191.241","TCP","60","49189  >  8000 [ACK] Seq=577 Ack=66214 Win=65536 Len=0"
"495","72.235576","212.83.191.241","192.168.1.107","TCP","1514","8000  >  49189 [ACK] Seq=67674 Ack=577 Win=17408 Len=1460 [TCP segment of a reassembled PDU]"
"496","72.235580","192.168.1.107","212.83.191.241","TCP","60","49189  >  8000 [ACK] Seq=577 Ack=69134 Win=65536 Len=0"
"497","72.235825","212.83.191.241","192.168.1.107","TCP","1514","8000  >  49189 [ACK] Seq=69134 Ack=577 Win=17408 Len=1460 [TCP segment of a reassembled PDU]"
"498","72.236545","212.83.191.241","192.168.1.107","TCP","1514","8000  >  49189 [ACK] Seq=70594 Ack=577 Win=17408 Len=1460 [TCP segment of a reassembled PDU]"
"499","72.236557","192.168.1.107","212.83.191.241","TCP","60","49189  >  8000 [ACK] Seq=577 Ack=72054 Win=65536 Len=0"
"500","72.236743","212.83.191.241","192.168.1.107","TCP","1514","8000  >  49189 [ACK] Seq=72054 Ack=577 Win=17408 Len=1460 [TCP segment of a reassembled PDU]"
"501","72.236993","212.83.191.241","192.168.1.107","TCP","1514","8000  >  49189 [ACK] Seq=73514 Ack=577 Win=17408 Len=1460 [TCP segment of a reassembled PDU]"
"502","72.236997","192.168.1.107","212.83.191.241","TCP","60","49189  >  8000 [ACK] Seq=577 Ack=74974 Win=65536 Len=0"
"503","72.237242","212.83.191.241","192.168.1.107","TCP","1514","8000  >  49189 [ACK] Seq=74974 Ack=577 Win=17408 Len=1460 [TCP segment of a reassembled PDU]"
"504","72.237246","212.83.191.241","192.168.1.107","TCP","1514","8000  >  49189 [ACK] Seq=76434 Ack=577 Win=17408 Len=1460 [TCP segment of a reassembled PDU]"
"505","72.237500","192.168.1.107","212.83.191.241","TCP","60","49189  >  8000 [ACK] Seq=577 Ack=77894 Win=65536 Len=0"
"506","72.314200","212.83.191.241","192.168.1.107","TCP","1514","8000  >  49189 [ACK] Seq=77894 Ack=577 Win=17408 Len=1460 [TCP segment of a reassembled PDU]"
"507","72.314543","212.83.191.241","192.168.1.107","TCP","1514","8000  >  49189 [ACK] Seq=79354 Ack=577 Win=17408 Len=1460 [TCP segment of a reassembled PDU]"
"508","72.314791","212.83.191.241","192.168.1.107","TCP","1514","8000  >  49189 [ACK] Seq=80814 Ack=577 Win=17408 Len=1460 [TCP segment of a reassembled PDU]"
"509","72.314797","192.168.1.107","212.83.191.241","TCP","60","49189  >  8000 [ACK] Seq=577 Ack=80814 Win=65536 Len=0"
"510","72.315046","212.83.191.241","192.168.1.107","TCP","1514","8000  >  49189 [ACK] Seq=82274 Ack=577 Win=17408 Len=1460 [TCP segment of a reassembled PDU]"
"511","72.315297","212.83.191.241","192.168.1.107","TCP","1514","8000  >  49189 [ACK] Seq=83734 Ack=577 Win=17408 Len=1460 [TCP segment of a reassembled PDU]"
"512","72.315304","192.168.1.107","212.83.191.241","TCP","60","49189  >  8000 [ACK] Seq=577 Ack=83734 Win=65536 Len=0"
"513","72.315548","212.83.191.241","192.168.1.107","TCP","1514","8000  >  49189 [ACK] Seq=85194 Ack=577 Win=17408 Len=1460 [TCP segment of a reassembled PDU]"
"514","72.315555","192.168.1.107","212.83.191.241","TCP","60","49189  >  8000 [ACK] Seq=577 Ack=86654 Win=65536 Len=0"
"515","72.367185","212.83.191.241","192.168.1.107","TCP","1514","8000  >  49189 [ACK] Seq=86654 Ack=577 Win=17408 Len=1460 [TCP segment of a reassembled PDU]"
"516","72.367503","212.83.191.241","192.168.1.107","TCP","1514","8000  >  49189 [ACK] Seq=88114 Ack=577 Win=17408 Len=1460 [TCP segment of a reassembled PDU]"
"517","72.367754","212.83.191.241","192.168.1.107","TCP","1514","8000  >  49189 [ACK] Seq=89574 Ack=577 Win=17408 Len=1460 [TCP segment of a reassembled PDU]"
"518","72.367758","192.168.1.107","212.83.191.241","TCP","60","49189  >  8000 [ACK] Seq=577 Ack=89574 Win=65536 Len=0"
"519","72.368003","212.83.191.241","192.168.1.107","TCP","1514","8000  >  49189 [ACK] Seq=91034 Ack=577 Win=17408 Len=1460 [TCP segment of a reassembled PDU]"
"520","72.368006","212.83.191.241","192.168.1.107","TCP","1514","8000  >  49189 [ACK] Seq=92494 Ack=577 Win=17408 Len=1460 [TCP segment of a reassembled PDU]"
"521","72.368009","192.168.1.107","212.83.191.241","TCP","60","49189  >  8000 [ACK] Seq=577 Ack=92494 Win=65536 Len=0"
"522","72.368252","212.83.191.241","192.168.1.107","TCP","1514","8000  >  49189 [ACK] Seq=93954 Ack=577 Win=17408 Len=1460 [TCP segment of a reassembled PDU]"
"523","72.368257","192.168.1.107","212.83.191.241","TCP","60","49189  >  8000 [ACK] Seq=577 Ack=95414 Win=65536 Len=0"
"524","72.368509","212.83.191.241","192.168.1.107","TCP","1514","8000  >  49189 [ACK] Seq=95414 Ack=577 Win=17408 Len=1460 [TCP segment of a reassembled PDU]"
"525","72.368760","212.83.191.241","192.168.1.107","TCP","1514","8000  >  49189 [ACK] Seq=96874 Ack=577 Win=17408 Len=1460 [TCP segment of a reassembled PDU]"
"526","72.368764","212.83.191.241","192.168.1.107","TCP","1514","8000  >  49189 [ACK] Seq=98334 Ack=577 Win=17408 Len=1460 [TCP segment of a reassembled PDU]"
"527","72.368766","192.168.1.107","212.83.191.241","TCP","60","49189  >  8000 [ACK] Seq=577 Ack=98334 Win=65536 Len=0"
"528","72.368768","212.83.191.241","192.168.1.107","TCP","1514","8000  >  49189 [ACK] Seq=99794 Ack=577 Win=17408 Len=1460 [TCP segment of a reassembled PDU]"
"529","72.369009","212.83.191.241","192.168.1.107","TCP","1514","8000  >  49189 [ACK] Seq=101254 Ack=577 Win=17408 Len=1460 [TCP segment of a reassembled PDU]"
"530","72.369013","192.168.1.107","212.83.191.241","TCP","60","49189  >  8000 [ACK] Seq=577 Ack=101254 Win=65536 Len=0"
"531","72.369567","212.83.191.241","192.168.1.107","TCP","1514","8000  >  49189 [ACK] Seq=102714 Ack=577 Win=17408 Len=1460 [TCP segment of a reassembled PDU]"
"532","72.369573","212.83.191.241","192.168.1.107","TCP","1514","8000  >  49189 [ACK] Seq=104174 Ack=577 Win=17408 Len=1460 [TCP segment of a reassembled PDU]"
"533","72.369576","192.168.1.107","212.83.191.241","TCP","60","49189  >  8000 [ACK] Seq=577 Ack=104174 Win=65536 Len=0"
"534","72.369804","212.83.191.241","192.168.1.107","TCP","1514","8000  >  49189 [ACK] Seq=105634 Ack=577 Win=17408 Len=1460 [TCP segment of a reassembled PDU]"
"535","72.369807","192.168.1.107","212.83.191.241","TCP","60","49189  >  8000 [ACK] Seq=577 Ack=107094 Win=65536 Len=0"
"536","72.370054","212.83.191.241","192.168.1.107","TCP","1514","8000  >  49189 [ACK] Seq=107094 Ack=577 Win=17408 Len=1460 [TCP segment of a reassembled PDU]"
"537","72.370057","212.83.191.241","192.168.1.107","TCP","1514","8000  >  49189 [ACK] Seq=108554 Ack=577 Win=17408 Len=1460 [TCP segment of a reassembled PDU]"
"538","72.370304","192.168.1.107","212.83.191.241","TCP","60","49189  >  8000 [ACK] Seq=577 Ack=110014 Win=65536 Len=0"
"539","72.370307","212.83.191.241","192.168.1.107","TCP","1514","8000  >  49189 [ACK] Seq=110014 Ack=577 Win=17408 Len=1460 [TCP segment of a reassembled PDU]"
"540","72.370554","212.83.191.241","192.168.1.107","TCP","1514","8000  >  49189 [ACK] Seq=111474 Ack=577 Win=17408 Len=1460 [TCP segment of a reassembled PDU]"
"541","72.370558","192.168.1.107","212.83.191.241","TCP","60","49189  >  8000 [ACK] Seq=577 Ack=112934 Win=65536 Len=0"
"542","72.438142","212.83.191.241","192.168.1.107","TCP","1514","8000  >  49189 [ACK] Seq=112934 Ack=577 Win=17408 Len=1460 [TCP segment of a reassembled PDU]"
"543","72.438459","212.83.191.241","192.168.1.107","TCP","1514","8000  >  49189 [ACK] Seq=114394 Ack=577 Win=17408 Len=1460 [TCP segment of a reassembled PDU]"
"544","72.438710","212.83.191.241","192.168.1.107","TCP","1514","8000  >  49189 [ACK] Seq=115854 Ack=577 Win=17408 Len=1460 [TCP segment of a reassembled PDU]"
"545","72.438714","192.168.1.107","212.83.191.241","TCP","60","49189  >  8000 [ACK] Seq=577 Ack=115854 Win=65536 Len=0"
"546","72.438716","212.83.191.241","192.168.1.107","TCP","1514","8000  >  49189 [ACK] Seq=117314 Ack=577 Win=17408 Len=1460 [TCP segment of a reassembled PDU]"
"547","72.438958","212.83.191.241","192.168.1.107","TCP","1514","8000  >  49189 [ACK] Seq=118774 Ack=577 Win=17408 Len=1460 [TCP segment of a reassembled PDU]"
"548","72.438963","192.168.1.107","212.83.191.241","TCP","60","49189  >  8000 [ACK] Seq=577 Ack=118774 Win=65536 Len=0"
"549","72.438964","212.83.191.241","192.168.1.107","TCP","1514","8000  >  49189 [ACK] Seq=120234 Ack=577 Win=17408 Len=1460 [TCP segment of a reassembled PDU]"
"550","72.439209","192.168.1.107","212.83.191.241","TCP","60","49189  >  8000 [ACK] Seq=577 Ack=121694 Win=65536 Len=0"
"551","72.439459","212.83.191.241","192.168.1.107","TCP","1514","8000  >  49189 [ACK] Seq=121694 Ack=577 Win=17408 Len=1460 [TCP segment of a reassembled PDU]"
"552","72.439462","212.83.191.241","192.168.1.107","TCP","1514","8000  >  49189 [ACK] Seq=123154 Ack=577 Win=17408 Len=1460 [TCP segment of a reassembled PDU]"
"553","72.439709","212.83.191.241","192.168.1.107","TCP","1514","8000  >  49189 [ACK] Seq=124614 Ack=577 Win=17408 Len=1460 [TCP segment of a reassembled PDU]"
"554","72.439714","192.168.1.107","212.83.191.241","TCP","60","49189  >  8000 [ACK] Seq=577 Ack=124614 Win=65536 Len=0"
"555","72.441523","212.83.191.241","192.168.1.107","TCP","1514","8000  >  49189 [ACK] Seq=126074 Ack=577 Win=17408 Len=1460 [TCP segment of a reassembled PDU]"
"556","72.441534","192.168.1.107","212.83.191.241","TCP","60","49189  >  8000 [ACK] Seq=577 Ack=127534 Win=65536 Len=0"
"557","72.441720","212.83.191.241","192.168.1.107","TCP","1514","8000  >  49189 [ACK] Seq=127534 Ack=577 Win=17408 Len=1460 [TCP segment of a reassembled PDU]"
"558","72.442005","212.83.191.241","192.168.1.107","TCP","1514","8000  >  49189 [ACK] Seq=128994 Ack=577 Win=17408 Len=1460 [TCP segment of a reassembled PDU]"
"559","72.442010","192.168.1.107","212.83.191.241","TCP","60","49189  >  8000 [ACK] Seq=577 Ack=130454 Win=65536 Len=0"
"560","72.498830","212.83.191.241","192.168.1.107","TCP","1514","8000  >  49189 [ACK] Seq=130454 Ack=577 Win=17408 Len=1460 [TCP segment of a reassembled PDU]"
"561","72.499028","212.83.191.241","192.168.1.107","TCP","1514","8000  >  49189 [ACK] Seq=131914 Ack=577 Win=17408 Len=1460 [TCP segment of a reassembled PDU]"
"562","72.499033","192.168.1.107","212.83.191.241","TCP","60","49189  >  8000 [ACK] Seq=577 Ack=133374 Win=65536 Len=0"
"563","72.499618","212.83.191.241","192.168.1.107","TCP","1514","8000  >  49189 [ACK] Seq=133374 Ack=577 Win=17408 Len=1460 [TCP segment of a reassembled PDU]"
"564","72.499868","212.83.191.241","192.168.1.107","TCP","1514","8000  >  49189 [ACK] Seq=134834 Ack=577 Win=17408 Len=1460 [TCP segment of a reassembled PDU]"
"565","72.499872","192.168.1.107","212.83.191.241","TCP","60","49189  >  8000 [ACK] Seq=577 Ack=136294 Win=65536 Len=0"
"566","72.501718","212.83.191.241","192.168.1.107","TCP","1514","8000  >  49189 [ACK] Seq=136294 Ack=577 Win=17408 Len=1460 [TCP segment of a reassembled PDU]"
"567","72.501950","212.83.191.241","192.168.1.107","TCP","1514","8000  >  49189 [ACK] Seq=137754 Ack=577 Win=17408 Len=1460 [TCP segment of a reassembled PDU]"
"568","72.501956","192.168.1.107","212.83.191.241","TCP","60","49189  >  8000 [ACK] Seq=577 Ack=139214 Win=65536 Len=0"
"569","72.502851","212.83.191.241","192.168.1.107","TCP","1514","8000  >  49189 [ACK] Seq=139214 Ack=577 Win=17408 Len=1460 [TCP segment of a reassembled PDU]"
"570","72.503156","212.83.191.241","192.168.1.107","TCP","1514","8000  >  49189 [ACK] Seq=140674 Ack=577 Win=17408 Len=1460 [TCP segment of a reassembled PDU]"
"571","72.503406","192.168.1.107","212.83.191.241","TCP","60","49189  >  8000 [ACK] Seq=577 Ack=142134 Win=65536 Len=0"
"572","72.504238","212.83.191.241","192.168.1.107","TCP","1514","8000  >  49189 [ACK] Seq=142134 Ack=577 Win=17408 Len=1460 [TCP segment of a reassembled PDU]"
"573","72.504729","212.83.191.241","192.168.1.107","TCP","1514","8000  >  49189 [ACK] Seq=143594 Ack=577 Win=17408 Len=1460 [TCP segment of a reassembled PDU]"
"574","72.504734","192.168.1.107","212.83.191.241","TCP","60","49189  >  8000 [ACK] Seq=577 Ack=145054 Win=65536 Len=0"
"575","72.505221","212.83.191.241","192.168.1.107","TCP","1514","8000  >  49189 [ACK] Seq=145054 Ack=577 Win=17408 Len=1460 [TCP segment of a reassembled PDU]"
"576","72.505471","212.83.191.241","192.168.1.107","TCP","1514","8000  >  49189 [ACK] Seq=146514 Ack=577 Win=17408 Len=1460 [TCP segment of a reassembled PDU]"
"577","72.505475","192.168.1.107","212.83.191.241","TCP","60","49189  >  8000 [ACK] Seq=577 Ack=147974 Win=65536 Len=0"
"578","72.506175","212.83.191.241","192.168.1.107","TCP","1514","8000  >  49189 [ACK] Seq=147974 Ack=577 Win=17408 Len=1460 [TCP segment of a reassembled PDU]"
"579","72.506522","212.83.191.241","192.168.1.107","TCP","1514","8000  >  49189 [ACK] Seq=149434 Ack=577 Win=17408 Len=1460 [TCP segment of a reassembled PDU]"
"580","72.506527","192.168.1.107","212.83.191.241","TCP","60","49189  >  8000 [ACK] Seq=577 Ack=150894 Win=65536 Len=0"
"581","72.506800","212.83.191.241","192.168.1.107","TCP","1514","8000  >  49189 [ACK] Seq=150894 Ack=577 Win=17408 Len=1460 [TCP segment of a reassembled PDU]"
"582","72.507097","212.83.191.241","192.168.1.107","TCP","1514","8000  >  49189 [ACK] Seq=152354 Ack=577 Win=17408 Len=1460 [TCP segment of a reassembled PDU]"
"583","72.507348","192.168.1.107","212.83.191.241","TCP","60","49189  >  8000 [ACK] Seq=577 Ack=153814 Win=65536 Len=0"
"584","72.507351","212.83.191.241","192.168.1.107","TCP","1514","8000  >  49189 [ACK] Seq=153814 Ack=577 Win=17408 Len=1460 [TCP segment of a reassembled PDU]"
"585","72.507765","212.83.191.241","192.168.1.107","TCP","1514","8000  >  49189 [ACK] Seq=155274 Ack=577 Win=17408 Len=1460 [TCP segment of a reassembled PDU]"
"586","72.507769","192.168.1.107","212.83.191.241","TCP","60","49189  >  8000 [ACK] Seq=577 Ack=156734 Win=65536 Len=0"
"587","72.508091","212.83.191.241","192.168.1.107","TCP","1514","8000  >  49189 [ACK] Seq=156734 Ack=577 Win=17408 Len=1460 [TCP segment of a reassembled PDU]"
"588","72.508341","212.83.191.241","192.168.1.107","TCP","1514","8000  >  49189 [ACK] Seq=158194 Ack=577 Win=17408 Len=1460 [TCP segment of a reassembled PDU]"
"589","72.508344","192.168.1.107","212.83.191.241","TCP","60","49189  >  8000 [ACK] Seq=577 Ack=159654 Win=65536 Len=0"
"590","72.508993","212.83.191.241","192.168.1.107","TCP","1514","8000  >  49189 [ACK] Seq=159654 Ack=577 Win=17408 Len=1460 [TCP segment of a reassembled PDU]"
"591","72.509305","212.83.191.241","192.168.1.107","TCP","1514","8000  >  49189 [ACK] Seq=161114 Ack=577 Win=17408 Len=1460 [TCP segment of a reassembled PDU]"
"592","72.509309","192.168.1.107","212.83.191.241","TCP","60","49189  >  8000 [ACK] Seq=577 Ack=162574 Win=65536 Len=0"
"593","72.563684","212.83.191.241","192.168.1.107","TCP","1514","8000  >  49189 [ACK] Seq=162574 Ack=577 Win=17408 Len=1460 [TCP segment of a reassembled PDU]"
"594","72.563928","212.83.191.241","192.168.1.107","TCP","1514","8000  >  49189 [ACK] Seq=164034 Ack=577 Win=17408 Len=1460 [TCP segment of a reassembled PDU]"
"595","72.563932","212.83.191.241","192.168.1.107","TCP","1514","8000  >  49189 [ACK] Seq=165494 Ack=577 Win=17408 Len=1460 [TCP segment of a reassembled PDU]"
"596","72.563936","192.168.1.107","212.83.191.241","TCP","60","49189  >  8000 [ACK] Seq=577 Ack=165494 Win=141568 Len=0"
"597","72.564427","212.83.191.241","192.168.1.107","TCP","1514","8000  >  49189 [ACK] Seq=166954 Ack=577 Win=17408 Len=1460 [TCP segment of a reassembled PDU]"
"598","72.564431","212.83.191.241","192.168.1.107","TCP","1514","8000  >  49189 [ACK] Seq=168414 Ack=577 Win=17408 Len=1460 [TCP segment of a reassembled PDU]"
"599","72.564433","192.168.1.107","212.83.191.241","TCP","60","49189  >  8000 [ACK] Seq=577 Ack=168414 Win=141568 Len=0"
"600","72.564700","212.83.191.241","192.168.1.107","TCP","1514","8000  >  49189 [ACK] Seq=169874 Ack=577 Win=17408 Len=1460 [TCP segment of a reassembled PDU]"
"601","72.564949","212.83.191.241","192.168.1.107","TCP","1514","8000  >  49189 [ACK] Seq=171334 Ack=577 Win=17408 Len=1460 [TCP segment of a reassembled PDU]"
"602","72.564953","192.168.1.107","212.83.191.241","TCP","60","49189  >  8000 [ACK] Seq=577 Ack=171334 Win=141568 Len=0"
"603","72.565199","212.83.191.241","192.168.1.107","TCP","1514","8000  >  49189 [ACK] Seq=172794 Ack=577 Win=17408 Len=1460 [TCP segment of a reassembled PDU]"
"604","72.565202","192.168.1.107","212.83.191.241","TCP","60","49189  >  8000 [ACK] Seq=577 Ack=174254 Win=141568 Len=0"
"605","72.565448","212.83.191.241","192.168.1.107","TCP","1514","8000  >  49189 [ACK] Seq=174254 Ack=577 Win=17408 Len=1460 [TCP segment of a reassembled PDU]"
"606","72.565452","212.83.191.241","192.168.1.107","TCP","1514","8000  >  49189 [ACK] Seq=175714 Ack=577 Win=17408 Len=1460 [TCP segment of a reassembled PDU]"
"607","72.565455","192.168.1.107","212.83.191.241","TCP","60","49189  >  8000 [ACK] Seq=577 Ack=177174 Win=141568 Len=0"
"608","72.565808","212.83.191.241","192.168.1.107","TCP","1514","8000  >  49189 [ACK] Seq=177174 Ack=577 Win=17408 Len=1460 [TCP segment of a reassembled PDU]"
"609","72.567846","212.83.191.241","192.168.1.107","TCP","1514","8000  >  49189 [ACK] Seq=178634 Ack=577 Win=17408 Len=1460 [TCP segment of a reassembled PDU]"
"610","72.567858","192.168.1.107","212.83.191.241","TCP","60","49189  >  8000 [ACK] Seq=577 Ack=180094 Win=141568 Len=0"
"611","72.568044","212.83.191.241","192.168.1.107","TCP","1514","8000  >  49189 [ACK] Seq=180094 Ack=577 Win=17408 Len=1460 [TCP segment of a reassembled PDU]"
"612","72.568294","212.83.191.241","192.168.1.107","TCP","1514","8000  >  49189 [ACK] Seq=181554 Ack=577 Win=17408 Len=1460 [TCP segment of a reassembled PDU]"
"613","72.568298","192.168.1.107","212.83.191.241","TCP","60","49189  >  8000 [ACK] Seq=577 Ack=183014 Win=141568 Len=0"
"614","72.568545","212.83.191.241","192.168.1.107","TCP","1514","8000  >  49189 [ACK] Seq=183014 Ack=577 Win=17408 Len=1460 [TCP segment of a reassembled PDU]"
"615","72.568793","212.83.191.241","192.168.1.107","TCP","1514","8000  >  49189 [ACK] Seq=184474 Ack=577 Win=17408 Len=1460 [TCP segment of a reassembled PDU]"
"616","72.568797","212.83.191.241","192.168.1.107","TCP","1514","8000  >  49189 [ACK] Seq=185934 Ack=577 Win=17408 Len=1460 [TCP segment of a reassembled PDU]"
"617","72.568800","192.168.1.107","212.83.191.241","TCP","60","49189  >  8000 [ACK] Seq=577 Ack=185934 Win=141568 Len=0"
"618","72.569099","212.83.191.241","192.168.1.107","TCP","1514","8000  >  49189 [ACK] Seq=187394 Ack=577 Win=17408 Len=1460 [TCP segment of a reassembled PDU]"
"619","72.569349","212.83.191.241","192.168.1.107","TCP","1514","8000  >  49189 [ACK] Seq=188854 Ack=577 Win=17408 Len=1460 [TCP segment of a reassembled PDU]"
"620","72.569353","192.168.1.107","212.83.191.241","TCP","60","49189  >  8000 [ACK] Seq=577 Ack=188854 Win=141568 Len=0"
"621","72.569354","212.83.191.241","192.168.1.107","TCP","1514","8000  >  49189 [ACK] Seq=190314 Ack=577 Win=17408 Len=1460 [TCP segment of a reassembled PDU]"
"622","72.569600","212.83.191.241","192.168.1.107","TCP","1514","8000  >  49189 [ACK] Seq=191774 Ack=577 Win=17408 Len=1460 [TCP segment of a reassembled PDU]"
"623","72.569605","192.168.1.107","212.83.191.241","TCP","60","49189  >  8000 [ACK] Seq=577 Ack=191774 Win=141568 Len=0"
"624","72.569956","212.83.191.241","192.168.1.107","TCP","1514","8000  >  49189 [ACK] Seq=193234 Ack=577 Win=17408 Len=1460 [TCP segment of a reassembled PDU]"
"625","72.569960","192.168.1.107","212.83.191.241","TCP","60","49189  >  8000 [ACK] Seq=577 Ack=194694 Win=141568 Len=0"
"626","72.629801","212.83.191.241","192.168.1.107","TCP","1514","8000  >  49189 [ACK] Seq=194694 Ack=577 Win=17408 Len=1460 [TCP segment of a reassembled PDU]"
"627","72.629811","212.83.191.241","192.168.1.107","TCP","1514","8000  >  49189 [ACK] Seq=196154 Ack=577 Win=17408 Len=1460 [TCP segment of a reassembled PDU]"
"628","72.629815","192.168.1.107","212.83.191.241","TCP","60","49189  >  8000 [ACK] Seq=577 Ack=197614 Win=158976 Len=0"
"629","72.630248","212.83.191.241","192.168.1.107","TCP","1514","8000  >  49189 [ACK] Seq=197614 Ack=577 Win=17408 Len=1460 [TCP segment of a reassembled PDU]"
"630","72.630252","212.83.191.241","192.168.1.107","TCP","1514","8000  >  49189 [ACK] Seq=199074 Ack=577 Win=17408 Len=1460 [TCP segment of a reassembled PDU]"
"631","72.630255","192.168.1.107","212.83.191.241","TCP","60","49189  >  8000 [ACK] Seq=577 Ack=200534 Win=158976 Len=0"
"632","72.630498","212.83.191.241","192.168.1.107","TCP","1514","8000  >  49189 [ACK] Seq=200534 Ack=577 Win=17408 Len=1460 [TCP segment of a reassembled PDU]"
"633","72.630749","212.83.191.241","192.168.1.107","TCP","1514","8000  >  49189 [ACK] Seq=201994 Ack=577 Win=17408 Len=1460 [TCP segment of a reassembled PDU]"
"634","72.630753","192.168.1.107","212.83.191.241","TCP","60","49189  >  8000 [ACK] Seq=577 Ack=203454 Win=158976 Len=0"
"635","72.634449","212.83.191.241","192.168.1.107","TCP","1514","8000  >  49189 [ACK] Seq=203454 Ack=577 Win=17408 Len=1460 [TCP segment of a reassembled PDU]"
"636","72.634768","212.83.191.241","192.168.1.107","TCP","1514","8000  >  49189 [ACK] Seq=204914 Ack=577 Win=17408 Len=1460 [TCP segment of a reassembled PDU]"
"637","72.635017","212.83.191.241","192.168.1.107","TCP","1514","8000  >  49189 [ACK] Seq=206374 Ack=577 Win=17408 Len=1460 [TCP segment of a reassembled PDU]"
"638","72.635022","192.168.1.107","212.83.191.241","TCP","60","49189  >  8000 [ACK] Seq=577 Ack=206374 Win=156160 Len=0"
"639","72.635267","212.83.191.241","192.168.1.107","TCP","1514","8000  >  49189 [ACK] Seq=207834 Ack=577 Win=17408 Len=1460 [TCP segment of a reassembled PDU]"
"640","72.635270","212.83.191.241","192.168.1.107","TCP","1514","8000  >  49189 [ACK] Seq=209294 Ack=577 Win=17408 Len=1460 [TCP segment of a reassembled PDU]"
"641","72.635274","192.168.1.107","212.83.191.241","TCP","60","49189  >  8000 [ACK] Seq=577 Ack=209294 Win=156160 Len=0"
"642","72.635517","212.83.191.241","192.168.1.107","TCP","1514","8000  >  49189 [ACK] Seq=210754 Ack=577 Win=17408 Len=1460 [TCP segment of a reassembled PDU]"
"643","72.635521","192.168.1.107","212.83.191.241","TCP","60","49189  >  8000 [ACK] Seq=577 Ack=212214 Win=156160 Len=0"
"644","72.635767","212.83.191.241","192.168.1.107","TCP","1514","8000  >  49189 [ACK] Seq=212214 Ack=577 Win=17408 Len=1460 [TCP segment of a reassembled PDU]"
"645","72.635770","212.83.191.241","192.168.1.107","TCP","1514","8000  >  49189 [ACK] Seq=213674 Ack=577 Win=17408 Len=1460 [TCP segment of a reassembled PDU]"
"646","72.636017","212.83.191.241","192.168.1.107","TCP","1514","8000  >  49189 [ACK] Seq=215134 Ack=577 Win=17408 Len=1460 [TCP segment of a reassembled PDU]"
"647","72.636021","192.168.1.107","212.83.191.241","TCP","60","49189  >  8000 [ACK] Seq=577 Ack=215134 Win=156160 Len=0"
"648","72.636022","212.83.191.241","192.168.1.107","TCP","1514","8000  >  49189 [ACK] Seq=216594 Ack=577 Win=17408 Len=1460 [TCP segment of a reassembled PDU]"
"649","72.636267","192.168.1.107","212.83.191.241","TCP","60","49189  >  8000 [ACK] Seq=577 Ack=218054 Win=156160 Len=0"
"650","72.636585","212.83.191.241","192.168.1.107","TCP","1514","8000  >  49189 [ACK] Seq=218054 Ack=577 Win=17408 Len=1460 [TCP segment of a reassembled PDU]"
"651","72.636834","212.83.191.241","192.168.1.107","TCP","1514","8000  >  49189 [ACK] Seq=219514 Ack=577 Win=17408 Len=1460 [TCP segment of a reassembled PDU]"
"652","72.636837","212.83.191.241","192.168.1.107","TCP","1514","8000  >  49189 [ACK] Seq=220974 Ack=577 Win=17408 Len=1460 [TCP segment of a reassembled PDU]"
"653","72.636840","192.168.1.107","212.83.191.241","TCP","60","49189  >  8000 [ACK] Seq=577 Ack=220974 Win=156160 Len=0"
"654","72.637084","212.83.191.241","192.168.1.107","TCP","1514","8000  >  49189 [ACK] Seq=222434 Ack=577 Win=17408 Len=1460 [TCP segment of a reassembled PDU]"
"655","72.637088","212.83.191.241","192.168.1.107","TCP","1514","8000  >  49189 [ACK] Seq=223894 Ack=577 Win=17408 Len=1460 [TCP segment of a reassembled PDU]"
"656","72.637090","192.168.1.107","212.83.191.241","TCP","60","49189  >  8000 [ACK] Seq=577 Ack=223894 Win=156160 Len=0"
"657","72.637358","212.83.191.241","192.168.1.107","TCP","1514","8000  >  49189 [ACK] Seq=225354 Ack=577 Win=17408 Len=1460 [TCP segment of a reassembled PDU]"
"658","72.637362","192.168.1.107","212.83.191.241","TCP","60","49189  >  8000 [ACK] Seq=577 Ack=226814 Win=156160 Len=0"
"659","72.690877","212.83.191.241","192.168.1.107","TCP","1514","8000  >  49189 [ACK] Seq=226814 Ack=577 Win=17408 Len=1460 [TCP segment of a reassembled PDU]"
"660","72.690887","212.83.191.241","192.168.1.107","TCP","1514","8000  >  49189 [ACK] Seq=228274 Ack=577 Win=17408 Len=1460 [TCP segment of a reassembled PDU]"
"661","72.691075","192.168.1.107","212.83.191.241","TCP","60","49189  >  8000 [ACK] Seq=577 Ack=229734 Win=156160 Len=0"
"662","72.691079","212.83.191.241","192.168.1.107","TCP","1514","8000  >  49189 [ACK] Seq=229734 Ack=577 Win=17408 Len=1460 [TCP segment of a reassembled PDU]"
"663","72.691575","212.83.191.241","192.168.1.107","TCP","1514","8000  >  49189 [ACK] Seq=231194 Ack=577 Win=17408 Len=1460 [TCP segment of a reassembled PDU]"
"664","72.691579","192.168.1.107","212.83.191.241","TCP","60","49189  >  8000 [ACK] Seq=577 Ack=232654 Win=156160 Len=0"
"665","72.691824","212.83.191.241","192.168.1.107","TCP","1514","8000  >  49189 [ACK] Seq=232654 Ack=577 Win=17408 Len=1460 [TCP segment of a reassembled PDU]"
"666","72.691828","212.83.191.241","192.168.1.107","TCP","1514","8000  >  49189 [ACK] Seq=234114 Ack=577 Win=17408 Len=1460 [TCP segment of a reassembled PDU]"
"667","72.691830","192.168.1.107","212.83.191.241","TCP","60","49189  >  8000 [ACK] Seq=577 Ack=235574 Win=156160 Len=0"
"668","72.692073","212.83.191.241","192.168.1.107","TCP","1514","8000  >  49189 [ACK] Seq=235574 Ack=577 Win=17408 Len=1460 [TCP segment of a reassembled PDU]"
"669","72.692323","212.83.191.241","192.168.1.107","TCP","1514","8000  >  49189 [ACK] Seq=237034 Ack=577 Win=17408 Len=1460 [TCP segment of a reassembled PDU]"
"670","72.692327","192.168.1.107","212.83.191.241","TCP","60","49189  >  8000 [ACK] Seq=577 Ack=238494 Win=156160 Len=0"
"671","72.692574","212.83.191.241","192.168.1.107","TCP","1514","8000  >  49189 [ACK] Seq=238494 Ack=577 Win=17408 Len=1460 [TCP segment of a reassembled PDU]"
"672","72.692578","212.83.191.241","192.168.1.107","TCP","1514","8000  >  49189 [ACK] Seq=239954 Ack=577 Win=17408 Len=1460 [TCP segment of a reassembled PDU]"
"673","72.692830","192.168.1.107","212.83.191.241","TCP","60","49189  >  8000 [ACK] Seq=577 Ack=241414 Win=156160 Len=0"
"674","72.693106","212.83.191.241","192.168.1.107","TCP","1514","8000  >  49189 [ACK] Seq=241414 Ack=577 Win=17408 Len=1460 [TCP segment of a reassembled PDU]"
"675","72.693354","212.83.191.241","192.168.1.107","TCP","1514","8000  >  49189 [ACK] Seq=242874 Ack=577 Win=17408 Len=1460 [TCP segment of a reassembled PDU]"
"676","72.693358","192.168.1.107","212.83.191.241","TCP","60","49189  >  8000 [ACK] Seq=577 Ack=244334 Win=156160 Len=0"
"677","72.693607","212.83.191.241","192.168.1.107","TCP","1514","8000  >  49189 [ACK] Seq=244334 Ack=577 Win=17408 Len=1460 [TCP segment of a reassembled PDU]"
"678","72.693611","212.83.191.241","192.168.1.107","TCP","1514","8000  >  49189 [ACK] Seq=245794 Ack=577 Win=17408 Len=1460 [TCP segment of a reassembled PDU]"
"679","72.693613","212.83.191.241","192.168.1.107","TCP","1514","8000  >  49189 [ACK] Seq=247254 Ack=577 Win=17408 Len=1460 [TCP segment of a reassembled PDU]"
"680","72.693615","192.168.1.107","212.83.191.241","TCP","60","49189  >  8000 [ACK] Seq=577 Ack=247254 Win=156160 Len=0"
"681","72.693856","212.83.191.241","192.168.1.107","TCP","1514","8000  >  49189 [ACK] Seq=248714 Ack=577 Win=17408 Len=1460 [TCP segment of a reassembled PDU]"
"682","72.693860","192.168.1.107","212.83.191.241","TCP","60","49189  >  8000 [ACK] Seq=577 Ack=250174 Win=156160 Len=0"
"683","72.694105","212.83.191.241","192.168.1.107","TCP","1514","8000  >  49189 [ACK] Seq=250174 Ack=577 Win=17408 Len=1460 [TCP segment of a reassembled PDU]"
"684","72.694109","212.83.191.241","192.168.1.107","HTTP","607","HTTP/1.1 200 OK  (audio/mpeg)"
"685","72.694111","192.168.1.107","212.83.191.241","TCP","60","49189  >  8000 [ACK] Seq=577 Ack=252187 Win=156160 Len=0"
"686","80.994991","192.168.1.107","94.137.122.252","TCP","60","49192  >  80 [FIN, ACK] Seq=299 Ack=439 Win=65024 Len=0"
"687","80.995001","192.168.1.107","212.83.191.241","TCP","60","49189  >  8000 [FIN, ACK] Seq=577 Ack=252187 Win=156160 Len=0"
"688","81.122428","212.83.191.241","192.168.1.107","TCP","60","8000  >  49189 [FIN, ACK] Seq=252187 Ack=578 Win=17408 Len=0"
"689","81.122438","192.168.1.107","212.83.191.241","TCP","60","49189  >  8000 [ACK] Seq=578 Ack=252188 Win=156160 Len=0"
"690","81.154033","94.137.122.252","192.168.1.107","TCP","60","80  >  49192 [FIN, ACK] Seq=439 Ack=300 Win=6912 Len=0"
"691","81.154043","192.168.1.107","94.137.122.252","TCP","60","49192  >  80 [ACK] Seq=300 Ack=440 Win=65024 Len=0"
