"No.","Time","Source","Destination","Protocol","Length","Info"
"1","0.000000","172.16.2.139","23.218.156.83","TCP","66","49186  >  80 [SYN] Seq=0 Win=8192 Len=0 MSS=1268 WS=4 SACK_PERM"
"2","0.004967","23.218.156.83","172.16.2.139","TCP","66","80  >  49186 [SYN, ACK] Seq=0 Ack=1 Win=14600 Len=0 MSS=1460 SACK_PERM WS=2"
"3","0.016589","172.16.2.139","23.218.156.83","TCP","54","49186  >  80 [ACK] Seq=1 Ack=1 Win=16484 Len=0"
"4","0.017592","172.16.2.139","23.218.156.83","HTTP","797","GET /gnews.php?id=884107-mlb-jeff-francoeur-had-lasik-surgery HTTP/1.1 "
"5","0.022402","23.218.156.83","172.16.2.139","TCP","60","80  >  49186 [ACK] Seq=1 Ack=744 Win=16086 Len=0"
"6","5.255172","23.218.156.83","172.16.2.139","TCP","1322","80  >  49186 [ACK] Seq=1 Ack=744 Win=16086 Len=1268 [TCP segment of a reassembled PDU]"
"7","5.255224","23.218.156.83","172.16.2.139","TCP","1322","80  >  49186 [ACK] Seq=1269 Ack=744 Win=16086 Len=1268 [TCP segment of a reassembled PDU]"
"8","5.255230","23.218.156.83","172.16.2.139","TCP","1322","80  >  49186 [ACK] Seq=2537 Ack=744 Win=16086 Len=1268 [TCP segment of a reassembled PDU]"
"9","5.255236","23.218.156.83","172.16.2.139","TCP","1322","80  >  49186 [ACK] Seq=3805 Ack=744 Win=16086 Len=1268 [TCP segment of a reassembled PDU]"
"10","5.255241","23.218.156.83","172.16.2.139","TCP","1322","80  >  49186 [ACK] Seq=5073 Ack=744 Win=16086 Len=1268 [TCP segment of a reassembled PDU]"
"11","5.255256","23.218.156.83","172.16.2.139","TCP","1322","80  >  49186 [ACK] Seq=6341 Ack=744 Win=16086 Len=1268 [TCP segment of a reassembled PDU]"
"12","5.255260","23.218.156.83","172.16.2.139","TCP","1101","80  >  49186 [PSH, ACK] Seq=7609 Ack=744 Win=16086 Len=1047 [TCP segment of a reassembled PDU]"
"13","5.268360","172.16.2.139","23.218.156.83","TCP","66","[TCP Dup ACK 3#1] 49186  >  80 [ACK] Seq=744 Ack=1 Win=16484 Len=0 SLE=7609 SRE=8656"
"14","5.268465","172.16.2.139","23.218.156.83","TCP","66","49186  >  80 [ACK] Seq=744 Ack=1269 Win=16484 Len=0 SLE=7609 SRE=8656"
"15","5.268523","172.16.2.139","23.218.156.83","TCP","66","49186  >  80 [ACK] Seq=744 Ack=2537 Win=16484 Len=0 SLE=7609 SRE=8656"
"16","5.268584","172.16.2.139","23.218.156.83","TCP","66","49186  >  80 [ACK] Seq=744 Ack=3805 Win=16484 Len=0 SLE=7609 SRE=8656"
"17","5.268640","172.16.2.139","23.218.156.83","TCP","66","49186  >  80 [ACK] Seq=744 Ack=5073 Win=16484 Len=0 SLE=7609 SRE=8656"
"18","5.268696","172.16.2.139","23.218.156.83","TCP","66","49186  >  80 [ACK] Seq=744 Ack=6341 Win=16484 Len=0 SLE=7609 SRE=8656"
"19","5.268758","172.16.2.139","23.218.156.83","TCP","54","49186  >  80 [ACK] Seq=744 Ack=8656 Win=16484 Len=0"
"20","5.273392","23.218.156.83","172.16.2.139","TCP","1322","[TCP Spurious Retransmission] 80  >  49186 [ACK] Seq=1 Ack=744 Win=16086 Len=1268"
"21","5.273441","23.218.156.83","172.16.2.139","TCP","1322","[TCP Spurious Retransmission] 80  >  49186 [ACK] Seq=1269 Ack=744 Win=16086 Len=1268"
"22","5.273447","23.218.156.83","172.16.2.139","TCP","1322","[TCP Spurious Retransmission] 80  >  49186 [ACK] Seq=2537 Ack=744 Win=16086 Len=1268"
"23","5.273453","23.218.156.83","172.16.2.139","TCP","1322","[TCP Spurious Retransmission] 80  >  49186 [ACK] Seq=3805 Ack=744 Win=16086 Len=1268"
"24","5.273458","23.218.156.83","172.16.2.139","TCP","1322","80  >  49186 [ACK] Seq=8656 Ack=744 Win=16086 Len=1268 [TCP segment of a reassembled PDU]"
"25","5.273475","23.218.156.83","172.16.2.139","TCP","1322","80  >  49186 [ACK] Seq=9924 Ack=744 Win=16086 Len=1268 [TCP segment of a reassembled PDU]"
"26","5.273631","23.218.156.83","172.16.2.139","HTTP","211","HTTP/1.1 200 OK  (text/html)"
"27","5.273641","23.218.156.83","172.16.2.139","TCP","1322","[TCP Spurious Retransmission] 80  >  49186 [ACK] Seq=6341 Ack=744 Win=16086 Len=1268"
"28","5.287573","172.16.2.139","23.218.156.83","TCP","66","[TCP Dup ACK 19#1] 49186  >  80 [ACK] Seq=744 Ack=8656 Win=16484 Len=0 SLE=1 SRE=1269"
"29","5.287641","172.16.2.139","23.218.156.83","TCP","66","[TCP Dup ACK 19#2] 49186  >  80 [ACK] Seq=744 Ack=8656 Win=16484 Len=0 SLE=1269 SRE=2537"
"30","5.287696","172.16.2.139","23.218.156.83","TCP","66","[TCP Dup ACK 19#3] 49186  >  80 [ACK] Seq=744 Ack=8656 Win=16484 Len=0 SLE=2537 SRE=3805"
"31","5.287752","172.16.2.139","23.218.156.83","TCP","66","[TCP Dup ACK 19#4] 49186  >  80 [ACK] Seq=744 Ack=8656 Win=16484 Len=0 SLE=3805 SRE=5073"
"32","5.287808","172.16.2.139","23.218.156.83","TCP","54","49186  >  80 [ACK] Seq=744 Ack=11192 Win=16484 Len=0"
"33","5.287864","172.16.2.139","23.218.156.83","TCP","66","49186  >  80 [ACK] Seq=744 Ack=11349 Win=16324 Len=0 SLE=6341 SRE=7609"
"34","5.295467","172.16.2.139","23.218.156.83","TCP","66","49188  >  80 [SYN] Seq=0 Win=8192 Len=0 MSS=1268 WS=4 SACK_PERM"
"35","5.299680","23.218.156.83","172.16.2.139","TCP","66","80  >  49188 [SYN, ACK] Seq=0 Ack=1 Win=14600 Len=0 MSS=1460 SACK_PERM WS=2"
"36","5.304254","172.16.2.139","23.218.156.83","HTTP","517","GET /includes/css/kffl.css HTTP/1.1 "
"37","5.308971","23.218.156.83","172.16.2.139","TCP","60","80  >  49186 [ACK] Seq=11349 Ack=1207 Win=17572 Len=0"
"38","5.309325","23.218.156.83","172.16.2.139","TCP","1322","80  >  49186 [ACK] Seq=11349 Ack=1207 Win=17572 Len=1268 [TCP segment of a reassembled PDU]"
"39","5.309366","23.218.156.83","172.16.2.139","TCP","1322","80  >  49186 [ACK] Seq=12617 Ack=1207 Win=17572 Len=1268 [TCP segment of a reassembled PDU]"
"40","5.309377","23.218.156.83","172.16.2.139","HTTP","733","HTTP/1.1 200 OK  (text/css)"
"41","5.310476","172.16.2.139","23.218.156.83","TCP","54","49188  >  80 [ACK] Seq=1 Ack=1 Win=16484 Len=0"
"42","5.311144","172.16.2.139","23.218.156.83","HTTP","515","GET /includes/scripts.js HTTP/1.1 "
"43","5.315286","23.218.156.83","172.16.2.139","TCP","60","80  >  49188 [ACK] Seq=1 Ack=462 Win=15672 Len=0"
"44","5.315606","23.218.156.83","172.16.2.139","TCP","1322","80  >  49188 [ACK] Seq=1 Ack=462 Win=15672 Len=1268 [TCP segment of a reassembled PDU]"
"45","5.315619","23.218.156.83","172.16.2.139","TCP","1322","80  >  49188 [ACK] Seq=1269 Ack=462 Win=15672 Len=1268 [TCP segment of a reassembled PDU]"
"46","5.315624","23.218.156.83","172.16.2.139","TCP","1322","80  >  49188 [ACK] Seq=2537 Ack=462 Win=15672 Len=1268 [TCP segment of a reassembled PDU]"
"47","5.315647","23.218.156.83","172.16.2.139","TCP","1322","80  >  49188 [ACK] Seq=3805 Ack=462 Win=15672 Len=1268 [TCP segment of a reassembled PDU]"
"48","5.315655","23.218.156.83","172.16.2.139","HTTP","796","HTTP/1.1 200 OK  (application/javascript)"
"49","5.321302","172.16.2.139","23.218.156.83","TCP","66","[TCP Dup ACK 33#1] 49186  >  80 [ACK] Seq=1207 Ack=11349 Win=16324 Len=0 SLE=13885 SRE=14564"
"50","5.321360","172.16.2.139","23.218.156.83","TCP","66","49186  >  80 [ACK] Seq=1207 Ack=12617 Win=16484 Len=0 SLE=13885 SRE=14564"
"51","5.321422","172.16.2.139","23.218.156.83","TCP","54","49186  >  80 [ACK] Seq=1207 Ack=14564 Win=16484 Len=0"
"52","5.326961","172.16.2.139","23.218.156.83","TCP","66","[TCP Dup ACK 41#1] 49188  >  80 [ACK] Seq=462 Ack=1 Win=16484 Len=0 SLE=5073 SRE=5815"
"53","5.327402","172.16.2.139","23.218.156.83","TCP","66","49188  >  80 [ACK] Seq=462 Ack=1269 Win=16484 Len=0 SLE=5073 SRE=5815"
"54","5.327820","172.16.2.139","23.218.156.83","TCP","66","49188  >  80 [ACK] Seq=462 Ack=2537 Win=16484 Len=0 SLE=5073 SRE=5815"
"55","5.327899","172.16.2.139","23.218.156.83","TCP","66","49188  >  80 [ACK] Seq=462 Ack=3805 Win=16484 Len=0 SLE=5073 SRE=5815"
"56","5.327953","172.16.2.139","23.218.156.83","TCP","54","49188  >  80 [ACK] Seq=462 Ack=5815 Win=16484 Len=0"
"57","5.331188","23.218.156.83","172.16.2.139","TCP","1322","[TCP Spurious Retransmission] 80  >  49188 [ACK] Seq=1 Ack=462 Win=15672 Len=1268"
"58","5.331212","23.218.156.83","172.16.2.139","TCP","1322","[TCP Spurious Retransmission] 80  >  49188 [ACK] Seq=1269 Ack=462 Win=15672 Len=1268"
"59","5.331770","23.218.156.83","172.16.2.139","TCP","1322","[TCP Spurious Retransmission] 80  >  49188 [ACK] Seq=2537 Ack=462 Win=15672 Len=1268"
"60","5.331784","23.218.156.83","172.16.2.139","TCP","1322","[TCP Spurious Retransmission] 80  >  49188 [ACK] Seq=3805 Ack=462 Win=15672 Len=1268"
"61","5.343460","172.16.2.139","23.218.156.83","TCP","66","[TCP Dup ACK 56#1] 49188  >  80 [ACK] Seq=462 Ack=5815 Win=16484 Len=0 SLE=1 SRE=1269"
"62","5.343614","172.16.2.139","23.218.156.83","TCP","66","[TCP Dup ACK 56#2] 49188  >  80 [ACK] Seq=462 Ack=5815 Win=16484 Len=0 SLE=1269 SRE=2537"
"63","5.343802","172.16.2.139","23.218.156.83","TCP","66","[TCP Dup ACK 56#3] 49188  >  80 [ACK] Seq=462 Ack=5815 Win=16484 Len=0 SLE=2537 SRE=3805"
"64","5.343857","172.16.2.139","23.218.156.83","TCP","66","[TCP Dup ACK 56#4] 49188  >  80 [ACK] Seq=462 Ack=5815 Win=16484 Len=0 SLE=3805 SRE=5073"
"65","6.931611","172.16.2.139","88.198.0.59","TCP","66","49216  >  80 [SYN] Seq=0 Win=8192 Len=0 MSS=1268 WS=4 SACK_PERM"
"66","7.058415","88.198.0.59","172.16.2.139","TCP","66","80  >  49216 [SYN, ACK] Seq=0 Ack=1 Win=14600 Len=0 MSS=1460 SACK_PERM WS=128"
"67","7.070902","172.16.2.139","88.198.0.59","TCP","54","49216  >  80 [ACK] Seq=1 Ack=1 Win=16484 Len=0"
"68","7.073219","172.16.2.139","88.198.0.59","HTTP","582","GET /web/1.php HTTP/1.1 "
"69","7.124859","172.16.2.139","23.218.156.83","HTTP","628","GET /includes/images/bg-main-nav.jpg HTTP/1.1 "
"70","7.129468","23.218.156.83","172.16.2.139","TCP","1322","80  >  49188 [ACK] Seq=5815 Ack=1036 Win=16820 Len=1268 [TCP segment of a reassembled PDU]"
"71","7.129482","23.218.156.83","172.16.2.139","HTTP","423","HTTP/1.1 200 OK  (JPEG JFIF image)"
"72","7.131334","172.16.2.139","23.218.156.83","HTTP","629","GET /includes/images/social-icons.png HTTP/1.1 "
"73","7.136475","23.218.156.83","172.16.2.139","TCP","1322","80  >  49186 [ACK] Seq=14564 Ack=1782 Win=19058 Len=1268 [TCP segment of a reassembled PDU]"
"74","7.136500","23.218.156.83","172.16.2.139","TCP","1322","80  >  49186 [ACK] Seq=15832 Ack=1782 Win=19058 Len=1268 [TCP segment of a reassembled PDU]"
"75","7.136506","23.218.156.83","172.16.2.139","HTTP","1137","HTTP/1.1 200 OK  (PNG)"
"76","7.142664","172.16.2.139","23.218.156.83","TCP","54","49188  >  80 [ACK] Seq=1036 Ack=7452 Win=16484 Len=0"
"77","7.150085","172.16.2.139","23.218.156.83","TCP","66","[TCP Dup ACK 51#1] 49186  >  80 [ACK] Seq=1782 Ack=14564 Win=16484 Len=0 SLE=17100 SRE=18183"
"78","7.150270","172.16.2.139","23.218.156.83","TCP","66","49186  >  80 [ACK] Seq=1782 Ack=15832 Win=16484 Len=0 SLE=17100 SRE=18183"
"79","7.150632","172.16.2.139","23.218.156.83","TCP","54","49186  >  80 [ACK] Seq=1782 Ack=18183 Win=16484 Len=0"
"80","7.200243","88.198.0.59","172.16.2.139","TCP","60","80  >  49216 [ACK] Seq=1 Ack=529 Win=15744 Len=0"
"81","7.284252","88.198.0.59","172.16.2.139","HTTP","427","HTTP/1.1 302 Moved Temporarily "
"82","7.284257","88.198.0.59","172.16.2.139","TCP","60","80  >  49216 [FIN, ACK] Seq=374 Ack=529 Win=15744 Len=0"
"83","7.297474","172.16.2.139","88.198.0.59","TCP","54","[TCP Dup ACK 67#1] 49216  >  80 [ACK] Seq=529 Ack=1 Win=16484 Len=0"
"84","7.297567","172.16.2.139","88.198.0.59","TCP","54","49216  >  80 [ACK] Seq=529 Ack=375 Win=16108 Len=0"
"85","7.300003","172.16.2.139","88.198.0.59","TCP","54","49216  >  80 [FIN, ACK] Seq=529 Ack=375 Win=16108 Len=0"
"86","7.426646","88.198.0.59","172.16.2.139","TCP","60","80  >  49216 [ACK] Seq=375 Ack=530 Win=15744 Len=0"
"87","7.440202","172.16.2.139","217.23.15.220","TCP","66","49225  >  80 [SYN] Seq=0 Win=8192 Len=0 MSS=1268 WS=4 SACK_PERM"
"88","7.571560","217.23.15.220","172.16.2.139","TCP","66","80  >  49225 [SYN, ACK] Seq=0 Ack=1 Win=14600 Len=0 MSS=1460 SACK_PERM WS=16"
"89","7.592832","172.16.2.139","217.23.15.220","TCP","54","49225  >  80 [ACK] Seq=1 Ack=1 Win=16484 Len=0"
"90","7.594844","172.16.2.139","217.23.15.220","HTTP","607","GET /temp/support/30f29ae/?cmpid=333333 HTTP/1.1 "
"91","7.725918","217.23.15.220","172.16.2.139","TCP","60","80  >  49225 [ACK] Seq=1 Ack=554 Win=15712 Len=0"
"92","7.758066","217.23.15.220","172.16.2.139","TCP","1322","80  >  49225 [ACK] Seq=1 Ack=554 Win=15712 Len=1268 [TCP segment of a reassembled PDU]"
"93","7.758120","217.23.15.220","172.16.2.139","HTTP","440","HTTP/1.1 200 OK  (text/html)"
"94","7.770723","172.16.2.139","217.23.15.220","TCP","54","49225  >  80 [ACK] Seq=554 Ack=1655 Win=16484 Len=0"
"95","7.772958","172.16.2.139","217.23.15.220","HTTP","476","GET /temp/support/dj.js HTTP/1.1 "
"96","7.877394","172.16.2.139","23.218.156.83","HTTP","621","GET /includes/images/hotw.png HTTP/1.1 "
"97","7.881903","23.218.156.83","172.16.2.139","TCP","1322","80  >  49188 [ACK] Seq=7452 Ack=1603 Win=17968 Len=1268 [TCP segment of a reassembled PDU]"
"98","7.881931","23.218.156.83","172.16.2.139","HTTP","439","HTTP/1.1 200 OK  (text/html)"
"99","7.894114","172.16.2.139","50.22.134.3","TCP","66","49228  >  80 [SYN] Seq=0 Win=8192 Len=0 MSS=1268 WS=4 SACK_PERM"
"100","7.894174","172.16.2.139","23.218.156.83","TCP","54","49188  >  80 [ACK] Seq=1603 Ack=9105 Win=16484 Len=0"
"101","7.932799","217.23.15.220","172.16.2.139","TCP","1322","80  >  49225 [ACK] Seq=1655 Ack=976 Win=16816 Len=1268 [TCP segment of a reassembled PDU]"
"102","7.932949","217.23.15.220","172.16.2.139","TCP","1322","80  >  49225 [ACK] Seq=2923 Ack=976 Win=16816 Len=1268 [TCP segment of a reassembled PDU]"
"103","7.933122","217.23.15.220","172.16.2.139","TCP","1322","80  >  49225 [ACK] Seq=4191 Ack=976 Win=16816 Len=1268 [TCP segment of a reassembled PDU]"
"104","7.933131","217.23.15.220","172.16.2.139","TCP","340","80  >  49225 [PSH, ACK] Seq=5459 Ack=976 Win=16816 Len=286 [TCP segment of a reassembled PDU]"
"105","7.933136","217.23.15.220","172.16.2.139","HTTP","684","HTTP/1.1 200 OK  (application/javascript)"
"106","7.940557","50.22.134.3","172.16.2.139","TCP","62","80  >  49228 [SYN, ACK] Seq=0 Ack=1 Win=5840 Len=0 MSS=1460 WS=128"
"107","7.945543","172.16.2.139","217.23.15.220","TCP","54","49225  >  80 [ACK] Seq=976 Ack=4191 Win=16484 Len=0"
"108","7.945599","172.16.2.139","217.23.15.220","TCP","54","49225  >  80 [ACK] Seq=976 Ack=5745 Win=16484 Len=0"
"109","7.952984","172.16.2.139","50.22.134.3","TCP","54","49228  >  80 [ACK] Seq=1 Ack=1 Win=16484 Len=0"
"110","7.954612","172.16.2.139","50.22.134.3","HTTP","470","GET /index.php?ref=mediaclickinc HTTP/1.1 "
"111","8.000431","50.22.134.3","172.16.2.139","TCP","60","80  >  49228 [ACK] Seq=1 Ack=417 Win=6912 Len=0"
"112","8.004546","50.22.134.3","172.16.2.139","TCP","1322","80  >  49228 [ACK] Seq=1 Ack=417 Win=6912 Len=1268 [TCP segment of a reassembled PDU]"
"113","8.004598","50.22.134.3","172.16.2.139","TCP","1322","80  >  49228 [ACK] Seq=1269 Ack=417 Win=6912 Len=1268 [TCP segment of a reassembled PDU]"
"114","8.004624","50.22.134.3","172.16.2.139","HTTP","847","HTTP/1.1 200 OK  (text/html)"
"115","8.016520","172.16.2.139","50.22.134.3","TCP","54","[TCP Dup ACK 109#1] 49228  >  80 [ACK] Seq=417 Ack=1 Win=16484 Len=0"
"116","8.016593","172.16.2.139","50.22.134.3","TCP","54","49228  >  80 [ACK] Seq=417 Ack=1269 Win=16484 Len=0"
"117","8.016642","172.16.2.139","50.22.134.3","TCP","54","49228  >  80 [ACK] Seq=417 Ack=3331 Win=16484 Len=0"
"118","8.017677","172.16.2.139","50.22.134.3","TCP","54","49228  >  80 [FIN, ACK] Seq=417 Ack=3331 Win=16484 Len=0"
"119","8.025377","172.16.2.139","217.23.15.220","HTTP","600","GET /temp/support/931b3/?java=333333 HTTP/1.1 "
"120","8.027495","172.16.2.139","217.23.15.220","TCP","66","49229  >  80 [SYN] Seq=0 Win=8192 Len=0 MSS=1268 WS=4 SACK_PERM"
"121","8.063689","50.22.134.3","172.16.2.139","TCP","60","80  >  49228 [ACK] Seq=3331 Ack=418 Win=6912 Len=0"
"122","8.176426","217.23.15.220","172.16.2.139","TCP","66","80  >  49229 [SYN, ACK] Seq=0 Ack=1 Win=14600 Len=0 MSS=1460 SACK_PERM WS=16"
"123","8.187930","172.16.2.139","217.23.15.220","TCP","54","49229  >  80 [ACK] Seq=1 Ack=1 Win=16484 Len=0"
"124","8.188212","172.16.2.139","217.23.15.220","HTTP","591","GET /2/ex1.php?cmpid=333333 HTTP/1.1 "
"125","8.188854","217.23.15.220","172.16.2.139","HTTP","499","HTTP/1.1 200 OK "
"126","8.337144","217.23.15.220","172.16.2.139","TCP","60","80  >  49229 [ACK] Seq=1 Ack=538 Win=15680 Len=0"
"127","8.364906","217.23.15.220","172.16.2.139","HTTP","337","HTTP/1.1 302 Found "
"128","8.389862","172.16.2.139","217.23.15.220","HTTP","571","GET /2/ HTTP/1.1 "
"129","8.549253","217.23.15.220","172.16.2.139","HTTP","539","HTTP/1.1 302 Found "
"130","8.584627","172.16.2.139","217.23.15.220","TCP","54","49229  >  80 [ACK] Seq=538 Ack=284 Win=16200 Len=0"
"131","8.658013","172.16.2.139","108.168.246.235","TCP","66","49230  >  80 [SYN] Seq=0 Win=8192 Len=0 MSS=1268 WS=4 SACK_PERM"
"132","8.664480","108.168.246.235","172.16.2.139","TCP","66","80  >  49230 [SYN, ACK] Seq=0 Ack=1 Win=14600 Len=0 MSS=1460 SACK_PERM WS=128"
"133","8.676740","172.16.2.139","108.168.246.235","TCP","54","49230  >  80 [ACK] Seq=1 Ack=1 Win=16484 Len=0"
"134","8.676822","172.16.2.139","108.168.246.235","HTTP","557","GET / HTTP/1.1 "
"135","8.682958","108.168.246.235","172.16.2.139","TCP","60","80  >  49230 [ACK] Seq=1 Ack=504 Win=15744 Len=0"
"136","8.683336","108.168.246.235","172.16.2.139","HTTP","464","HTTP/1.1 302 Found  (text/html)"
"137","8.683394","108.168.246.235","172.16.2.139","TCP","60","80  >  49230 [FIN, ACK] Seq=411 Ack=504 Win=15744 Len=0"
"138","8.694865","172.16.2.139","108.168.246.235","TCP","54","[TCP Dup ACK 133#1] 49230  >  80 [ACK] Seq=504 Ack=1 Win=16484 Len=0"
"139","8.697992","172.16.2.139","108.168.246.235","TCP","54","49230  >  80 [ACK] Seq=504 Ack=412 Win=16072 Len=0"
"140","8.698174","172.16.2.139","108.168.246.235","TCP","54","49230  >  80 [FIN, ACK] Seq=504 Ack=412 Win=16072 Len=0"
"141","8.704432","108.168.246.235","172.16.2.139","TCP","60","80  >  49230 [ACK] Seq=412 Ack=505 Win=15744 Len=0"
"142","8.818367","172.16.2.139","217.23.15.220","TCP","54","49225  >  80 [ACK] Seq=2039 Ack=7305 Win=16484 Len=0"
"143","10.127252","172.16.2.139","23.218.156.83","HTTP","1181","GET /includes/swfobject.js HTTP/1.1 "
"144","10.132471","23.218.156.83","172.16.2.139","TCP","1322","80  >  49186 [ACK] Seq=18183 Ack=2909 Win=21312 Len=1268 [TCP segment of a reassembled PDU]"
"145","10.132494","23.218.156.83","172.16.2.139","TCP","1322","80  >  49186 [ACK] Seq=19451 Ack=2909 Win=21312 Len=1268 [TCP segment of a reassembled PDU]"
"146","10.132499","23.218.156.83","172.16.2.139","TCP","1322","80  >  49186 [ACK] Seq=20719 Ack=2909 Win=21312 Len=1268 [TCP segment of a reassembled PDU]"
"147","10.132505","23.218.156.83","172.16.2.139","TCP","1322","80  >  49186 [ACK] Seq=21987 Ack=2909 Win=21312 Len=1268 [TCP segment of a reassembled PDU]"
"148","10.132515","23.218.156.83","172.16.2.139","TCP","1322","80  >  49186 [ACK] Seq=23255 Ack=2909 Win=21312 Len=1268 [TCP segment of a reassembled PDU]"
"149","10.132563","23.218.156.83","172.16.2.139","TCP","1322","80  >  49186 [ACK] Seq=24523 Ack=2909 Win=21312 Len=1268 [TCP segment of a reassembled PDU]"
"150","10.132573","23.218.156.83","172.16.2.139","TCP","1322","80  >  49186 [ACK] Seq=25791 Ack=2909 Win=21312 Len=1268 [TCP segment of a reassembled PDU]"
"151","10.132581","23.218.156.83","172.16.2.139","TCP","1322","80  >  49186 [ACK] Seq=27059 Ack=2909 Win=21312 Len=1268 [TCP segment of a reassembled PDU]"
"152","10.132586","23.218.156.83","172.16.2.139","HTTP","535","HTTP/1.1 200 OK  (application/javascript)"
"153","10.145366","172.16.2.139","23.218.156.83","TCP","54","49186  >  80 [ACK] Seq=2909 Ack=20719 Win=16484 Len=0"
"154","10.145446","172.16.2.139","23.218.156.83","TCP","54","49186  >  80 [ACK] Seq=2909 Ack=23255 Win=16484 Len=0"
"155","10.145522","172.16.2.139","23.218.156.83","TCP","54","49186  >  80 [ACK] Seq=2909 Ack=25791 Win=16484 Len=0"
"156","10.145580","172.16.2.139","23.218.156.83","TCP","54","49186  >  80 [ACK] Seq=2909 Ack=28327 Win=15216 Len=0"
"157","10.234606","172.16.2.139","23.218.156.83","TCP","54","49186  >  80 [ACK] Seq=2909 Ack=28808 Win=16484 Len=0"
"158","18.364993","217.23.15.220","172.16.2.139","TCP","60","80  >  49229 [FIN, ACK] Seq=284 Ack=538 Win=15680 Len=0"
"159","18.377300","172.16.2.139","217.23.15.220","TCP","54","49229  >  80 [ACK] Seq=538 Ack=285 Win=16200 Len=0"
"160","18.382070","172.16.2.139","217.23.15.220","TCP","66","49258  >  80 [SYN] Seq=0 Win=8192 Len=0 MSS=1268 WS=256 SACK_PERM"
"161","18.384922","172.16.2.139","217.23.15.220","TCP","66","49259  >  80 [SYN] Seq=0 Win=8192 Len=0 MSS=1268 WS=256 SACK_PERM"
"162","18.516619","217.23.15.220","172.16.2.139","TCP","66","80  >  49259 [SYN, ACK] Seq=0 Ack=1 Win=14600 Len=0 MSS=1460 SACK_PERM WS=16"
"163","18.528119","172.16.2.139","217.23.15.220","TCP","54","49259  >  80 [ACK] Seq=1 Ack=1 Win=16384 Len=0"
"164","18.528661","217.23.15.220","172.16.2.139","TCP","66","80  >  49258 [SYN, ACK] Seq=0 Ack=1 Win=14600 Len=0 MSS=1460 SACK_PERM WS=16"
"165","18.538018","172.16.2.139","217.23.15.220","HTTP","361","GET /temp/support/7e.jar?java=333333 HTTP/1.1 "
"166","18.539820","172.16.2.139","217.23.15.220","TCP","54","49258  >  80 [ACK] Seq=1 Ack=1 Win=16384 Len=0"
"167","18.541832","172.16.2.139","217.23.15.220","HTTP","346","GET /temp/support/30f29ae/app.jnlp HTTP/1.1 "
"168","18.549107","217.23.15.220","172.16.2.139","TCP","60","80  >  49225 [FIN, ACK] Seq=7305 Ack=2039 Win=19024 Len=0"
"169","18.560365","172.16.2.139","217.23.15.220","TCP","54","49225  >  80 [ACK] Seq=2039 Ack=7306 Win=16484 Len=0"
"170","18.669493","217.23.15.220","172.16.2.139","TCP","60","80  >  49259 [ACK] Seq=1 Ack=308 Win=15680 Len=0"
"171","18.688454","217.23.15.220","172.16.2.139","TCP","60","80  >  49258 [ACK] Seq=1 Ack=293 Win=15680 Len=0"
"172","18.699007","217.23.15.220","172.16.2.139","TCP","1322","80  >  49259 [ACK] Seq=1 Ack=308 Win=15680 Len=1268 [TCP segment of a reassembled PDU]"
"173","18.699055","217.23.15.220","172.16.2.139","TCP","1322","80  >  49259 [ACK] Seq=1269 Ack=308 Win=15680 Len=1268 [TCP segment of a reassembled PDU]"
"174","18.699119","217.23.15.220","172.16.2.139","TCP","1322","80  >  49259 [ACK] Seq=2537 Ack=308 Win=15680 Len=1268 [TCP segment of a reassembled PDU]"
"175","18.699129","217.23.15.220","172.16.2.139","TCP","340","80  >  49259 [PSH, ACK] Seq=3805 Ack=308 Win=15680 Len=286 [TCP segment of a reassembled PDU]"
"176","18.699278","217.23.15.220","172.16.2.139","HTTP","492","HTTP/1.1 200 OK  (text/html)"
"177","18.711564","172.16.2.139","217.23.15.220","TCP","54","49259  >  80 [ACK] Seq=308 Ack=2537 Win=16384 Len=0"
"178","18.711640","172.16.2.139","217.23.15.220","TCP","54","49259  >  80 [ACK] Seq=308 Ack=4091 Win=16384 Len=0"
"179","18.717292","217.23.15.220","172.16.2.139","HTTP","380","HTTP/1.1 403 Not Found  (text/html)"
"180","18.747341","172.16.2.139","217.23.15.220","HTTP","318","GET /temp/support/7e.jar?java=333333 HTTP/1.1 "
"181","18.749305","172.16.2.139","217.23.15.220","HTTP","323","GET /temp/support/30f29ae/app.jnlp HTTP/1.1 "
"182","18.908758","217.23.15.220","172.16.2.139","TCP","1322","80  >  49259 [ACK] Seq=4529 Ack=572 Win=16752 Len=1268 [TCP segment of a reassembled PDU]"
"183","18.908814","217.23.15.220","172.16.2.139","TCP","1322","80  >  49259 [ACK] Seq=5797 Ack=572 Win=16752 Len=1268 [TCP segment of a reassembled PDU]"
"184","18.908908","217.23.15.220","172.16.2.139","TCP","1322","80  >  49259 [ACK] Seq=7065 Ack=572 Win=16752 Len=1268 [TCP segment of a reassembled PDU]"
"185","18.908916","217.23.15.220","172.16.2.139","TCP","340","80  >  49259 [PSH, ACK] Seq=8333 Ack=572 Win=16752 Len=286 [TCP segment of a reassembled PDU]"
"186","18.908919","217.23.15.220","172.16.2.139","HTTP","492","HTTP/1.1 200 OK  (text/html)"
"187","18.921499","172.16.2.139","217.23.15.220","TCP","54","49259  >  80 [ACK] Seq=572 Ack=7065 Win=16384 Len=0"
"188","18.922639","172.16.2.139","217.23.15.220","TCP","54","49259  >  80 [ACK] Seq=572 Ack=8619 Win=16384 Len=0"
"189","18.925143","217.23.15.220","172.16.2.139","HTTP","342","HTTP/1.1 403 Not Found  (text/html)"
"190","18.946384","172.16.2.139","217.23.15.220","HTTP","346","GET /temp/support/30f29ae/app.jnlp HTTP/1.1 "
"191","19.028404","172.16.2.139","217.23.15.220","HTTP","361","GET /temp/support/7e.jar?java=333333 HTTP/1.1 "
"192","19.122472","217.23.15.220","172.16.2.139","HTTP","380","HTTP/1.1 403 Not Found  (text/html)"
"193","19.188771","217.23.15.220","172.16.2.139","TCP","1322","80  >  49259 [ACK] Seq=9057 Ack=879 Win=17824 Len=1268 [TCP segment of a reassembled PDU]"
"194","19.188823","217.23.15.220","172.16.2.139","TCP","1322","80  >  49259 [ACK] Seq=10325 Ack=879 Win=17824 Len=1268 [TCP segment of a reassembled PDU]"
"195","19.188920","217.23.15.220","172.16.2.139","TCP","1322","80  >  49259 [ACK] Seq=11593 Ack=879 Win=17824 Len=1268 [TCP segment of a reassembled PDU]"
"196","19.188931","217.23.15.220","172.16.2.139","TCP","340","80  >  49259 [PSH, ACK] Seq=12861 Ack=879 Win=17824 Len=286 [TCP segment of a reassembled PDU]"
"197","19.188935","217.23.15.220","172.16.2.139","HTTP","492","HTTP/1.1 200 OK  (text/html)"
"198","19.201320","172.16.2.139","217.23.15.220","TCP","54","49259  >  80 [ACK] Seq=879 Ack=11593 Win=16384 Len=0"
"199","19.201399","172.16.2.139","217.23.15.220","TCP","54","49259  >  80 [ACK] Seq=879 Ack=13147 Win=16384 Len=0"
"200","19.246224","172.16.2.139","217.23.15.220","HTTP","361","GET /temp/support/7e.jar?java=333333 HTTP/1.1 "
"201","19.344314","172.16.2.139","217.23.15.220","TCP","54","49258  >  80 [ACK] Seq=854 Ack=941 Win=15360 Len=0"
"202","19.406402","217.23.15.220","172.16.2.139","TCP","1322","80  >  49259 [ACK] Seq=13585 Ack=1186 Win=18896 Len=1268 [TCP segment of a reassembled PDU]"
"203","19.406439","217.23.15.220","172.16.2.139","TCP","1322","80  >  49259 [ACK] Seq=14853 Ack=1186 Win=18896 Len=1268 [TCP segment of a reassembled PDU]"
"204","19.406505","217.23.15.220","172.16.2.139","TCP","1322","80  >  49259 [ACK] Seq=16121 Ack=1186 Win=18896 Len=1268 [TCP segment of a reassembled PDU]"
"205","19.406515","217.23.15.220","172.16.2.139","TCP","340","80  >  49259 [PSH, ACK] Seq=17389 Ack=1186 Win=18896 Len=286 [TCP segment of a reassembled PDU]"
"206","19.406666","217.23.15.220","172.16.2.139","HTTP","492","HTTP/1.1 200 OK  (text/html)"
"207","19.419062","172.16.2.139","217.23.15.220","TCP","54","49259  >  80 [ACK] Seq=1186 Ack=16121 Win=16384 Len=0"
"208","19.419120","172.16.2.139","217.23.15.220","TCP","54","49259  >  80 [ACK] Seq=1186 Ack=17675 Win=16384 Len=0"
"209","19.490340","172.16.2.139","217.23.15.220","HTTP","287","GET /temp/support/-148529710/?page=333333 HTTP/1.1 "
"210","19.660120","217.23.15.220","172.16.2.139","TCP","60","80  >  49259 [ACK] Seq=18113 Ack=1419 Win=19968 Len=0"
"211","20.298042","217.23.15.220","172.16.2.139","HTTP","525","HTTP/1.1 302 Found "
"212","20.544376","172.16.2.139","217.23.15.220","TCP","54","49259  >  80 [ACK] Seq=1419 Ack=18584 Win=15360 Len=0"
"213","21.779927","172.16.2.139","217.23.15.220","TCP","54","49259  >  80 [FIN, ACK] Seq=1419 Ack=18584 Win=15360 Len=0"
"214","21.790239","172.16.2.139","217.23.15.220","TCP","66","49261  >  80 [SYN] Seq=0 Win=8192 Len=0 MSS=1268 WS=256 SACK_PERM"
"215","21.911425","217.23.15.220","172.16.2.139","TCP","60","80  >  49259 [FIN, ACK] Seq=18584 Ack=1420 Win=19968 Len=0"
"216","21.922667","172.16.2.139","217.23.15.220","TCP","54","49259  >  80 [ACK] Seq=1420 Ack=18585 Win=15360 Len=0"
"217","21.937585","217.23.15.220","172.16.2.139","TCP","66","80  >  49261 [SYN, ACK] Seq=0 Ack=1 Win=14600 Len=0 MSS=1460 SACK_PERM WS=16"
"218","21.949230","172.16.2.139","217.23.15.220","TCP","54","49261  >  80 [ACK] Seq=1 Ack=1 Win=16384 Len=0"
"219","21.952499","172.16.2.139","217.23.15.220","HTTP","312","GET /temp/333333.exe HTTP/1.1 "
"220","22.099394","217.23.15.220","172.16.2.139","TCP","60","80  >  49261 [ACK] Seq=1 Ack=259 Win=15680 Len=0"
"221","22.128705","217.23.15.220","172.16.2.139","TCP","1322","80  >  49261 [ACK] Seq=1 Ack=259 Win=15680 Len=1268 [TCP segment of a reassembled PDU]"
"222","22.128764","217.23.15.220","172.16.2.139","TCP","1322","80  >  49261 [ACK] Seq=1269 Ack=259 Win=15680 Len=1268 [TCP segment of a reassembled PDU]"
"223","22.128885","217.23.15.220","172.16.2.139","TCP","1322","80  >  49261 [ACK] Seq=2537 Ack=259 Win=15680 Len=1268 [TCP segment of a reassembled PDU]"
"224","22.128895","217.23.15.220","172.16.2.139","TCP","375","80  >  49261 [PSH, ACK] Seq=3805 Ack=259 Win=15680 Len=321 [TCP segment of a reassembled PDU]"
"225","22.142498","172.16.2.139","217.23.15.220","TCP","54","49261  >  80 [ACK] Seq=259 Ack=2537 Win=16384 Len=0"
"226","22.142578","172.16.2.139","217.23.15.220","TCP","54","49261  >  80 [ACK] Seq=259 Ack=4126 Win=16384 Len=0"
"227","22.169833","217.23.15.220","172.16.2.139","TCP","1322","80  >  49261 [ACK] Seq=4126 Ack=259 Win=15680 Len=1268 [TCP segment of a reassembled PDU]"
"228","22.169888","217.23.15.220","172.16.2.139","TCP","1322","80  >  49261 [ACK] Seq=5394 Ack=259 Win=15680 Len=1268 [TCP segment of a reassembled PDU]"
"229","22.169972","217.23.15.220","172.16.2.139","TCP","1322","80  >  49261 [ACK] Seq=6662 Ack=259 Win=15680 Len=1268 [TCP segment of a reassembled PDU]"
"230","22.170137","217.23.15.220","172.16.2.139","TCP","1322","80  >  49261 [ACK] Seq=7930 Ack=259 Win=15680 Len=1268 [TCP segment of a reassembled PDU]"
"231","22.170300","217.23.15.220","172.16.2.139","TCP","1322","80  >  49261 [ACK] Seq=9198 Ack=259 Win=15680 Len=1268 [TCP segment of a reassembled PDU]"
"232","22.182378","172.16.2.139","217.23.15.220","TCP","54","49261  >  80 [ACK] Seq=259 Ack=6662 Win=16384 Len=0"
"233","22.182441","172.16.2.139","217.23.15.220","TCP","54","49261  >  80 [ACK] Seq=259 Ack=9198 Win=16384 Len=0"
"234","22.289597","217.23.15.220","172.16.2.139","TCP","1322","80  >  49261 [ACK] Seq=10466 Ack=259 Win=15680 Len=1268 [TCP segment of a reassembled PDU]"
"235","22.289650","217.23.15.220","172.16.2.139","TCP","1322","80  >  49261 [PSH, ACK] Seq=11734 Ack=259 Win=15680 Len=1268 [TCP segment of a reassembled PDU]"
"236","22.289759","217.23.15.220","172.16.2.139","TCP","1322","80  >  49261 [ACK] Seq=13002 Ack=259 Win=15680 Len=1268 [TCP segment of a reassembled PDU]"
"237","22.289956","217.23.15.220","172.16.2.139","TCP","1322","80  >  49261 [ACK] Seq=14270 Ack=259 Win=15680 Len=1268 [TCP segment of a reassembled PDU]"
"238","22.289970","217.23.15.220","172.16.2.139","TCP","1322","80  >  49261 [ACK] Seq=15538 Ack=259 Win=15680 Len=1268 [TCP segment of a reassembled PDU]"
"239","22.290088","217.23.15.220","172.16.2.139","TCP","1322","80  >  49261 [ACK] Seq=16806 Ack=259 Win=15680 Len=1268 [TCP segment of a reassembled PDU]"
"240","22.290288","217.23.15.220","172.16.2.139","TCP","1322","80  >  49261 [ACK] Seq=18074 Ack=259 Win=15680 Len=1268 [TCP segment of a reassembled PDU]"
"241","22.302412","172.16.2.139","217.23.15.220","TCP","54","49261  >  80 [ACK] Seq=259 Ack=11734 Win=16384 Len=0"
"242","22.302477","172.16.2.139","217.23.15.220","TCP","54","49261  >  80 [ACK] Seq=259 Ack=14270 Win=16384 Len=0"
"243","22.302591","172.16.2.139","217.23.15.220","TCP","54","49261  >  80 [ACK] Seq=259 Ack=16806 Win=16384 Len=0"
"244","22.302649","172.16.2.139","217.23.15.220","TCP","54","49261  >  80 [ACK] Seq=259 Ack=19342 Win=16384 Len=0"
"245","22.330005","217.23.15.220","172.16.2.139","TCP","1322","80  >  49261 [ACK] Seq=19342 Ack=259 Win=15680 Len=1268 [TCP segment of a reassembled PDU]"
"246","22.330067","217.23.15.220","172.16.2.139","TCP","1322","80  >  49261 [PSH, ACK] Seq=20610 Ack=259 Win=15680 Len=1268 [TCP segment of a reassembled PDU]"
"247","22.330136","217.23.15.220","172.16.2.139","TCP","1322","80  >  49261 [ACK] Seq=21878 Ack=259 Win=15680 Len=1268 [TCP segment of a reassembled PDU]"
"248","22.330297","217.23.15.220","172.16.2.139","TCP","1322","80  >  49261 [ACK] Seq=23146 Ack=259 Win=15680 Len=1268 [TCP segment of a reassembled PDU]"
"249","22.343589","172.16.2.139","217.23.15.220","TCP","54","49261  >  80 [ACK] Seq=259 Ack=21878 Win=16384 Len=0"
"250","22.343677","172.16.2.139","217.23.15.220","TCP","54","49261  >  80 [ACK] Seq=259 Ack=24414 Win=16384 Len=0"
"251","22.450067","217.23.15.220","172.16.2.139","TCP","1322","80  >  49261 [ACK] Seq=24414 Ack=259 Win=15680 Len=1268 [TCP segment of a reassembled PDU]"
"252","22.450132","217.23.15.220","172.16.2.139","TCP","1322","80  >  49261 [PSH, ACK] Seq=25682 Ack=259 Win=15680 Len=1268 [TCP segment of a reassembled PDU]"
"253","22.450201","217.23.15.220","172.16.2.139","TCP","1322","80  >  49261 [ACK] Seq=26950 Ack=259 Win=15680 Len=1268 [TCP segment of a reassembled PDU]"
"254","22.450368","217.23.15.220","172.16.2.139","TCP","1322","80  >  49261 [ACK] Seq=28218 Ack=259 Win=15680 Len=1268 [TCP segment of a reassembled PDU]"
"255","22.450554","217.23.15.220","172.16.2.139","TCP","1322","80  >  49261 [ACK] Seq=29486 Ack=259 Win=15680 Len=1268 [TCP segment of a reassembled PDU]"
"256","22.450565","217.23.15.220","172.16.2.139","TCP","1322","80  >  49261 [ACK] Seq=30754 Ack=259 Win=15680 Len=1268 [TCP segment of a reassembled PDU]"
"257","22.450733","217.23.15.220","172.16.2.139","TCP","1322","80  >  49261 [ACK] Seq=32022 Ack=259 Win=15680 Len=1268 [TCP segment of a reassembled PDU]"
"258","22.450744","217.23.15.220","172.16.2.139","TCP","1322","80  >  49261 [ACK] Seq=33290 Ack=259 Win=15680 Len=1268 [TCP segment of a reassembled PDU]"
"259","22.464281","172.16.2.139","217.23.15.220","TCP","54","49261  >  80 [ACK] Seq=259 Ack=26950 Win=16384 Len=0"
"260","22.464351","172.16.2.139","217.23.15.220","TCP","54","49261  >  80 [ACK] Seq=259 Ack=29486 Win=16384 Len=0"
"261","22.464415","172.16.2.139","217.23.15.220","TCP","54","49261  >  80 [ACK] Seq=259 Ack=32022 Win=16384 Len=0"
"262","22.464471","172.16.2.139","217.23.15.220","TCP","54","49261  >  80 [ACK] Seq=259 Ack=34558 Win=16384 Len=0"
"263","22.491259","217.23.15.220","172.16.2.139","TCP","1322","80  >  49261 [PSH, ACK] Seq=34558 Ack=259 Win=15680 Len=1268 [TCP segment of a reassembled PDU]"
"264","22.491309","217.23.15.220","172.16.2.139","TCP","1322","80  >  49261 [ACK] Seq=35826 Ack=259 Win=15680 Len=1268 [TCP segment of a reassembled PDU]"
"265","22.491439","217.23.15.220","172.16.2.139","TCP","1322","80  >  49261 [ACK] Seq=37094 Ack=259 Win=15680 Len=1268 [TCP segment of a reassembled PDU]"
"266","22.491608","217.23.15.220","172.16.2.139","TCP","1322","80  >  49261 [ACK] Seq=38362 Ack=259 Win=15680 Len=1268 [TCP segment of a reassembled PDU]"
"267","22.503505","172.16.2.139","217.23.15.220","TCP","54","49261  >  80 [ACK] Seq=259 Ack=37094 Win=49408 Len=0"
"268","22.503582","172.16.2.139","217.23.15.220","TCP","54","49261  >  80 [ACK] Seq=259 Ack=39630 Win=49408 Len=0"
"269","22.611929","217.23.15.220","172.16.2.139","TCP","1322","80  >  49261 [PSH, ACK] Seq=39630 Ack=259 Win=15680 Len=1268 [TCP segment of a reassembled PDU]"
"270","22.611988","217.23.15.220","172.16.2.139","TCP","1322","80  >  49261 [ACK] Seq=40898 Ack=259 Win=15680 Len=1268 [TCP segment of a reassembled PDU]"
"271","22.612059","217.23.15.220","172.16.2.139","TCP","1322","80  >  49261 [ACK] Seq=42166 Ack=259 Win=15680 Len=1268 [TCP segment of a reassembled PDU]"
"272","22.612258","217.23.15.220","172.16.2.139","TCP","1322","80  >  49261 [ACK] Seq=43434 Ack=259 Win=15680 Len=1268 [TCP segment of a reassembled PDU]"
"273","22.612415","217.23.15.220","172.16.2.139","TCP","1322","80  >  49261 [ACK] Seq=44702 Ack=259 Win=15680 Len=1268 [TCP segment of a reassembled PDU]"
"274","22.612426","217.23.15.220","172.16.2.139","TCP","1322","80  >  49261 [ACK] Seq=45970 Ack=259 Win=15680 Len=1268 [TCP segment of a reassembled PDU]"
"275","22.612563","217.23.15.220","172.16.2.139","TCP","1322","80  >  49261 [ACK] Seq=47238 Ack=259 Win=15680 Len=1268 [TCP segment of a reassembled PDU]"
"276","22.612734","217.23.15.220","172.16.2.139","TCP","1322","80  >  49261 [PSH, ACK] Seq=48506 Ack=259 Win=15680 Len=1268 [TCP segment of a reassembled PDU]"
"277","22.624839","172.16.2.139","217.23.15.220","TCP","54","49261  >  80 [ACK] Seq=259 Ack=42166 Win=48128 Len=0"
"278","22.624917","172.16.2.139","217.23.15.220","TCP","54","49261  >  80 [ACK] Seq=259 Ack=44702 Win=48128 Len=0"
"279","22.624977","172.16.2.139","217.23.15.220","TCP","54","49261  >  80 [ACK] Seq=259 Ack=47238 Win=48128 Len=0"
"280","22.625049","172.16.2.139","217.23.15.220","TCP","54","49261  >  80 [ACK] Seq=259 Ack=49774 Win=48128 Len=0"
"281","22.651647","217.23.15.220","172.16.2.139","TCP","1322","80  >  49261 [ACK] Seq=49774 Ack=259 Win=15680 Len=1268 [TCP segment of a reassembled PDU]"
"282","22.651693","217.23.15.220","172.16.2.139","TCP","1322","80  >  49261 [ACK] Seq=51042 Ack=259 Win=15680 Len=1268 [TCP segment of a reassembled PDU]"
"283","22.651698","217.23.15.220","172.16.2.139","TCP","1322","80  >  49261 [ACK] Seq=52310 Ack=259 Win=15680 Len=1268 [TCP segment of a reassembled PDU]"
"284","22.651703","217.23.15.220","172.16.2.139","TCP","1322","80  >  49261 [PSH, ACK] Seq=53578 Ack=259 Win=15680 Len=1268 [TCP segment of a reassembled PDU]"
"285","22.651725","217.23.15.220","172.16.2.139","TCP","1322","80  >  49261 [ACK] Seq=54846 Ack=259 Win=15680 Len=1268 [TCP segment of a reassembled PDU]"
"286","22.651731","217.23.15.220","172.16.2.139","TCP","1322","80  >  49261 [ACK] Seq=56114 Ack=259 Win=15680 Len=1268 [TCP segment of a reassembled PDU]"
"287","22.651842","217.23.15.220","172.16.2.139","TCP","1322","80  >  49261 [ACK] Seq=57382 Ack=259 Win=15680 Len=1268 [TCP segment of a reassembled PDU]"
"288","22.651999","217.23.15.220","172.16.2.139","TCP","1322","80  >  49261 [ACK] Seq=58650 Ack=259 Win=15680 Len=1268 [TCP segment of a reassembled PDU]"
"289","22.652021","217.23.15.220","172.16.2.139","TCP","1322","80  >  49261 [ACK] Seq=59918 Ack=259 Win=15680 Len=1268 [TCP segment of a reassembled PDU]"
"290","22.664865","172.16.2.139","217.23.15.220","TCP","54","49261  >  80 [ACK] Seq=259 Ack=52310 Win=53248 Len=0"
"291","22.664925","172.16.2.139","217.23.15.220","TCP","54","49261  >  80 [ACK] Seq=259 Ack=54846 Win=53248 Len=0"
"292","22.664981","172.16.2.139","217.23.15.220","TCP","54","49261  >  80 [ACK] Seq=259 Ack=57382 Win=53248 Len=0"
"293","22.665035","172.16.2.139","217.23.15.220","TCP","54","49261  >  80 [ACK] Seq=259 Ack=59918 Win=53248 Len=0"
"294","22.772483","217.23.15.220","172.16.2.139","TCP","1322","80  >  49261 [ACK] Seq=61186 Ack=259 Win=15680 Len=1268 [TCP segment of a reassembled PDU]"
"295","22.772534","217.23.15.220","172.16.2.139","TCP","1322","80  >  49261 [PSH, ACK] Seq=62454 Ack=259 Win=15680 Len=1268 [TCP segment of a reassembled PDU]"
"296","22.772645","217.23.15.220","172.16.2.139","TCP","1322","80  >  49261 [ACK] Seq=63722 Ack=259 Win=15680 Len=1268 [TCP segment of a reassembled PDU]"
"297","22.772810","217.23.15.220","172.16.2.139","TCP","1322","80  >  49261 [ACK] Seq=64990 Ack=259 Win=15680 Len=1268 [TCP segment of a reassembled PDU]"
"298","22.772993","217.23.15.220","172.16.2.139","TCP","1322","80  >  49261 [PSH, ACK] Seq=66258 Ack=259 Win=15680 Len=1268 [TCP segment of a reassembled PDU]"
"299","22.773005","217.23.15.220","172.16.2.139","TCP","1322","80  >  49261 [ACK] Seq=67526 Ack=259 Win=15680 Len=1268 [TCP segment of a reassembled PDU]"
"300","22.773132","217.23.15.220","172.16.2.139","TCP","1322","80  >  49261 [ACK] Seq=68794 Ack=259 Win=15680 Len=1268 [TCP segment of a reassembled PDU]"
"301","22.773144","217.23.15.220","172.16.2.139","TCP","1322","80  >  49261 [ACK] Seq=70062 Ack=259 Win=15680 Len=1268 [TCP segment of a reassembled PDU]"
"302","22.773322","217.23.15.220","172.16.2.139","TCP","1322","80  >  49261 [ACK] Seq=71330 Ack=259 Win=15680 Len=1268 [TCP segment of a reassembled PDU]"
"303","22.773500","217.23.15.220","172.16.2.139","TCP","1322","80  >  49261 [ACK] Seq=72598 Ack=259 Win=15680 Len=1268 [TCP segment of a reassembled PDU]"
"304","22.773508","217.23.15.220","172.16.2.139","TCP","1322","80  >  49261 [ACK] Seq=73866 Ack=259 Win=15680 Len=1268 [TCP segment of a reassembled PDU]"
"305","22.773674","217.23.15.220","172.16.2.139","TCP","1322","80  >  49261 [ACK] Seq=75134 Ack=259 Win=15680 Len=1268 [TCP segment of a reassembled PDU]"
"306","22.786536","172.16.2.139","217.23.15.220","TCP","54","49261  >  80 [ACK] Seq=259 Ack=62454 Win=58112 Len=0"
"307","22.786627","172.16.2.139","217.23.15.220","TCP","54","49261  >  80 [ACK] Seq=259 Ack=64990 Win=58112 Len=0"
"308","22.786681","172.16.2.139","217.23.15.220","TCP","54","49261  >  80 [ACK] Seq=259 Ack=67526 Win=58112 Len=0"
"309","22.786753","172.16.2.139","217.23.15.220","TCP","54","49261  >  80 [ACK] Seq=259 Ack=70062 Win=58112 Len=0"
"310","22.786808","172.16.2.139","217.23.15.220","TCP","54","49261  >  80 [ACK] Seq=259 Ack=72598 Win=58112 Len=0"
"311","22.786862","172.16.2.139","217.23.15.220","TCP","54","49261  >  80 [ACK] Seq=259 Ack=75134 Win=55552 Len=0"
"312","22.788141","172.16.2.139","217.23.15.220","TCP","54","49261  >  80 [ACK] Seq=259 Ack=76402 Win=58112 Len=0"
"313","22.812662","217.23.15.220","172.16.2.139","TCP","1322","80  >  49261 [ACK] Seq=76402 Ack=259 Win=15680 Len=1268 [TCP segment of a reassembled PDU]"
"314","22.812688","217.23.15.220","172.16.2.139","TCP","1322","80  >  49261 [ACK] Seq=77670 Ack=259 Win=15680 Len=1268 [TCP segment of a reassembled PDU]"
"315","22.812742","217.23.15.220","172.16.2.139","TCP","1322","80  >  49261 [ACK] Seq=78938 Ack=259 Win=15680 Len=1268 [TCP segment of a reassembled PDU]"
"316","22.812885","217.23.15.220","172.16.2.139","HTTP","1322","[TCP Previous segment not captured] Continuation"
"317","22.812925","217.23.15.220","172.16.2.139","HTTP","1322","Continuation"
"318","22.812935","217.23.15.220","172.16.2.139","TCP","1322","[TCP Out-Of-Order] 80  >  49261 [ACK] Seq=80206 Ack=259 Win=15680 Len=1268"
"319","22.813048","217.23.15.220","172.16.2.139","HTTP","1322","Continuation"
"320","22.813086","217.23.15.220","172.16.2.139","TCP","1322","[TCP Out-Of-Order] 80  >  49261 [ACK] Seq=81474 Ack=259 Win=15680 Len=1268"
"321","22.813096","217.23.15.220","172.16.2.139","HTTP","1322","Continuation"
"322","22.813225","217.23.15.220","172.16.2.139","TCP","1322","[TCP Out-Of-Order] 80  >  49261 [ACK] Seq=82742 Ack=259 Win=15680 Len=1268"
"323","22.813237","217.23.15.220","172.16.2.139","HTTP","1322","Continuation"
"324","22.813242","217.23.15.220","172.16.2.139","TCP","1322","[TCP Out-Of-Order] 80  >  49261 [ACK] Seq=84010 Ack=259 Win=15680 Len=1268"
"325","22.831851","172.16.2.139","217.23.15.220","TCP","54","49261  >  80 [ACK] Seq=259 Ack=78938 Win=68352 Len=0"
"326","22.831924","172.16.2.139","217.23.15.220","TCP","66","49261  >  80 [ACK] Seq=259 Ack=80206 Win=68352 Len=0 SLE=85278 SRE=86546"
"327","22.832015","172.16.2.139","217.23.15.220","TCP","66","[TCP Dup ACK 326#1] 49261  >  80 [ACK] Seq=259 Ack=80206 Win=68352 Len=0 SLE=85278 SRE=87814"
"328","22.832070","172.16.2.139","217.23.15.220","TCP","66","49261  >  80 [ACK] Seq=259 Ack=81474 Win=68352 Len=0 SLE=85278 SRE=87814"
"329","22.832124","172.16.2.139","217.23.15.220","TCP","66","[TCP Dup ACK 328#1] 49261  >  80 [ACK] Seq=259 Ack=81474 Win=68352 Len=0 SLE=85278 SRE=89082"
"330","22.832223","172.16.2.139","217.23.15.220","TCP","66","49261  >  80 [ACK] Seq=259 Ack=82742 Win=68352 Len=0 SLE=85278 SRE=89082"
"331","22.832289","172.16.2.139","217.23.15.220","TCP","66","[TCP Dup ACK 330#1] 49261  >  80 [ACK] Seq=259 Ack=82742 Win=68352 Len=0 SLE=85278 SRE=90350"
"332","22.832342","172.16.2.139","217.23.15.220","TCP","66","49261  >  80 [ACK] Seq=259 Ack=84010 Win=68352 Len=0 SLE=85278 SRE=90350"
"333","22.832520","172.16.2.139","217.23.15.220","TCP","66","[TCP Dup ACK 332#1] 49261  >  80 [ACK] Seq=259 Ack=84010 Win=68352 Len=0 SLE=85278 SRE=91618"
"334","22.832576","172.16.2.139","217.23.15.220","TCP","54","49261  >  80 [ACK] Seq=259 Ack=91618 Win=68352 Len=0"
"335","22.933652","217.23.15.220","172.16.2.139","HTTP","1322","Continuation"
"336","22.933697","217.23.15.220","172.16.2.139","HTTP","1322","Continuation"
"337","22.933779","217.23.15.220","172.16.2.139","HTTP","1322","Continuation"
"338","22.933953","217.23.15.220","172.16.2.139","HTTP","1322","Continuation"
"339","22.933988","217.23.15.220","172.16.2.139","HTTP","1322","Continuation"
"340","22.934122","217.23.15.220","172.16.2.139","HTTP","1322","Continuation"
"341","22.934297","217.23.15.220","172.16.2.139","HTTP","1322","Continuation"
"342","22.934315","217.23.15.220","172.16.2.139","HTTP","1322","Continuation"
"343","22.934554","217.23.15.220","172.16.2.139","HTTP","1322","Continuation"
"344","22.934561","217.23.15.220","172.16.2.139","HTTP","1322","Continuation"
"345","22.934731","217.23.15.220","172.16.2.139","HTTP","1322","Continuation"
"346","22.934742","217.23.15.220","172.16.2.139","HTTP","1322","Continuation"
"347","22.934901","217.23.15.220","172.16.2.139","HTTP","1322","Continuation"
"348","22.935077","217.23.15.220","172.16.2.139","HTTP","1322","Continuation"
"349","22.935099","217.23.15.220","172.16.2.139","HTTP","1322","Continuation"
"350","22.935254","217.23.15.220","172.16.2.139","HTTP","1322","Continuation"
"351","22.935438","217.23.15.220","172.16.2.139","HTTP","1322","Continuation"
"352","22.935445","217.23.15.220","172.16.2.139","HTTP","1322","Continuation"
"353","22.935593","217.23.15.220","172.16.2.139","HTTP","1322","Continuation"
"354","22.935787","217.23.15.220","172.16.2.139","HTTP","1322","Continuation"
"355","22.947302","172.16.2.139","217.23.15.220","TCP","54","49261  >  80 [ACK] Seq=259 Ack=94154 Win=76032 Len=0"
"356","22.947879","172.16.2.139","217.23.15.220","TCP","54","49261  >  80 [ACK] Seq=259 Ack=96690 Win=76032 Len=0"
"357","22.947942","172.16.2.139","217.23.15.220","TCP","54","49261  >  80 [ACK] Seq=259 Ack=99226 Win=76032 Len=0"
"358","22.948088","172.16.2.139","217.23.15.220","TCP","54","49261  >  80 [ACK] Seq=259 Ack=101762 Win=76032 Len=0"
"359","22.948143","172.16.2.139","217.23.15.220","TCP","54","49261  >  80 [ACK] Seq=259 Ack=104298 Win=76032 Len=0"
"360","22.948275","172.16.2.139","217.23.15.220","TCP","54","49261  >  80 [ACK] Seq=259 Ack=106834 Win=76032 Len=0"
"361","22.948329","172.16.2.139","217.23.15.220","TCP","54","49261  >  80 [ACK] Seq=259 Ack=109370 Win=74752 Len=0"
"362","22.948440","172.16.2.139","217.23.15.220","TCP","54","49261  >  80 [ACK] Seq=259 Ack=111906 Win=72192 Len=0"
"363","22.948527","172.16.2.139","217.23.15.220","TCP","54","49261  >  80 [ACK] Seq=259 Ack=114442 Win=69632 Len=0"
"364","22.948582","172.16.2.139","217.23.15.220","TCP","54","49261  >  80 [ACK] Seq=259 Ack=116978 Win=67072 Len=0"
"365","22.956876","172.16.2.139","217.23.15.220","TCP","54","[TCP Window Update] 49261  >  80 [ACK] Seq=259 Ack=116978 Win=76032 Len=0"
"366","22.978919","217.23.15.220","172.16.2.139","HTTP","1322","Continuation"
"367","22.979040","217.23.15.220","172.16.2.139","HTTP","1322","Continuation"
"368","22.979188","217.23.15.220","172.16.2.139","HTTP","1322","Continuation"
"369","22.979698","217.23.15.220","172.16.2.139","HTTP","1322","Continuation"
"370","22.979881","217.23.15.220","172.16.2.139","TCP","1322","[TCP Spurious Retransmission] 80  >  49261 [ACK] Seq=80206 Ack=259 Win=15680 Len=1268"
"371","22.979892","217.23.15.220","172.16.2.139","HTTP","1322","Continuation"
"372","22.979901","217.23.15.220","172.16.2.139","HTTP","1322","Continuation"
"373","22.979906","217.23.15.220","172.16.2.139","TCP","1322","[TCP Spurious Retransmission] 80  >  49261 [ACK] Seq=81474 Ack=259 Win=15680 Len=1268"
"374","22.980042","217.23.15.220","172.16.2.139","TCP","1322","[TCP Spurious Retransmission] 80  >  49261 [ACK] Seq=82742 Ack=259 Win=15680 Len=1268"
"375","22.980217","217.23.15.220","172.16.2.139","TCP","1322","[TCP Spurious Retransmission] 80  >  49261 [ACK] Seq=84010 Ack=259 Win=15680 Len=1268"
"376","22.992075","172.16.2.139","217.23.15.220","TCP","54","49261  >  80 [ACK] Seq=259 Ack=119514 Win=94976 Len=0"
"377","22.992362","172.16.2.139","217.23.15.220","TCP","54","49261  >  80 [ACK] Seq=259 Ack=122050 Win=94976 Len=0"
"378","22.992485","172.16.2.139","217.23.15.220","TCP","66","[TCP Dup ACK 377#1] 49261  >  80 [ACK] Seq=259 Ack=122050 Win=94976 Len=0 SLE=80206 SRE=81474"
"379","22.992571","172.16.2.139","217.23.15.220","TCP","54","49261  >  80 [ACK] Seq=259 Ack=124586 Win=94976 Len=0"
"380","22.992681","172.16.2.139","217.23.15.220","TCP","66","[TCP Dup ACK 379#1] 49261  >  80 [ACK] Seq=259 Ack=124586 Win=94976 Len=0 SLE=81474 SRE=82742"
"381","22.993023","172.16.2.139","217.23.15.220","TCP","66","[TCP Dup ACK 379#2] 49261  >  80 [ACK] Seq=259 Ack=124586 Win=94976 Len=0 SLE=82742 SRE=84010"
"382","22.994439","172.16.2.139","217.23.15.220","TCP","66","[TCP Dup ACK 379#3] 49261  >  80 [ACK] Seq=259 Ack=124586 Win=94976 Len=0 SLE=84010 SRE=85278"
"383","23.094325","217.23.15.220","172.16.2.139","HTTP","1322","Continuation"
"384","23.094382","217.23.15.220","172.16.2.139","HTTP","1322","Continuation"
"385","23.094921","217.23.15.220","172.16.2.139","HTTP","1322","Continuation"
"386","23.095092","217.23.15.220","172.16.2.139","HTTP","1322","Continuation"
"387","23.095276","217.23.15.220","172.16.2.139","HTTP","1322","Continuation"
"388","23.095448","217.23.15.220","172.16.2.139","HTTP","1322","Continuation"
"389","23.095459","217.23.15.220","172.16.2.139","HTTP","1322","Continuation"
"390","23.095600","217.23.15.220","172.16.2.139","HTTP","1322","Continuation"
"391","23.095820","217.23.15.220","172.16.2.139","HTTP","1322","Continuation"
"392","23.095837","217.23.15.220","172.16.2.139","HTTP","1322","Continuation"
"393","23.095966","217.23.15.220","172.16.2.139","HTTP","1322","Continuation"
"394","23.095982","217.23.15.220","172.16.2.139","HTTP","1322","Continuation"
"395","23.096147","217.23.15.220","172.16.2.139","HTTP","1322","Continuation"
"396","23.096321","217.23.15.220","172.16.2.139","HTTP","1322","Continuation"
"397","23.096328","217.23.15.220","172.16.2.139","HTTP","1322","Continuation"
"398","23.096485","217.23.15.220","172.16.2.139","HTTP","1322","Continuation"
"399","23.096652","217.23.15.220","172.16.2.139","HTTP","1322","Continuation"
"400","23.106966","172.16.2.139","217.23.15.220","TCP","54","49261  >  80 [ACK] Seq=259 Ack=127122 Win=93696 Len=0"
"401","23.107289","172.16.2.139","217.23.15.220","TCP","54","49261  >  80 [ACK] Seq=259 Ack=129658 Win=93696 Len=0"
"402","23.107356","172.16.2.139","217.23.15.220","TCP","54","49261  >  80 [ACK] Seq=259 Ack=132194 Win=93696 Len=0"
"403","23.107457","172.16.2.139","217.23.15.220","TCP","54","49261  >  80 [ACK] Seq=259 Ack=134730 Win=92416 Len=0"
"404","23.108215","172.16.2.139","217.23.15.220","TCP","54","49261  >  80 [ACK] Seq=259 Ack=137266 Win=89856 Len=0"
"405","23.108487","172.16.2.139","217.23.15.220","TCP","54","49261  >  80 [ACK] Seq=259 Ack=139802 Win=87296 Len=0"
"406","23.108594","172.16.2.139","217.23.15.220","TCP","54","49261  >  80 [ACK] Seq=259 Ack=142338 Win=84736 Len=0"
"407","23.108648","172.16.2.139","217.23.15.220","TCP","54","49261  >  80 [ACK] Seq=259 Ack=144874 Win=82176 Len=0"
"408","23.112091","172.16.2.139","217.23.15.220","TCP","54","49261  >  80 [ACK] Seq=259 Ack=146142 Win=93696 Len=0"
"409","23.139134","217.23.15.220","172.16.2.139","HTTP","1322","Continuation"
"410","23.139183","217.23.15.220","172.16.2.139","HTTP","1322","Continuation"
"411","23.139591","217.23.15.220","172.16.2.139","HTTP","1322","Continuation"
"412","23.139613","217.23.15.220","172.16.2.139","HTTP","1322","Continuation"
"413","23.140334","217.23.15.220","172.16.2.139","HTTP","1322","Continuation"
"414","23.140448","217.23.15.220","172.16.2.139","HTTP","1322","Continuation"
"415","23.140459","217.23.15.220","172.16.2.139","HTTP","1322","Continuation"
"416","23.142087","217.23.15.220","172.16.2.139","HTTP","1322","Continuation"
"417","23.142192","217.23.15.220","172.16.2.139","HTTP","1322","Continuation"
"418","23.142353","217.23.15.220","172.16.2.139","TCP","1322","80  >  49261 [ACK] Seq=157554 Ack=259 Win=15680 Len=1268 [TCP segment of a reassembled PDU]"
"419","23.152559","172.16.2.139","217.23.15.220","TCP","54","49261  >  80 [ACK] Seq=259 Ack=148678 Win=105216 Len=0"
"420","23.152619","172.16.2.139","217.23.15.220","TCP","54","49261  >  80 [ACK] Seq=259 Ack=151214 Win=105216 Len=0"
"421","23.152673","172.16.2.139","217.23.15.220","TCP","54","49261  >  80 [ACK] Seq=259 Ack=153750 Win=106496 Len=0"
"422","23.159635","172.16.2.139","217.23.15.220","TCP","54","49261  >  80 [ACK] Seq=259 Ack=156286 Win=106496 Len=0"
"423","23.159689","172.16.2.139","217.23.15.220","TCP","54","49261  >  80 [ACK] Seq=259 Ack=158822 Win=106496 Len=0"
"424","23.254579","217.23.15.220","172.16.2.139","TCP","1322","80  >  49261 [ACK] Seq=158822 Ack=259 Win=15680 Len=1268 [TCP segment of a reassembled PDU]"
"425","23.254720","217.23.15.220","172.16.2.139","TCP","1322","80  >  49261 [ACK] Seq=160090 Ack=259 Win=15680 Len=1268 [TCP segment of a reassembled PDU]"
"426","23.254924","217.23.15.220","172.16.2.139","TCP","1322","80  >  49261 [ACK] Seq=161358 Ack=259 Win=15680 Len=1268 [TCP segment of a reassembled PDU]"
"427","23.254936","217.23.15.220","172.16.2.139","TCP","1322","80  >  49261 [ACK] Seq=162626 Ack=259 Win=15680 Len=1268 [TCP segment of a reassembled PDU]"
"428","23.255064","217.23.15.220","172.16.2.139","TCP","1322","80  >  49261 [ACK] Seq=163894 Ack=259 Win=15680 Len=1268 [TCP segment of a reassembled PDU]"
"429","23.255247","217.23.15.220","172.16.2.139","TCP","1322","80  >  49261 [ACK] Seq=165162 Ack=259 Win=15680 Len=1268 [TCP segment of a reassembled PDU]"
"430","23.255257","217.23.15.220","172.16.2.139","TCP","1322","80  >  49261 [ACK] Seq=166430 Ack=259 Win=15680 Len=1268 [TCP segment of a reassembled PDU]"
"431","23.255430","217.23.15.220","172.16.2.139","TCP","1322","80  >  49261 [ACK] Seq=167698 Ack=259 Win=15680 Len=1268 [TCP segment of a reassembled PDU]"
"432","23.255437","217.23.15.220","172.16.2.139","TCP","1322","80  >  49261 [ACK] Seq=168966 Ack=259 Win=15680 Len=1268 [TCP segment of a reassembled PDU]"
"433","23.255578","217.23.15.220","172.16.2.139","TCP","1322","80  >  49261 [ACK] Seq=170234 Ack=259 Win=15680 Len=1268 [TCP segment of a reassembled PDU]"
"434","23.255757","217.23.15.220","172.16.2.139","TCP","1322","80  >  49261 [PSH, ACK] Seq=171502 Ack=259 Win=15680 Len=1268 [TCP segment of a reassembled PDU]"
"435","23.255775","217.23.15.220","172.16.2.139","TCP","1322","80  >  49261 [ACK] Seq=172770 Ack=259 Win=15680 Len=1268 [TCP segment of a reassembled PDU]"
"436","23.255947","217.23.15.220","172.16.2.139","TCP","1322","80  >  49261 [ACK] Seq=174038 Ack=259 Win=15680 Len=1268 [TCP segment of a reassembled PDU]"
"437","23.255955","217.23.15.220","172.16.2.139","TCP","1322","80  >  49261 [ACK] Seq=175306 Ack=259 Win=15680 Len=1268 [TCP segment of a reassembled PDU]"
"438","23.256109","217.23.15.220","172.16.2.139","TCP","1322","80  >  49261 [ACK] Seq=176574 Ack=259 Win=15680 Len=1268 [TCP segment of a reassembled PDU]"
"439","23.256299","217.23.15.220","172.16.2.139","TCP","1322","80  >  49261 [ACK] Seq=177842 Ack=259 Win=15680 Len=1268 [TCP segment of a reassembled PDU]"
"440","23.256313","217.23.15.220","172.16.2.139","TCP","1322","80  >  49261 [ACK] Seq=179110 Ack=259 Win=15680 Len=1268 [TCP segment of a reassembled PDU]"
"441","23.256493","217.23.15.220","172.16.2.139","TCP","1322","80  >  49261 [ACK] Seq=180378 Ack=259 Win=15680 Len=1268 [TCP segment of a reassembled PDU]"
"442","23.256503","217.23.15.220","172.16.2.139","TCP","1322","80  >  49261 [ACK] Seq=181646 Ack=259 Win=15680 Len=1268 [TCP segment of a reassembled PDU]"
"443","23.256633","217.23.15.220","172.16.2.139","TCP","1322","80  >  49261 [ACK] Seq=182914 Ack=259 Win=15680 Len=1268 [TCP segment of a reassembled PDU]"
"444","23.256813","217.23.15.220","172.16.2.139","TCP","1322","80  >  49261 [ACK] Seq=184182 Ack=259 Win=15680 Len=1268 [TCP segment of a reassembled PDU]"
"445","23.256825","217.23.15.220","172.16.2.139","TCP","1322","80  >  49261 [ACK] Seq=185450 Ack=259 Win=15680 Len=1268 [TCP segment of a reassembled PDU]"
"446","23.256991","217.23.15.220","172.16.2.139","TCP","1322","80  >  49261 [ACK] Seq=186718 Ack=259 Win=15680 Len=1268 [TCP segment of a reassembled PDU]"
"447","23.257170","217.23.15.220","172.16.2.139","TCP","1322","80  >  49261 [ACK] Seq=187986 Ack=259 Win=15680 Len=1268 [TCP segment of a reassembled PDU]"
"448","23.259697","217.23.15.220","172.16.2.139","TCP","1322","80  >  49261 [ACK] Seq=189254 Ack=259 Win=15680 Len=1268 [TCP segment of a reassembled PDU]"
"449","23.259840","217.23.15.220","172.16.2.139","TCP","1322","80  >  49261 [ACK] Seq=190522 Ack=259 Win=15680 Len=1268 [TCP segment of a reassembled PDU]"
"450","23.271568","172.16.2.139","217.23.15.220","TCP","54","49261  >  80 [ACK] Seq=259 Ack=161358 Win=106496 Len=0"
"451","23.271642","172.16.2.139","217.23.15.220","TCP","54","49261  >  80 [ACK] Seq=259 Ack=163894 Win=106496 Len=0"
"452","23.271751","172.16.2.139","217.23.15.220","TCP","54","49261  >  80 [ACK] Seq=259 Ack=166430 Win=106496 Len=0"
"453","23.271807","172.16.2.139","217.23.15.220","TCP","54","49261  >  80 [ACK] Seq=259 Ack=168966 Win=106496 Len=0"
"454","23.271901","172.16.2.139","217.23.15.220","TCP","54","49261  >  80 [ACK] Seq=259 Ack=171502 Win=106496 Len=0"
"455","23.272027","172.16.2.139","217.23.15.220","TCP","54","49261  >  80 [ACK] Seq=259 Ack=174038 Win=106496 Len=0"
"456","23.272118","172.16.2.139","217.23.15.220","TCP","54","49261  >  80 [ACK] Seq=259 Ack=176574 Win=105216 Len=0"
"457","23.272215","172.16.2.139","217.23.15.220","TCP","54","49261  >  80 [ACK] Seq=259 Ack=179110 Win=102656 Len=0"
"458","23.272303","172.16.2.139","217.23.15.220","TCP","54","49261  >  80 [ACK] Seq=259 Ack=181646 Win=100096 Len=0"
"459","23.272370","172.16.2.139","217.23.15.220","TCP","54","49261  >  80 [ACK] Seq=259 Ack=184182 Win=97536 Len=0"
"460","23.272457","172.16.2.139","217.23.15.220","TCP","54","49261  >  80 [ACK] Seq=259 Ack=186718 Win=94976 Len=0"
"461","23.272512","172.16.2.139","217.23.15.220","TCP","54","49261  >  80 [ACK] Seq=259 Ack=189254 Win=92416 Len=0"
"462","23.272629","172.16.2.139","217.23.15.220","TCP","54","49261  >  80 [ACK] Seq=259 Ack=191790 Win=89856 Len=0"
"463","23.273081","172.16.2.139","217.23.15.220","TCP","54","[TCP Window Update] 49261  >  80 [ACK] Seq=259 Ack=191790 Win=106496 Len=0"
"464","23.300214","217.23.15.220","172.16.2.139","TCP","1322","80  >  49261 [ACK] Seq=191790 Ack=259 Win=15680 Len=1268 [TCP segment of a reassembled PDU]"
"465","23.300322","217.23.15.220","172.16.2.139","TCP","1322","80  >  49261 [ACK] Seq=193058 Ack=259 Win=15680 Len=1268 [TCP segment of a reassembled PDU]"
"466","23.300375","217.23.15.220","172.16.2.139","TCP","1322","80  >  49261 [ACK] Seq=194326 Ack=259 Win=15680 Len=1268 [TCP segment of a reassembled PDU]"
"467","23.300524","217.23.15.220","172.16.2.139","TCP","1322","80  >  49261 [ACK] Seq=195594 Ack=259 Win=15680 Len=1268 [TCP segment of a reassembled PDU]"
"468","23.300718","217.23.15.220","172.16.2.139","TCP","1322","80  >  49261 [PSH, ACK] Seq=196862 Ack=259 Win=15680 Len=1268 [TCP segment of a reassembled PDU]"
"469","23.300729","217.23.15.220","172.16.2.139","TCP","1322","80  >  49261 [ACK] Seq=198130 Ack=259 Win=15680 Len=1268 [TCP segment of a reassembled PDU]"
"470","23.300872","217.23.15.220","172.16.2.139","TCP","1322","80  >  49261 [ACK] Seq=199398 Ack=259 Win=15680 Len=1268 [TCP segment of a reassembled PDU]"
"471","23.300884","217.23.15.220","172.16.2.139","TCP","1322","80  >  49261 [ACK] Seq=200666 Ack=259 Win=15680 Len=1268 [TCP segment of a reassembled PDU]"
"472","23.301021","217.23.15.220","172.16.2.139","TCP","1322","80  >  49261 [ACK] Seq=201934 Ack=259 Win=15680 Len=1268 [TCP segment of a reassembled PDU]"
"473","23.307353","217.23.15.220","172.16.2.139","TCP","1322","80  >  49261 [ACK] Seq=203202 Ack=259 Win=15680 Len=1268 [TCP segment of a reassembled PDU]"
"474","23.307376","217.23.15.220","172.16.2.139","HTTP","1322","Continuation"
"475","23.307425","217.23.15.220","172.16.2.139","TCP","1322","80  >  49261 [ACK] Seq=205738 Ack=259 Win=15680 Len=1268 [TCP segment of a reassembled PDU]"
"476","23.307618","217.23.15.220","172.16.2.139","TCP","1322","80  >  49261 [ACK] Seq=207006 Ack=259 Win=15680 Len=1268 [TCP segment of a reassembled PDU]"
"477","23.307764","217.23.15.220","172.16.2.139","TCP","1322","80  >  49261 [ACK] Seq=208274 Ack=259 Win=15680 Len=1268 [TCP segment of a reassembled PDU]"
"478","23.307777","217.23.15.220","172.16.2.139","HTTP","1322","Continuation"
"479","23.312777","172.16.2.139","217.23.15.220","TCP","54","49261  >  80 [ACK] Seq=259 Ack=194326 Win=129280 Len=0"
"480","23.312829","172.16.2.139","217.23.15.220","TCP","54","49261  >  80 [ACK] Seq=259 Ack=196862 Win=129280 Len=0"
"481","23.312904","172.16.2.139","217.23.15.220","TCP","54","49261  >  80 [ACK] Seq=259 Ack=199398 Win=129280 Len=0"
"482","23.313014","172.16.2.139","217.23.15.220","TCP","54","49261  >  80 [ACK] Seq=259 Ack=201934 Win=129280 Len=0"
"483","23.320013","172.16.2.139","217.23.15.220","TCP","54","49261  >  80 [ACK] Seq=259 Ack=204470 Win=129280 Len=0"
"484","23.320073","172.16.2.139","217.23.15.220","TCP","54","49261  >  80 [ACK] Seq=259 Ack=207006 Win=129280 Len=0"
"485","23.320123","172.16.2.139","217.23.15.220","TCP","54","49261  >  80 [ACK] Seq=259 Ack=209542 Win=129280 Len=0"
"486","23.419140","217.23.15.220","172.16.2.139","HTTP","1322","[TCP Previous segment not captured] Continuation"
"487","23.419177","217.23.15.220","172.16.2.139","HTTP","1322","Continuation"
"488","23.419182","217.23.15.220","172.16.2.139","TCP","1322","[TCP Out-Of-Order] 80  >  49261 [ACK] Seq=210810 Ack=259 Win=15680 Len=1268"
"489","23.419380","217.23.15.220","172.16.2.139","TCP","1322","[TCP Out-Of-Order] 80  >  49261 [ACK] Seq=212078 Ack=259 Win=15680 Len=1268"
"490","23.419391","217.23.15.220","172.16.2.139","HTTP","1322","Continuation"
"491","23.419396","217.23.15.220","172.16.2.139","HTTP","1322","Continuation"
"492","23.419563","217.23.15.220","172.16.2.139","TCP","1322","[TCP Out-Of-Order] 80  >  49261 [ACK] Seq=213346 Ack=259 Win=15680 Len=1268"
"493","23.419570","217.23.15.220","172.16.2.139","HTTP","1322","Continuation"
"494","23.419574","217.23.15.220","172.16.2.139","TCP","1322","[TCP Out-Of-Order] 80  >  49261 [ACK] Seq=214614 Ack=259 Win=15680 Len=1268"
"495","23.419703","217.23.15.220","172.16.2.139","HTTP","1322","Continuation"
"496","23.419711","217.23.15.220","172.16.2.139","HTTP","1322","Continuation"
"497","23.419887","217.23.15.220","172.16.2.139","HTTP","1322","Continuation"
"498","23.420066","217.23.15.220","172.16.2.139","HTTP","1322","Continuation"
"499","23.420075","217.23.15.220","172.16.2.139","HTTP","1322","Continuation"
"500","23.420240","217.23.15.220","172.16.2.139","HTTP","1322","Continuation"
"501","23.420247","217.23.15.220","172.16.2.139","HTTP","1322","Continuation"
"502","23.420415","217.23.15.220","172.16.2.139","HTTP","1322","Continuation"
"503","23.420596","217.23.15.220","172.16.2.139","HTTP","1322","Continuation"
"504","23.420603","217.23.15.220","172.16.2.139","HTTP","136","Continuation"
"505","23.434729","172.16.2.139","217.23.15.220","TCP","66","49261  >  80 [ACK] Seq=259 Ack=210810 Win=134400 Len=0 SLE=215882 SRE=217150"
"506","23.434863","172.16.2.139","217.23.15.220","TCP","66","[TCP Dup ACK 505#1] 49261  >  80 [ACK] Seq=259 Ack=210810 Win=134400 Len=0 SLE=215882 SRE=218418"
"507","23.434967","172.16.2.139","217.23.15.220","TCP","66","49261  >  80 [ACK] Seq=259 Ack=212078 Win=134400 Len=0 SLE=215882 SRE=218418"
"508","23.435085","172.16.2.139","217.23.15.220","TCP","66","49261  >  80 [ACK] Seq=259 Ack=213346 Win=134400 Len=0 SLE=215882 SRE=218418"
"509","23.435149","172.16.2.139","217.23.15.220","TCP","66","[TCP Dup ACK 508#1] 49261  >  80 [ACK] Seq=259 Ack=213346 Win=134400 Len=0 SLE=215882 SRE=219686"
"510","23.435212","172.16.2.139","217.23.15.220","TCP","66","[TCP Dup ACK 508#2] 49261  >  80 [ACK] Seq=259 Ack=213346 Win=134400 Len=0 SLE=215882 SRE=220954"
"511","23.435265","172.16.2.139","217.23.15.220","TCP","66","49261  >  80 [ACK] Seq=259 Ack=214614 Win=134400 Len=0 SLE=215882 SRE=220954"
"512","23.435373","172.16.2.139","217.23.15.220","TCP","66","[TCP Dup ACK 511#1] 49261  >  80 [ACK] Seq=259 Ack=214614 Win=134400 Len=0 SLE=215882 SRE=222222"
"513","23.435442","172.16.2.139","217.23.15.220","TCP","54","49261  >  80 [ACK] Seq=259 Ack=222222 Win=134400 Len=0"
"514","23.435505","172.16.2.139","217.23.15.220","TCP","54","49261  >  80 [ACK] Seq=259 Ack=224758 Win=131840 Len=0"
"515","23.435572","172.16.2.139","217.23.15.220","TCP","66","[TCP Dup ACK 514#1] 49261  >  80 [ACK] Seq=259 Ack=224758 Win=131840 Len=0 SLE=233634 SRE=233716"
"516","23.435639","172.16.2.139","217.23.15.220","TCP","66","49261  >  80 [ACK] Seq=259 Ack=226026 Win=130560 Len=0 SLE=233634 SRE=233716"
"517","23.435695","172.16.2.139","217.23.15.220","TCP","66","49261  >  80 [ACK] Seq=259 Ack=227294 Win=129280 Len=0 SLE=233634 SRE=233716"
"518","23.435754","172.16.2.139","217.23.15.220","TCP","66","49261  >  80 [ACK] Seq=259 Ack=228562 Win=128000 Len=0 SLE=233634 SRE=233716"
"519","23.435822","172.16.2.139","217.23.15.220","TCP","66","49261  >  80 [ACK] Seq=259 Ack=229830 Win=126720 Len=0 SLE=233634 SRE=233716"
"520","23.435908","172.16.2.139","217.23.15.220","TCP","66","49261  >  80 [ACK] Seq=259 Ack=231098 Win=125440 Len=0 SLE=233634 SRE=233716"
"521","23.435968","172.16.2.139","217.23.15.220","TCP","66","49261  >  80 [ACK] Seq=259 Ack=232366 Win=124160 Len=0 SLE=233634 SRE=233716"
"522","23.436022","172.16.2.139","217.23.15.220","TCP","54","49261  >  80 [ACK] Seq=259 Ack=233716 Win=122880 Len=0"
"523","23.436312","172.16.2.139","217.23.15.220","TCP","54","[TCP Window Update] 49261  >  80 [ACK] Seq=259 Ack=233716 Win=134400 Len=0"
"524","23.448144","172.16.2.139","217.23.15.220","HTTP","335","GET /temp/support/-148529710/?page=33333302 HTTP/1.1 "
"525","23.582343","217.23.15.220","172.16.2.139","TCP","1322","[TCP Spurious Retransmission] 80  >  49261 [ACK] Seq=210810 Ack=259 Win=15680 Len=1268"
"526","23.582414","217.23.15.220","172.16.2.139","TCP","1322","[TCP Spurious Retransmission] 80  >  49261 [ACK] Seq=212078 Ack=259 Win=15680 Len=1268"
"527","23.582482","217.23.15.220","172.16.2.139","TCP","1322","[TCP Spurious Retransmission] 80  >  49261 [ACK] Seq=213346 Ack=259 Win=15680 Len=1268"
"528","23.582640","217.23.15.220","172.16.2.139","TCP","1322","[TCP Spurious Retransmission] 80  >  49261 [ACK] Seq=224758 Ack=259 Win=15680 Len=1268"
"529","23.582653","217.23.15.220","172.16.2.139","TCP","1322","[TCP Spurious Retransmission] 80  >  49261 [ACK] Seq=214614 Ack=259 Win=15680 Len=1268"
"530","23.582658","217.23.15.220","172.16.2.139","TCP","1322","[TCP Spurious Retransmission] 80  >  49261 [ACK] Seq=226026 Ack=259 Win=15680 Len=1268"
"531","23.582819","217.23.15.220","172.16.2.139","TCP","1322","[TCP Spurious Retransmission] 80  >  49261 [ACK] Seq=227294 Ack=259 Win=15680 Len=1268"
"532","23.582999","217.23.15.220","172.16.2.139","TCP","1322","[TCP Spurious Retransmission] 80  >  49261 [ACK] Seq=228562 Ack=259 Win=15680 Len=1268"
"533","23.583007","217.23.15.220","172.16.2.139","TCP","1322","[TCP Spurious Retransmission] 80  >  49261 [ACK] Seq=229830 Ack=259 Win=15680 Len=1268"
"534","23.583165","217.23.15.220","172.16.2.139","TCP","1322","[TCP Spurious Retransmission] 80  >  49261 [ACK] Seq=231098 Ack=259 Win=15680 Len=1268"
"535","23.583361","217.23.15.220","172.16.2.139","TCP","1322","[TCP Spurious Retransmission] 80  >  49261 [ACK] Seq=232366 Ack=259 Win=15680 Len=1268"
"536","23.595428","172.16.2.139","217.23.15.220","TCP","66","[TCP Dup ACK 522#1] 49261  >  80 [ACK] Seq=540 Ack=233716 Win=134400 Len=0 SLE=210810 SRE=212078"
"537","23.595484","172.16.2.139","217.23.15.220","TCP","66","[TCP Dup ACK 522#2] 49261  >  80 [ACK] Seq=540 Ack=233716 Win=134400 Len=0 SLE=212078 SRE=213346"
"538","23.595577","172.16.2.139","217.23.15.220","TCP","66","[TCP Dup ACK 522#3] 49261  >  80 [ACK] Seq=540 Ack=233716 Win=134400 Len=0 SLE=213346 SRE=214614"
"539","23.595675","172.16.2.139","217.23.15.220","TCP","66","[TCP Dup ACK 522#4] 49261  >  80 [ACK] Seq=540 Ack=233716 Win=134400 Len=0 SLE=224758 SRE=226026"
"540","23.595729","172.16.2.139","217.23.15.220","TCP","66","[TCP Dup ACK 522#5] 49261  >  80 [ACK] Seq=540 Ack=233716 Win=134400 Len=0 SLE=214614 SRE=215882"
"541","23.595794","172.16.2.139","217.23.15.220","TCP","66","[TCP Dup ACK 522#6] 49261  >  80 [ACK] Seq=540 Ack=233716 Win=134400 Len=0 SLE=226026 SRE=227294"
"542","23.595902","172.16.2.139","217.23.15.220","TCP","66","[TCP Dup ACK 522#7] 49261  >  80 [ACK] Seq=540 Ack=233716 Win=134400 Len=0 SLE=227294 SRE=228562"
"543","23.595966","172.16.2.139","217.23.15.220","TCP","66","[TCP Dup ACK 522#8] 49261  >  80 [ACK] Seq=540 Ack=233716 Win=134400 Len=0 SLE=228562 SRE=229830"
"544","23.596015","172.16.2.139","217.23.15.220","TCP","66","[TCP Dup ACK 522#9] 49261  >  80 [ACK] Seq=540 Ack=233716 Win=134400 Len=0 SLE=229830 SRE=231098"
"545","23.596070","172.16.2.139","217.23.15.220","TCP","66","[TCP Dup ACK 522#10] 49261  >  80 [ACK] Seq=540 Ack=233716 Win=134400 Len=0 SLE=231098 SRE=232366"
"546","23.596122","172.16.2.139","217.23.15.220","TCP","66","[TCP Dup ACK 522#11] 49261  >  80 [ACK] Seq=540 Ack=233716 Win=134400 Len=0 SLE=232366 SRE=233634"
"547","23.632122","217.23.15.220","172.16.2.139","TCP","60","80  >  49261 [ACK] Seq=233716 Ack=540 Win=16752 Len=0"
"548","24.153959","217.23.15.220","172.16.2.139","HTTP","464","HTTP/1.1 302 Found "
"549","24.169506","172.16.2.139","217.23.15.220","TCP","54","49261  >  80 [FIN, ACK] Seq=540 Ack=234126 Win=133888 Len=0"
"550","24.170755","172.16.2.139","217.23.15.220","TCP","66","49274  >  80 [SYN] Seq=0 Win=8192 Len=0 MSS=1268 WS=256 SACK_PERM"
"551","24.303391","217.23.15.220","172.16.2.139","TCP","66","80  >  49274 [SYN, ACK] Seq=0 Ack=1 Win=14600 Len=0 MSS=1460 SACK_PERM WS=16"
"552","24.314643","172.16.2.139","217.23.15.220","TCP","54","49274  >  80 [ACK] Seq=1 Ack=1 Win=16384 Len=0"
"553","24.316352","217.23.15.220","172.16.2.139","TCP","60","80  >  49261 [FIN, ACK] Seq=234126 Ack=541 Win=16752 Len=0"
"554","24.316427","172.16.2.139","217.23.15.220","HTTP","309","GET /temp/min.exe HTTP/1.1 "
"555","24.327804","172.16.2.139","217.23.15.220","TCP","54","49261  >  80 [ACK] Seq=541 Ack=234127 Win=133888 Len=0"
"556","24.449027","217.23.15.220","172.16.2.139","TCP","60","80  >  49274 [ACK] Seq=1 Ack=256 Win=15680 Len=0"
"557","24.478154","217.23.15.220","172.16.2.139","TCP","1322","80  >  49274 [ACK] Seq=1 Ack=256 Win=15680 Len=1268 [TCP segment of a reassembled PDU]"
"558","24.478365","217.23.15.220","172.16.2.139","TCP","1322","80  >  49274 [ACK] Seq=1269 Ack=256 Win=15680 Len=1268 [TCP segment of a reassembled PDU]"
"559","24.478580","217.23.15.220","172.16.2.139","TCP","1322","80  >  49274 [ACK] Seq=2537 Ack=256 Win=15680 Len=1268 [TCP segment of a reassembled PDU]"
"560","24.478595","217.23.15.220","172.16.2.139","TCP","375","80  >  49274 [PSH, ACK] Seq=3805 Ack=256 Win=15680 Len=321 [TCP segment of a reassembled PDU]"
"561","24.491758","172.16.2.139","217.23.15.220","TCP","54","49274  >  80 [ACK] Seq=256 Ack=2537 Win=16384 Len=0"
"562","24.491826","172.16.2.139","217.23.15.220","TCP","54","49274  >  80 [ACK] Seq=256 Ack=4126 Win=16384 Len=0"
"563","24.519197","217.23.15.220","172.16.2.139","TCP","1322","80  >  49274 [ACK] Seq=4126 Ack=256 Win=15680 Len=1268 [TCP segment of a reassembled PDU]"
"564","24.519309","217.23.15.220","172.16.2.139","TCP","1322","80  >  49274 [ACK] Seq=5394 Ack=256 Win=15680 Len=1268 [TCP segment of a reassembled PDU]"
"565","24.519394","217.23.15.220","172.16.2.139","TCP","1322","80  >  49274 [ACK] Seq=6662 Ack=256 Win=15680 Len=1268 [TCP segment of a reassembled PDU]"
"566","24.519550","217.23.15.220","172.16.2.139","TCP","1322","80  >  49274 [ACK] Seq=7930 Ack=256 Win=15680 Len=1268 [TCP segment of a reassembled PDU]"
"567","24.519598","217.23.15.220","172.16.2.139","TCP","1322","80  >  49274 [ACK] Seq=9198 Ack=256 Win=15680 Len=1268 [TCP segment of a reassembled PDU]"
"568","24.531847","172.16.2.139","217.23.15.220","TCP","54","49274  >  80 [ACK] Seq=256 Ack=6662 Win=16384 Len=0"
"569","24.531922","172.16.2.139","217.23.15.220","TCP","54","49274  >  80 [ACK] Seq=256 Ack=9198 Win=16384 Len=0"
"570","24.624646","217.23.15.220","172.16.2.139","TCP","1322","80  >  49274 [ACK] Seq=10466 Ack=256 Win=15680 Len=1268 [TCP segment of a reassembled PDU]"
"571","24.624706","217.23.15.220","172.16.2.139","TCP","1322","80  >  49274 [PSH, ACK] Seq=11734 Ack=256 Win=15680 Len=1268 [TCP segment of a reassembled PDU]"
"572","24.624749","217.23.15.220","172.16.2.139","TCP","1322","80  >  49274 [ACK] Seq=13002 Ack=256 Win=15680 Len=1268 [TCP segment of a reassembled PDU]"
"573","24.624910","217.23.15.220","172.16.2.139","TCP","1322","80  >  49274 [ACK] Seq=14270 Ack=256 Win=15680 Len=1268 [TCP segment of a reassembled PDU]"
"574","24.625084","217.23.15.220","172.16.2.139","TCP","1322","80  >  49274 [ACK] Seq=15538 Ack=256 Win=15680 Len=1268 [TCP segment of a reassembled PDU]"
"575","24.625096","217.23.15.220","172.16.2.139","TCP","1322","80  >  49274 [ACK] Seq=16806 Ack=256 Win=15680 Len=1268 [TCP segment of a reassembled PDU]"
"576","24.625258","217.23.15.220","172.16.2.139","TCP","1322","80  >  49274 [ACK] Seq=18074 Ack=256 Win=15680 Len=1268 [TCP segment of a reassembled PDU]"
"577","24.637795","172.16.2.139","217.23.15.220","TCP","54","49274  >  80 [ACK] Seq=256 Ack=11734 Win=16384 Len=0"
"578","24.637872","172.16.2.139","217.23.15.220","TCP","54","49274  >  80 [ACK] Seq=256 Ack=14270 Win=16384 Len=0"
"579","24.637928","172.16.2.139","217.23.15.220","TCP","54","49274  >  80 [ACK] Seq=256 Ack=16806 Win=16384 Len=0"
"580","24.637983","172.16.2.139","217.23.15.220","TCP","54","49274  >  80 [ACK] Seq=256 Ack=19342 Win=13824 Len=0"
"581","24.664466","217.23.15.220","172.16.2.139","TCP","1322","80  >  49274 [ACK] Seq=19342 Ack=256 Win=15680 Len=1268 [TCP segment of a reassembled PDU]"
"582","24.664531","217.23.15.220","172.16.2.139","TCP","1322","80  >  49274 [PSH, ACK] Seq=20610 Ack=256 Win=15680 Len=1268 [TCP segment of a reassembled PDU]"
"583","24.664573","217.23.15.220","172.16.2.139","TCP","1322","80  >  49274 [ACK] Seq=21878 Ack=256 Win=15680 Len=1268 [TCP segment of a reassembled PDU]"
"584","24.664756","217.23.15.220","172.16.2.139","TCP","1322","80  >  49274 [ACK] Seq=23146 Ack=256 Win=15680 Len=1268 [TCP segment of a reassembled PDU]"
"585","24.677353","172.16.2.139","217.23.15.220","TCP","54","49274  >  80 [ACK] Seq=256 Ack=21878 Win=11264 Len=0"
"586","24.677421","172.16.2.139","217.23.15.220","TCP","54","49274  >  80 [ACK] Seq=256 Ack=24414 Win=8704 Len=0"
"587","24.770735","217.23.15.220","172.16.2.139","TCP","1322","80  >  49274 [ACK] Seq=24414 Ack=256 Win=15680 Len=1268 [TCP segment of a reassembled PDU]"
"588","24.770796","217.23.15.220","172.16.2.139","TCP","1322","80  >  49274 [PSH, ACK] Seq=25682 Ack=256 Win=15680 Len=1268 [TCP segment of a reassembled PDU]"
"589","24.770858","217.23.15.220","172.16.2.139","TCP","1322","80  >  49274 [ACK] Seq=26950 Ack=256 Win=15680 Len=1268 [TCP segment of a reassembled PDU]"
"590","24.771022","217.23.15.220","172.16.2.139","TCP","1322","80  >  49274 [ACK] Seq=28218 Ack=256 Win=15680 Len=1268 [TCP segment of a reassembled PDU]"
"591","24.771198","217.23.15.220","172.16.2.139","TCP","1322","80  >  49274 [ACK] Seq=29486 Ack=256 Win=15680 Len=1268 [TCP segment of a reassembled PDU]"
"592","24.771209","217.23.15.220","172.16.2.139","TCP","1322","HTTP/1.1 200 OK  [TCP segment of a reassembled PDU]"
"593","24.783643","172.16.2.139","217.23.15.220","TCP","54","49274  >  80 [ACK] Seq=256 Ack=26950 Win=6144 Len=0"
"594","24.783713","172.16.2.139","217.23.15.220","TCP","54","49274  >  80 [ACK] Seq=256 Ack=29486 Win=3584 Len=0"
"595","24.783771","172.16.2.139","217.23.15.220","TCP","54","49274  >  80 [ACK] Seq=256 Ack=32022 Win=1024 Len=0"
"596","25.022375","172.16.2.139","217.23.15.220","TCP","54","49258  >  80 [RST, ACK] Seq=854 Ack=941 Win=0 Len=0"
"597","25.022474","172.16.2.139","217.23.15.220","TCP","54","49274  >  80 [RST, ACK] Seq=256 Ack=32022 Win=0 Len=0"
"598","43.686534","172.16.2.139","23.218.156.83","HTTP","1036","GET /images/favicon.ico HTTP/1.1 "
"599","43.731860","23.218.156.83","172.16.2.139","TCP","60","80  >  49188 [ACK] Seq=9105 Ack=2585 Win=19932 Len=0"
"600","43.778013","23.218.156.83","172.16.2.139","TCP","1322","80  >  49188 [ACK] Seq=9105 Ack=2585 Win=19932 Len=1268 [TCP segment of a reassembled PDU]"
"601","43.778039","23.218.156.83","172.16.2.139","HTTP","455","HTTP/1.1 200 OK  (image/x-icon)"
"602","43.789851","172.16.2.139","23.218.156.83","TCP","54","49188  >  80 [ACK] Seq=2585 Ack=10774 Win=16484 Len=0"
"603","49.845277","172.16.2.139","217.23.15.220","TCP","54","49229  >  80 [RST, ACK] Seq=538 Ack=285 Win=0 Len=0"
"604","49.845327","172.16.2.139","217.23.15.220","TCP","54","49225  >  80 [RST, ACK] Seq=2039 Ack=7306 Win=0 Len=0"
"605","73.914876","172.16.2.139","23.218.156.83","TCP","54","49186  >  80 [RST, ACK] Seq=2909 Ack=28808 Win=0 Len=0"
"606","108.859357","172.16.2.139","23.218.156.83","TCP","54","49188  >  80 [RST, ACK] Seq=2585 Ack=10774 Win=0 Len=0"
